,Tweet,Scores
1787,rakyatmelek rezaboy gerindra qc caya kpu caya rc caya kpps tinggal kecapean caya,-1.0
1789,kpuri laporin org gk karuan hujat kpu sdh lelah,-1.0
1791,tunduk sedikit salah jelas pemilu gagal bacot tugas kpu,-1.0
1792,kpu beri santun keluarga kpps tinggal tangsel,-1.0
1794,angka us tahan sore s,-1.0
1796,ditemu ribu salah input situng kpu kubu sangat brutal,-1.0
1797,orangberiman kpuid paling ngeles nunggu hutang cair pake dana haji dulu,-1.0
1803,dani yangfaqir dahnilanzar kpuid main bola curangi nangis lgi lu curangi udh keluar,-1.0
1804,fadlizon kalau niat curang logiya kpu bkalan mengklarifksi salah,-1.0
1807,ketua kpu tepis isu c aspal,-1.0
1808,kpuid masabudiman viryanazis masws novidaevi hsymasyari pramonoutan ksetyawan salah entry gag,-1.0
1809,gerak rakyat anti pemilu curang desak kpu gelar audit forensik it,-1.0
1811,abiyyu putraerlangga kpuid cakkhum bangpino putrabanten maulanatigor mbahuyok bunuh diri,-1.0
1812,cnnindonesia cebong kpu curang,-1.0
1814,kpuid doa tindas mustajabah lihat siapa bagaimana tindas tsb,-1.0
1815,depan hotel semeru bogor org ragam polisi ungut kotak tulis kpu allah takdir jatuh d,-1.0
1816,bogabogas republikaonline hebat apanya aplikasi situng kpu sengaja diseting utk tdk proteksi salah input,-1.0
1818,antaranews mulai salah arah aktifis juang utk tegaknya daulat rakyat utuh shg hrs l,-1.0
1821,bawa bukti ribu lebih salah input relawan it bpn desak bawaslu henti situng kpu,-1.0
1822,salah disebut salah input turut pakar it universitas airlangga soegianto soelistiono,-1.0
1826,fahrihamzah dilaku dpr ri pemilu rentak kali korban kecuranga,-1.0
1827,kpuid hoax tpi real no tipu benar kata ni anak lemah situsnya tahu curangcurengnya,-1.0
1829,report banding proses situng kpu vs kp level provinsi report,-1.0
1830,anehdan strategi mulai buah hasilsetelah simak tgl aprilbila meraka ang curang,-1.0
1831,hnurwahid kpuid kira siapa tadz sisip c palsu,-1.0
1835,mas ganibna kpuid pramonoutan maaf kalau konteksnya keliru input belas ribu tps scan c keliru in,-1.0
1836,dilanggar sumpah janji dilantik jadi kpps kema sumpah bagaiman,-1.0
1837,ruang situng kpu jorok cermin amburadul hasilnya jauh dibanding kerapihan warnet,-1.0
1845,bertemanm duri daging alas lama putus resmi kpu kedatang,-1.0
1846,garuda kpuid ronnierusli msaiddidu albertpanjaitn advokatbs guruplato doradong fahrihamzah akuntofa togel tolol gel,-1.0
1848,kpuid tunduk uu mana uu pwmbenaran salah input berxx tunduk uu team b,-1.0
1849,ribut rusuh dikarena ketidak adilan curang dilaku kpucoba kal,-1.0
1851,alhamdulillah susup lacak kata pakar itb intruder situng kpu intruder fungsi men,-1.0
1853,jangan main suara rakyat alas salah input ulang ulang segampang minta maaf kpu b,-1.0
1854,mberjag ronnierusli kpuid kursus lu dulu dungu ngapain lu tanya org maya ka,-1.0
1856,prof ang disingapure ad aqua yakok hilang konsentrasi kebawa aura kpu jadi,-1.0
1857,bpn prabowo serah bukti duga curang situng kpu bawaslu,-1.0
1858,akhir bpn prabowosandi buka rahasia curang hasil input data kpuid banyak kemar,-1.0
1860,acungsurajaya ganti presiden tutup siapapun pilih suara rakyat kata mar,-1.0
1863,ratus ribu curang input data kpu belah pihak kontestan salah satu kontestan,-1.0
1864,republikaonline sehebat apapun tekhnologipasti kurang kesalahanbaik tekhnologi sendiri,-1.0
1865,kpu tidur om,-1.0
1866,kpuid masabudiman viryanazis masws novidaevi hsymasyari pramonoutan ksetyawan klo becus menyele,-1.0
1868,cnnindonesia tinggal waktu sama san org ang ajal paksa bangat keliatannya ma,-1.0
1869,doradong masabudiman kpuid kulitnya udah tebal bebal urat malu udah koslet ha,-1.0
1870,kpuid masabudiman masws viryanazis hsymasyari novidaevi pramonoutan ksetyawan najis,-1.0
1875,kingtukijan sayembara buat dirinya sendiri dungu akut munafikun beri curang brutal s,-1.0
1878,mardani  april haram diri iak ganti presiden,-1.0
1881,fdja desak bawaslu kpu sentra gakkumdu dialog kait money politic pemilu,-1.0
1882,cara kerja kpu kecil prabohong bongkar cara main sungguh ngeri,-1.0
1884,cobeh klo kpu pusat tigl tunggu azab sj,-1.0
1888,data kpu salah entri data situngpemilu,-1.0
1889,loembok selesai khawatir akibat belas ribu human error salah entry data situng kpu sekarang namba,-1.0
1892,oknum kpu salah input data diancam tahun penjara denda juta kpu cukup minta maaf sangsi uu,-1.0
1894,catat kpu salah entri data situng pemilu,-1.0
1895,tryhardthenfail banyak korban curang lg dosa kalian sungguh besaaar kpuid,-1.0
1896,ngeri x situng kpuid id suara bkn makin turun makin lecit padahal inout an sdh,-1.0
1897,kpuid it kpu diaudit forensik salah input us us,-1.0
1900,selisih suara jumat mei kpu tps kp tps,-1.0
1901,oppositelinks kpuid bawasluri aneh yaa jateng kota maju tps salah jadi mikir benar maju,-1.0
1902,fadlizon kalau datangin kpu lantas org kpu takut gtu liat justru mungkin org kpu tawa,-1.0
1903,aldhikun ronnierusli kpuid gaya cebong bloon awal ngegas dungu dunguin gilir dikasih ngeles,-1.0
1904,kpu beber catat salah tugas entri data formulir c salin hasil pemungutan suara tingka,-1.0
1905,fajarnugros andiarief dasar quick count kpu sama lembaga survey sihcuma katanya kpu curang lembaga,-1.0
1907,tangassa rekidatuak situng kpu jangan harapin kiamat segitu gitu udah seting utk curang gw,-1.0
1913,syarman bawasluri kpuid curang ko angan punya etika malungumpet woiii curang menyaki,-1.0
1916,relawan it prabowo lapor salah input situng kpu bawaslu,-1.0
1917,powerofreceh cakkhum kpuid d jawab jangan bengong cc bawasluri,-1.0
1919,bpn prabowo lapor salah input kpu situng bawaslu,-1.0
1921,besok sy beber data salah satu tim bpnrelawanpendukung prabowo katanya temu salah situng kpuid amp,-1.0
1925,hukumdan wakakakapantesan blg kpu tsm curangnyangitung presiden keberapa ngawur doi,-1.0
1927,ngetwit jangan kpu salah input,-1.0
1928,ketua kpu tkn jokowi tuju bentuk tpf curang curang struktur sistemastis massif,-1.0
1929,kpuid masabudiman viryanazis masws novidaevi hsymasyari pramonoutan ksetyawan dosa,-1.0
1930,lebih berat mana tugas kpps kpu pusat kkps tinggal kpu pusat,-1.0
1931,kepala negara negarawan salah lembaga negara kpu alam krisis caya pemilu lem,-1.0
1935,kingpurwa pemilu kpuid congorlu jatuh lu ndre,-1.0
1936,antaranews modelnya beri pura pura beri dikasih bukti gimana kpuid,-1.0
1940,kpu tugas kpps tinggal dunia jadi,-1.0
1942,masifaturohmi glrhn zoelfick real count kpu selisih lebih suara curang impossible angk,-1.0
1946,syarman bawasluri kpuid curang ko sampe lupa angka aslinya,-1.0
1947,maya sohiban sama kpu masanyebut urut presiden medti curang,-1.0
1949,heran lihat kpuid sekarang tgl april sd sekarang masyarakat protes lapor salah input an,-1.0
1951,ferrykoto karniilyas prabowo ilctv waahh nyata bapak lompat pagar kpuid,-1.0
1952,kpu kubu prabowo lapor lembaga survey rilis quick count pilpres,-1.0
1953,fadlizon banyaknya langgar kpu,-1.0
1955,oppositelinks akuntofa tantang bukti curang tsm minimal suara nasiona,-1.0
1956,abdulrachim panca kpuid bu human error udah masuk tindak kriminal palsu data c,-1.0
1959,gaes kmrn katanya salah entry data jd dukung tdk salah yo twitt kpu jg sdh umumin hasilny,-1.0
1960,hnurwahid kpuid sedih lihat tweet digital catat u wahai pakai peci malu,-1.0
1961,whizid kpuid kasus namanya langgar pemilu langgar konstitusi makar,-1.0
1962,arya stark tusuk pisau pramuya badan the night kingkok ad aj mancing bahas kampret amp ceb,-1.0
1965,jadi salah input data situng kpu sebesar sen total tps diinput,-1.0
1966,pakpri komplek mega mai mana suaranya salah input kpu tps lurah padang sarai komplek mega,-1.0
1968,acehasan pusing kayanya tiap hari liat tv ttg hitung hsl pemilu prabowo kalahudh tolak qc hsl kpu,-1.0
1969,lisaamartatara chocostrwbrry kpuid bagus warnet drpd server kpuid kemarin jadi jangan menyamaka,-1.0
1970,kingtukijan sayembara buat dirinya sendiri dungu akut munafikun beri curang brutal bi,-1.0
1971,fitriee habibahnoeri hnurwahid kpuid mana lapor kasi berkas lapor pingin ajahahaha,-1.0
1973,fahrihamzah katanya udah amp menang stress emang kurang waras duo fh ba sam,-1.0
1975,pakar itb intruder situng kpu intruder fungsi ubah data disesuai hasil quick cou,-1.0
1976,etikamalasari kpuid masabudiman viryanazis masws novidaevi hsymasyari pramonoutan ksetyawan mungkin pake aplikasi packman,-1.0
1977,hnurwahid kpuid maaf ustadz jelang ramadhan alangkah sejuknya ustadz hnw jenak tinggal nafsu politi,-1.0
1978,kalau jumlahnya bu salah input namanya salah niat ketua kpuid,-1.0
1979,entah maksud tofa kawannya lempar tuduh pemilu curang dasar temu keliru input situng,-1.0
1980,relawanprosandi kpuid masabudiman dukung prabowo lucu dikit ozab azab ozab azab sdh trserah kalian s,-1.0
1982,doncorleone kpuid curang cerdas jadi punya malu,-1.0
1983,salah sebut jangan kunjung kpuid,-1.0
1986,detikcom ngapain kpu bunya lg nungguin baliho cilengsi nurunin,-1.0
1987,coba dibantah curang bpn bawa bukti tanya posisikapasitas skrng seb,-1.0
1990,powerofreceh parah brutal kpuid bawasluri,-1.0
1991,jangan salah jogja kalau ang romantis jangan salah kopi kalau ang enak jangan salah senja ka,-1.0
1992,dibilangin jangan maen ma kpu gag ngitungmasih maenhmmmm,-1.0
1994,tofa serah datanya dlm bentuk cetak zaman digital menstinya i dlm bentuk softcopy sj,-1.0
1995,byn titis pusatsemua balik kpuid kn gtubangsat,-1.0
1997,update salah input data situng kpu  mei ikut rincian salah,-1.0
1999,hnurwahid kpuid rampok amanah rakyat srti inihukumnya tads,-1.0
2001,kpuid bilang jangan caya hoax anjur tug bohong curang caya,-1.0
2002,rekapitulasi suara kpu sragen dijadwal mundur,-1.0
2006,null bpn lapor kpu lembaga survei bawaslu lampir buktibukti da,-1.0
2007,situng webb kpu dasar scan c aspal satu pleno tesmi tekap itulasi hitung nanual kpu dasar c otent,-1.0
2009,kpuid katanya tuan tunduk data c selalu selalu salah imput dg babi buta tiap hari da,-1.0
2012,rekrut anggota kpps kesan dadak kurang pembe,-1.0
2014,curiga curang rizal ramli minta sistem it kpu diaudit,-1.0
2015,bawa bukti lebih salah relawan it bpn desak bawaslu henti situngkpu,-1.0
2017,noerazahra larasatti fadlizon post kpuid bawasluri dprri narasi dibangun sandainya situng d,-1.0
2018,bisniscom kpu jdi antek jokowi keparat jahanam benih pki,-1.0
2019,mberjag ronnierusli kpuid bloon dungu siapa bu org nanya org tepat dungu,-1.0
2022,rockygerung mas bro jangan teduh uskita awasi kpubersama judilayokamu,-1.0
2023,maulana kpuid salah input jadi t,-1.0
2024,tunduk kpd ayat suci kpd lbh tunduk kpd konstitusidr samina wa athana dgn ulama kpd y,-1.0
2026,kpu an org tinggal gara hitung suara rakyat brp org korban ditaruh,-1.0
2028,mberjag ronnierusli kpuid yah dungu udh lu pda nanya sma org malah makin dungu,-1.0
2030,hnurwahid kpuid sangat ganggu dg cara tulis m human error tanda petik sinis,-1.0
2031,kpu putus tunggu komando hrs,-1.0
2032,hidayat angelone priyobudis kpuid kpkri audit kpuid penghianat rakyat bangsa,-1.0
2033,reftywf kpuid kpu keparat jahanam benih pki setankau m uang rakyat tpi kau curang dasar benih pki smua kalian kpu dajjal,-1.0
2034,kingpurwa pemilu kpuid congorlu jatuh lu ndre,-1.0
2039,lieus sungkharisma tangkap ketua kpu arief budiman,-1.0
2040,evalockheart guruplato maklum efek kunjung kpu jd salah input presiden,-1.0
2041,kpuid masabudiman viryanazis masws novidaevi hsymasyari pramonoutan ksetyawan g caya tolol,-1.0
2042,fadlizon gerindra tribunnews henti situng audit it kpu bangkl jujur tolak wajar dong kl malah curiga,-1.0
2043,beberapa berita jadi dasar naiknya tagar investigasi seluruh,-1.0
2044,nyata kpu cebonk gampang nular sby sampe kena salah input,-1.0
2045,republikaonline human error letak keyboard c sistemis kpuid,-1.0
2046,kpu kota malang mulai rekapitulasi suara camat blimbing beres,-1.0
2049,kpuid kalian jngan bodohi rakyatkalian sdah nyata tunduk sma penguasamau dalih apapunrakyat,-1.0
2052,kpu bawaslu minta bukti tuding suai praduga kpu belit dibukti,-1.0
2056,aldhikun ronnierusli kpuid cara bloon ngeles gini,-1.0
2058,tinggal gmna kpuid kurang waktu a,-1.0
2059,datuakpanduko pariaman strees gila toolong kpu,-1.0
2060,loembok selesai khawatir akibat belas ribu human error salah entry data situng kpu sekara,-1.0
2062,tempodotco fadlizon ikuti pleno kpu salah input jangan digoreng us awas hangus,-1.0
2063,ronavioleta divhumaspolri negara apabila lapor malah lapor ditangkap punya niat baik p,-1.0
2064,kpuid tlg dibaiki input data tps kel kadu jaya curug tangerang provbanten tulis input,-1.0
2065,abiyyu mbahuyok kpuid cakkhum bangpino putrabanten maulanatigor mgkn lupa shgg jadi,-1.0
2066,waduh serius bukti,-1.0
2067,mberjag ronnierusli kpuid gw lu udh nanya dungu ngerti maksud gw dungu,-1.0
2069,us usaha ber doa tiap sujud ingsalloh prabowo sandiuno jadi leader indonesia jangan d,-1.0
2070,bpn lapor kpu lembaga survei bawaslu,-1.0
2071,dodylucas akuntofa srg prof mengatakn kesalahn input kpu nyata,-1.0
2072,drhluck prabowo kalau selenggara pemilu kpu kpud curang bawaslu kalau kou,-1.0
2073,ayoo kpuid msh dalih salah entry kg paslon trus ditambah lipat disunat,-1.0
2075,kpuid klw kpuid tunduk uu tdk pidana oknum salah input situng tdk lampir c diduga c tdk asli temu,-1.0
2077,kpu tegas niat curang input data c fahri niat enggak usah dibela jawab,-1.0
2078,hasil curang kpu menang curang bahaya negara,-1.0
2079,mberjag ronnierusli kpuid gw lu udh nanya dungu ngerti dungu,-1.0
2081,yaa allah segeralah azabmu oknum laku curang kpuid ht,-1.0
2083,msaiddidu kpu ngeles,-1.0
2084,msaiddidu kpuid calon meni gagal senyumin,-1.0
2085,msaiddidu sampe temuin ketua kpu tempat sampah,-1.0
2086,kpu tolak usul henti situng,-1.0
2089,tadi udeh amprokin ame bpn yee awas ente ngeles kpuid bawasluri jangan ngigau mulu ngapa,-1.0
2090,imayadewi ireneviena kpuid salah input klau kali klilah berkali,-1.0
2091,kpu jjur kmi akur kpu curang kmi berang,-1.0
2092,oppositelinks kpuid mantapttp usutbiar se enak main input tutup kakieh tutup matagila oknum kpu,-1.0
2095,dilaku stress test it kpu input minal dikirim server induk shadow server karen,-1.0
2096,tvonenews alas pindah ibu kota alih isu kecuranga kpu,-1.0
2097,selesai khawatir akibat belas ribu human error salah entry data situng kpu sekarang nambah d,-1.0
2098,janggoputa karaengdillong ummiyasmine editektif prabowo sandiuno kpuid sakit kpuid dib,-1.0
2100,pantau proses input data situng kpu tugas dpr awas,-1.0
2101,kpuid masabudiman masws viryanazis hsymasyari novidaevi pramonoutan ksetyawan ngeri doanya ni utk kputakutlah,-1.0
2102,nyazizalsaggaf yennywahid mungkin krn ngitungnya pake kalkulator kpu,-1.0
2103,bawasluri tindak oknum susupi it kpu kalau khilaf salah input ratus amp tinda,-1.0
2104,kpu target verifikasi tugas pemilu wafat sakit selesai mei,-1.0
2106,abiyyu mbahuyok kpuid cakkhum bangpino putrabanten maulanatigor cebong mana ninggalin bangke dasar sampah,-1.0
2107,aneh kalah hitung sendiri menang sendiri ribut sendiri gila sendiri padahal kpu bawaslu pa,-1.0
2112,kpu lalu prematur sebut pemilu gagal,-1.0
2114,lisaamartatara kpuid nieh c palsu lolos sma kpu,-1.0
2116,bagaimana bawasluri dkppri gawat bnyk surat suara coblos setan kpuri tdk mnyelesaiknnya hrs m,-1.0
2117,pemilu kali beres situngnya beres rekap kabupaten beres otomatis hasilny,-1.0
2118,fahrihamzah c palsu knpa kpu lolos,-1.0
2119,dukung prabowo ntb minta kpuid diskualifikasi jokowimaruf desak bawaslu kpu putus,-1.0
2121,bu situng proses pembutan kotak suara masyarakat mulai duga tdk beres,-1.0
2123,geloraco rakyat pohon tindak curang kpu diskualifikasi junjung,-1.0
2124,aldhikun ronnierusli kpuid kalau petik arti te suruh kalimat har,-1.0
2125,data sumaa utara manipulasi kpu opposite,-1.0
2126,maspiyuuu kpuid salah sistemnya sampe kek gitu duhh,-1.0
2128,dylase rockygerung wah mulai tular mazhab math kpu,-1.0
2129,fahrihamzah c palsu knpa kpu lolos,-1.0
2130,hanshiday tular kpu,-1.0
2133,iyaorg kpu anak didiknya empud gurunya salah sebut eh anak didiknya salah input,-1.0
2135,nissakti bangor kpuid muak lihat muka,-1.0
2136,tolak narasi curang pmii gelar aksi dukung kpu bawaslu,-1.0
2137,kpuid kpuid lebih hoax dasar kpuid sampah masyarakat,-1.0
2139,fadlizon tribunnews gw rakyat gw caya kpu,-1.0
2142,hari bpn prabowosandi lapor kpu lembaga survei,-1.0
2143,powerofreceh edialong bawasluri kpuid bpn prabowo sandi bangkit bawa bukti lebih salah input situng kpu,-1.0
2144,efek situng kpu salah input ampe salah data prof,-1.0
2146,putrabanten kalau buat sayembara dungu ditagih duitnya dikasih uang ribu us,-1.0
2147,zon beri catat lemah situng kpu,-1.0
2149,hnurwahid kpuid bisamya salah anak tk,-1.0
2150,mantabb bawa bukti bawaslu tim it bpn lapor salah input situng kpu,-1.0
2151,banghas kpuid kpuid salah input dipakai buat framing,-1.0
2153,ketua kpu tepis isu c aspal,-1.0
2155,kpuid konsisten salah input salah input konsisten untung kpu konsisten salah,-1.0
2156,abanghumor kpuid gk dong ima ajkrn sblm nua audah byk identifikasi curang rupa slh infut data,-1.0
2159,kpuid masabudiman masws viryanazis hsymasyari novidaevi pramonoutan ksetyawan kpu curang,-1.0
2161,efek jadi jubir kpuid jadi tular salah input angka twitnya,-1.0
2162,haha udah fokus sama nasib tong gausah campuri pemilu dasar manusia munafik,-1.0
2163,kpu tolak usul henti situng,-1.0
2165,bpn prabowo serah bukti duga curang situng kpu bawaslu duga h,-1.0
2166,helmifelis novriyantoyanto khawatir lbh bs jg ancam duhjd inget mantan ketua kpu tinggal astaghfirullah,-1.0
2167,lama ketua kpu dicopot rakyat adudomba dukung amp antisipasi bapak,-1.0
2168,relawan prabowosandi lapor duga salah input data situng kpu bawaslu,-1.0
2171,gerindra dikasus situng kpu ribu insiden hingga pukul minta dibukti cebong dungu akut,-1.0
2172,newzepret kpuid bawasluri disana sini rakyat gerak cara naturallambat laun bara menjad,-1.0
2173,efek sering ngopi bareng kpuid salah inputnya tular,-1.0
2174,maspiyuuu kpuid kpuid nambah kali hitunh yah tim bpn lapor,-1.0
2175,mberjag ronnierusli kpuid udh salah malah nanya dungu,-1.0
2178,stop ditunggu kpu,-1.0
2180,salah woy sby presiden riweleh weleh pud pud salah hitung kpu,-1.0
2181,kpuid udahlah ibu dikpu main dgn suara rakyat mmg kasihan curangyg laknat raky,-1.0
2184,kata kpu hnya klo angka bpn benar komisioner kpu human error sengaja tuk kecil me,-1.0
2187,innayaputri masrudihz faridsdin bertemanm manuver politik paling absurd pesta demokrasi,-1.0
2188,bertemanm salah input tular kpuid,-1.0
2193,kpuid hoax haox hoax haoxayolah konfrontasi langsung sama bocahnyaberani,-1.0
2194,zarazettirazr duga kpu sengaja banyak salah situng sidang mk tkn kata habis,-1.0
2195,janwarbarus powerofreceh bawasluri kpuid gimana kesal duit dipake buat hambur oknum b,-1.0
2197,gundidr adilmer back handnya kpu salah input,-1.0
2200,mantap ketua dpr bongkar kecurngan kpu jokowi dpr rakyat tuntut kalian youtube,-1.0
2202,prof mahfud spt tular kalkulator kpu sby jadi presiden ri,-1.0
2205,aburizalbakrie sulkhannoor kalau masalah ribu salah input data kpuid intah gosah lalu serius gitu kira,-1.0
2207,ibnusonny kek kpu salah input,-1.0
2211,ratuanissah bawasluri kpuid situng framing salah dibawa mk tetap ha,-1.0
2212,iih emangnya negri gitu prof kalimat gaduh kpu bawaslu kasi bi,-1.0
2214,papua senjata akhir jlh suara provinsi gagal menang jkw sebabnya input kpuid u,-1.0
2215,kpuid masabudiman masws viryanazis hsymasyari novidaevi pramonoutan ksetyawan stlah salah entry sa,-1.0
2216,mohammadmakruf kpuid bawasluri pilkada dki pilpres ajar betapa hoax paling konyol pu,-1.0
2218,kpuid cara buka situs kpu luar negeri gmn,-1.0
2219,m mana m tim it bpn temu salah entry data kpu duga curang banyak,-1.0
2220,aldhikun ronnierusli kpuid baca pelan pelan bloon ronnierusli tdk nyata kpu pakai procie xeon w,-1.0
2221,efek main main kpu jadi ikut salah input harusnya presiden jadi,-1.0
2222,dhanihendy kpuid bawasluri kawalpemilu onnowpurbo sandiuno prabowo pemilu berbiaya mahal,-1.0
2223,ardiriau tular kpu,-1.0
2225,achsyuja kpuid estiningsihdwi kpuid besok jangan nyalon jd anggota kpu jadi tug sunat masal,-1.0
2226,hancur kpu wakakakaka,-1.0
2229,salah input situng kpu bpn salah sangat brutal,-1.0
2231,cakkhum andrerosiade kpupadang komplek mega mai mana suaranya salah input kpu tps lurah p,-1.0
2232,tunduk sama ormasnya doang bkin gaduh atas nama umat islam klaim ngawor umat islam ma,-1.0
2237,imayadewi ireneviena kpuid struktur masif brutal,-1.0
2238,ireneviena cerita film alm mas dono cocok buat kpu sekarang isinya maju mati mundur modar tempat sembunyiskakmat,-1.0
2240,kebabturkey parah nich kpuid,-1.0
2241,kpuid masabudiman masws viryanazis hsymasyari novidaevi pramonoutan ksetyawan salah entri berjamaah otak kardus,-1.0
2246,adraantau kpuid masabudiman y lapor atuhh curangvideolaporeh lapor ditangkap krna video hoax hi hi hi,-1.0
2250,salah input prof jangan nirukpu dong prof nyunat,-1.0
2251,duh kalang aktifis tuntut situng kpu ditutup pidana komis lewat youtube,-1.0
2253,kpuid masabudiman masws viryanazis hsymasyari novidaevi pramonoutan ksetyawan kalian curang,-1.0
2254,ayaniulva bawasluri kpu vs pln kpu meng input digit pln meng input puluh digit lebih akurat pln karen,-1.0
2256,msaiddidu dipikir lama ngenes qc tdk caya rc kpu tdk caya kpu bawaslu tdk caya,-1.0
2257,semenjak prof bela situng kpu jadi ikut salah input data sby presiden ri,-1.0
2258,pantau ruang server kpu lama jam secarabergantian,-1.0
2262,rada bingung bila kpu dalih situng hanyalah sekedar informasi dlm merespon kasus salah input sama en,-1.0
2263,saltlander ustadtengkuzul suryawadi kpuid ngaku ustad ustad hobi y maki ngomong kotor pntas ny disebut,-1.0
2264,rini bong cek pengen menang main curang cek kata curang amp brutal klo kamu waras,-1.0
2265,update real count kpu jumat mei pukul jokowi vs prabowo selisih jutasuara,-1.0
2266,salah input situng kpu capai kali  jumat mei inirinciannya,-1.0
2267,kpuid maling curi mangga tetangganya sang milik lapor kepala tangkap simaling dalih,-1.0
2268,mungkin hadir ijtimak beri contoh lapor curang bawaslu kali bawa bukti awalnya,-1.0
2271,kpuid masabudiman masws viryanazis hsymasyari novidaevi pramonoutan ksetyawan kpuid dlm bayang,-1.0
2272,doradong adakah berani ngefloading ip intruder rame fload ip intruder hari web kpu down binggo,-1.0
2274,bertemanm tular kpu jenderal,-1.0
2278,pnjljh cangkem rusaknalar anjlogsuya gaduh bukti curang kpu merek,-1.0
2280,madiaktivis sama dus bangga eh dasar tolol kpuid,-1.0
2281,midahhamid curang salah entry dibaiki janganlah keruh suasana bel,-1.0
2283,ustadtengkuzul rianabdipanges suryawadi kpuid zul mulut sampah ustad katany sungguh manusia munafik,-1.0
2284,amiruddinmusaam ustadtengkuzul simpul salah tanggap twit ttg metode bayar gaji gawai cara o,-1.0
2285,anaksingkong powerofreceh bawasluri kpuid opini publik penting jk bukti bukti sdh ditangan,-1.0
2288,madiaktivis ketua kpu otaknya sempit,-1.0
2292,akibat pemilu rentak,-1.0
2294,human error human honor ingat audit baik dunia akhirat kpuid,-1.0
2297,landasanutama zarazettirazr kpuid maling ditakuttakutin ginian pan,-1.0
2298,putus mk jumlah tps tp koq kpuid tps lantas tps selisih tps gimana ceritanya mang a,-1.0
2299,lisaamartatara kpuid situng kpu sdh prabowo gk bs nyalip lg amp bpn gk bs bukti curang,-1.0
2300,bentuk tpfk tim cari fakta curang pemilu bawaslu amp bpn prabowo siap kpu amp tkn jokowi siap malin,-1.0
2304,paslon tambah suara kpu lamtim akui salah input,-1.0
2305,onnowpurbo msaiddidu kpuid kalau bohong puasa lu diima kpuid malu loser,-1.0
2309,janwarbarus powerofreceh bawasluri kpuid geram ribu tps dibiar saksi,-1.0
2310,kpuid masabudiman masws viryanazis hsymasyari novidaevi pramonoutan ksetyawan jangan katarak dong,-1.0
2311,pedjoeangislam kpuid udah d bukti otak auto goblok cerna pedjoeangislam,-1.0
2313,gus aam tantang kpu sumpah mubahalah bukti curang kpuid siap menerim,-1.0
2315,vivacoid rampok sama garong saling puji anjing babi sedang salak romy angota kpu kelompok sama,-1.0
2317,watch berkas pemilu tong sampah kpu bobrok curang marak rakyat ribut on youtube,-1.0
2320,kpuid undangundang brapa kali salah input wajar fergussooo,-1.0
2321,tsamaradki ireneviena kpuid mungkin doi lelah scroll bawah eee kete,-1.0
2323,msapunya heriawanadiwan kpuid bawasluri kecuarangan sama parah dg edar narkoba orisme,-1.0
2324,subhanxyz cakkhum arlexwu kpuid rbaiki jangan salah input,-1.0
2327,update real qount kpu hari tgl mei pukul,-1.0
2332,gemes bahas sitang situng kpu minta pemilu ulang ngomong udah nah jadi anggota kpps s,-1.0
2333,wikagroup nsusan zarafaul libra kpuid wr fagtng bangzul ane muslim benci ulama,-1.0
2336,mediaindonesia mana sanggup kritis kpu biasa maen mobleg pasthi males buka situng,-1.0
2337,pesuruhpartai ireneviena kata trima apapun hasil hitung kpu kalau curang sprti,-1.0
2338,mediaindonesia kecewa pake kutang kali lu lu dukung rezim gk papa tp buka mata lebarlebar petug,-1.0
2339,msapunya kpuid bawasluri curang zalim kena azab allah,-1.0
2341,makin ketara curang mu kpuid,-1.0
2342,tonton selesai jumpa s ditor bawaslu sama tim prabowosandi atas lapor duga curang sa,-1.0
2344,msapunya mdifiga kpuid bawasluri moga d proses kalau tdk saatnya rakyat sikap,-1.0
2345,kpuid masabudiman masws viryanazis hsymasyari novidaevi pramonoutan ksetyawan salah entri ngeles,-1.0
2346,iyaorg kpu anak didiknya empud gurunya salah sebut eh anak didiknya salah input,-1.0
2352,dhanihendy kpuid bawasluri kawalpemilu onnowpurbo sandiuno prabowo bu salah input fraud,-1.0
2353,wajahmuslim malah main nuduh bgtu jangan jd provokator dong emng situ jd pimpin mo,-1.0
2354,pantau ruang server kpu lama jam cara ganti,-1.0
2355,briptu randu tinggal celaka usai aman pleno kpu sumsel briptu randu,-1.0
2359,pesuruhpartai imayadewi ireneviena alih isu fokus situng kpu mrk,-1.0
2363,kebabturkey vinergee korban berjatuhankarna curang bodoh kpu menginput data,-1.0
2364,what puluh ribu resmi bpn lapor data salah input situng kpu bawaslu,-1.0
2365,ahmadyani powerofreceh bawasluri kpuid bpn bu bodoh direncana,-1.0
2366,doncorleone bangpino kpuid udah putus urat malunya kpu,-1.0
2375,lonehero yudi moga masalahnya input kpu kacau banyak pindaian kosong amp sedia,-1.0
