,Tweet,Scores
608,salah input suara disengaja anggota kpu ancam penjara,-1.0
610,seneng ket kpu c arif budimanyg tiada arifnya dlm hidupnyaakhlak suai na,-1.0
612,powerofreceh bangpino akibat hoaxnya surat suara kontainerada c dimanipulasisurat suara ot,-1.0
615,helmifelis zarazettirazr kpuid iya padahal ramadhan justru setan dibelenggu jadi manusia ma,-1.0
616,republikaonline system error human error manajemen error kpu error dibukti maya audit jangan ditolak,-1.0
618,prof ente uda kena visa input data kpu korupsi angka presiden ente tulis uda koplak,-1.0
622,kpuid bawasluri fahrihamzah curang kpu dosa nuduh curang dosa dong,-1.0
623,kpuid us juang bapak tdk usah hirau stres berat,-1.0
625,hnurwahid maspolo kpuid berapa ribu lembar c palsu hnurwahid buatlah rakyat cerdas data n angka jang,-1.0
629,anak kelas bobol situs kpu pemilu hoax hatihati jadi sebut tahun we,-1.0
630,oppositelinks kpuid bawasluri monggo bukti,-1.0
634,kpuid bingung bagaimana caranya tahan curang,-1.0
635,tolak narasi curang,-1.0
637,mikir mlambat gimana mubahalah diganti sama maafan curang so,-1.0
638,dahsyat tim it prabowo lapor salah input bawaslu buktibukti tunjuk kpuid tindak sang,-1.0
639,pemilu paling buruk panjang sejarah bu titieksoeharto tegas pemilu l,-1.0
640,dhanihendy kpuid bawasluri kawalpemilu onnowpurbo sandiuno prabowo goblok,-1.0
642,salah sistem situng kpu lu tindak pidana la,-1.0
643,zarafaul nsusan libra kpuid wr fagtng bangzul sarpakenaka pantunjp ariantobulolo dasar,-1.0
646,situng kpu disusupi c palsu suara jokowi medan naik tambah karaknya palsu zalim arogan korup ingkar,-1.0
649,hamdanijuni ustadtengkuzul ngebet boneka pengen menang kpu ngeluarin putus,-1.0
650,tular sakit genetik kpuid nehpenyakit salah inputcebongers forever,-1.0
651,tsamaradki kpuid awal hancur kpu,-1.0
652,anizhomt orangberiman kpuid uda kena visa input data kpu korup angka,-1.0
653,kpuid tunduk sama sogok bukti kerja benar curang tinggal pilih azab kalian,-1.0
659,akuntofa kpuid sedikit bocor,-1.0
661,kpuid caya lgi smaa kpubyak omongmulai kardus anti airkuat katay dluhadehskrg dblg hum,-1.0
663,orangberiman kpuid nanya jadi salah input sama curang hubung us bukti,-1.0
664,bocahndablex soepono hnurwahid kpuid ejek buat gubernur tug pototng pita msh sadar sindir,-1.0
665,duh gmna bpk ikutn kpu human error sby presiden,-1.0
666,ruang situng kpu jorok cermin amburadul hasilnya jauh dibanding kerapihan warnet,-1.0
670,harusnya seru pilpres jangan curang kpu jujur bahaya imialisme cina lewat obor jerat ut,-1.0
672,baguswisnuputra sabdapanditai relawanprosandi bawasluri kpuid curiga hoax muya tampak,-1.0
675,kpu depok salah input suara jokowi ditulis viva,-1.0
676,akuntofa innalillahiwainnahillahirojiun pemilu buruk pasca diri nkri ketua kpu,-1.0
677,vivacoid tuduh hadap kpu sangat kacau brutal judul preeet,-1.0
678,annasuezann syifaznisa gw malah mikirnya yah buat juang mati lahan dgn bentur ses,-1.0
679,abiyyu cakkhum kpuid bangpino putrabanten maulanatigor mbahuyok tanda takut tahu salah,-1.0
680,imayadewi kpuid salah mungkin komplot,-1.0
681,bocahndablex soepono hnurwahid kpuid baliho provokasi kampretotak kebalik,-1.0
682,alhamdulillah bukti curang pemilu presiden dilapor bawaslu mas mustofa na,-1.0
683,tspartan herrymety akuntofa bawasluri partaisocmed dkppri dkppri kpuid jimlyas jangan ba mas,-1.0
684,imayadewi kpuid jangan lupa anggota dpr didlmnya milik suara mayoritas dikubu siapa sama ha,-1.0
685,kapan kpuri us bodohi rakyat,-1.0
687,prof romli maklumat rizieq shihab duduki kpu tindak pidana,-1.0
691,hnurwahid padahal bunya foto c jg kpuid byk org bilang ratus korban panitia tinggal adlh,-1.0
692,tetap transparan kpu tolak hentisitung,-1.0
693,jahat curang pemilu mana hitung tetap lanjut kpu pusat jahat angin la,-1.0
694,tanyoana kena visa kpu hilang angka,-1.0
697,tugas kpu prof salah input us gile loe ndro,-1.0
698,ferrykoto prabowo kpuid curang jadi dirugi salah satu paslon kalau semua paslon j,-1.0
699,tindaklanjuti lapor bpn bawaslu sidang salah input data kpu,-1.0
700,revolusi jargon reformasi nurunin korban tinggal berapa pemilu t selenggara kpuid korba,-1.0
705,kpuid muak dg basa basi kaliankpuid,-1.0
708,duga syahganda situng kpu sengaja dibuat rentan manipulasi,-1.0
710,doncorleone kpuid edan bu malu malu soal etika hukum lolos dipengadil,-1.0
711,akuntofa kpu maling,-1.0
714,saifulghani maap g tadi twit dibajak hacker kpu,-1.0
716,minta bukti emang kpu lihat curang didepan mata bawa semua bukti ra,-1.0
717,rohmatsyukur evalezfr bawasluri kpuid msaiddidu akun beliau lenyap dilenyap,-1.0
720,kpuid masabudiman masws viryanazis hsymasyari novidaevi pramonoutan ksetyawan gentle dong salah da,-1.0
722,msaiddidu bapak tanya kpu tdk dicaya rakyat minta bubar dpr,-1.0
723,katanya kpuid dite nyatanya entri data dibuat salah ditambah amp dikurangi jadi dite unt,-1.0
725,detikcom situng kpu stop ganti real count bpn live warnet warnet,-1.0
727,divhumaspolri kpuid bawasluri polisi jaman now warasyg buat jahat dilindungi sebar d,-1.0
728,zarafaul nsusan libra kpuid wr fagtng bangzul sarpakenaka pantunjp ariantobulolo takut,-1.0
730,liemid tangkap ka kpu,-1.0
732,hari lapor salah input tps karangasem kokbelum dikoreksi kpu,-1.0
734,bpn prabowosandi lapor kpu lembaga survei bawaslu,-1.0
738,abdrossid hnurwahid kpuid kursi sekarang kurang empuk,-1.0
739,priyobudis zarazettirazr aldyrl selalu koar koar paling pancasilais bangsat benalunya bangsa,-1.0
740,msaiddidu ilctv karniilyas adil rakyat bs hancur bom besar binasa negeri,-1.0
743,bener fadlizon fahrihamzah sekarang kpuid udah bu salah input malah ikut corat coret bah,-1.0
745,dpalugada yarham fadlizon curang bu ditangani mk bawaslu kpu,-1.0
751,nich dok survey n ahli it itb lapor duga curang lembaga survei n situng kpuri bawaslur,-1.0
753,tutup situng komisioner kpu dijerat pidana,-1.0
756,msaiddidu desioon kpuid tdk nah berfikir jauh sangka rakyat cara rentak mengam,-1.0
757,msaiddidu ilctv karniilyas malah jawab lama sedang jadi kpu curang prabowo menang,-1.0
760,greenblack masabudiman kpuid udah dihapus sama adminnya tetep jejak digital sulit dihilang,-1.0
761,hnurwahid kpuid lapor polisi palsu begini,-1.0
762,kpuid tunduk sering salah input,-1.0
765,nyata admin kpuid sekeren admin bkngoid serius hehehehe suruh nampilin udh d benerin mana d,-1.0
766,tatapuri or bodoh ulang salah arti kpu bodoh curang moga semua or kpu curang k,-1.0
769,detikcom lalu fanatik begini nihblm sdh ngakujgn malu pd umum kpu tdk suai harap,-1.0
772,kpuid preeettttunggulah azab timpa kluargamu kpu curang,-1.0
776,abiyyu bangpino kpuid cakkhum zarazettirazr putrabanten maulanatigor lisaamartatara kendali y,-1.0
777,kpuid masabudiman viryanazis masws novidaevi hsymasyari pramonoutan ksetyawan jangan buta tuli,-1.0
781,kpuid jokowi kroni moga allah laknat kalian dunia akhirat allah kalian lampau batas,-1.0
786,doncorleone kpuid salah cayaini banyak salah,-1.0
789,msaiddidu hdrabdurrahman kpu ilc mudh kali kayaknya rezim,-1.0
790,maulana ireneviena kpuid kalau kpu netral moga semua libat curang azab pedih,-1.0
791,ngotot salah input data pemilu modus salah input data,-1.0
794,campusteast jokowi bakal menang kalau curang maya curang manana sama kpuid c,-1.0
797,hukumdan kpuid bangsat,-1.0
798,mdualet fadlizon post kpu anggotax jg manusia bs salahsystemx dlu hrs dibaiki br dilanjut shg data disaji bensr real,-1.0
799,sekedar usul saran kpu msh curang bagaimana kalau kpu ganti sama anak kecil karna,-1.0
800,pidana hanyalah sebatas defenisi implementasi jadi suatu buat pidana adlh lalu bukti tp faktanya pidan,-1.0
802,doradong officialpan partaidemokrat mulai ancang buat tinggal prabowo akibat panitia gnp,-1.0
803,msaiddidu rakyat us kawal awas curang ahirnya kpuid tetap mbalelo nekat menang pe,-1.0
805,ronnierusli sasongko kpkri kpuid bongkar us keboronya,-1.0
806,bpn prabowosandi lapor kpu lembaga survei bawaslu direktur hukum advokasi,-1.0
807,kpuid masabudiman masws viryanazis hsymasyari novidaevi pramonoutan ksetyawan ci palsu bagaimana kpuid,-1.0
811,fadlizon kpuid nyinyir depan ketua kpu gk disosmed koar gk jelas,-1.0
813,situng kpu bnyk disusupi c palsu selalu untung ampmerugi alas jadi salah dlm input c hologr,-1.0
814,arwidodo suro lalimoco kpuid kpuid mendiskualifikasi siapa sendiri curangnya malah brutal,-1.0
815,demo kpu jabar mahasiswa unpad pemilu gagal,-1.0
816,ikut kpu ne salah input keseringan maen sma kpu seh jadinya salah input,-1.0
818,sbsinews guru besar hukum pidana universitas padjadjaran unpad prof romli atmasasmita kata tuduh curan,-1.0
819,timses capres tolak hasil rekapitulasi kpu kabupatennganjuk,-1.0
821,priyobudis hnurwahid kpuid disini curang tiga intah sendiri lalu hukum,-1.0
822,newzepret kpuid bawasluri tolak pemilu curang,-1.0
823,ismantengku prabowo sandiuno kpuid bawasluri kalau liat bgt cpt masivenya entry data salah it kpu angka,-1.0
829,cnnindonesia maksud cucu iblis nantang kpu bawaslu tkn sumpah mubahalah nuduh curang lgi ngaku ny,-1.0
830,pidana hanyalah sebatas defenisi implementasi jadi suatu buat pidana adlh lalu bukti tp faktan,-1.0
831,putraerlangga kpu jangan curangi,-1.0
834,cara paling efektif patah konspirasi jahat demokrasi dilaku jokowi rakyat kawal total rekapitu,-1.0
835,bagaimana hari salah data inputan situng kpu sdh capai,-1.0
839,korlap ngodek jangan lgbt temenya rockygerung beginilah cara bodoh dukung prabowo saking ing,-1.0
840,jakarta ibukota negara katanya dipindah jaring fast net nomor lambat beud inputnya tps dki bl,-1.0
841,kpuid masabudiman masws viryanazis hsymasyari novidaevi pramonoutan ksetyawan angya sj ngawur apalgi grafiknya,-1.0
842,negaraku hancur lebur palsu c masuk tanda tangan palsu sebuah jahat kasus c tps gerun,-1.0
843,alhamdulillah hasil relawan it prabowosandi diserah ditemu salah dlm penginputan data o,-1.0
846,intah justru jadi produsen hoax paling sempurna punya segala dikata curang,-1.0
847,kpuid yu tunduk uu mk lapor tugas kpu salah input apapun pidana masalah salah,-1.0
849,kpuid berita anak beri beres sistem website kpuid,-1.0
850,detikcom situng kpu hasil c disaksi saksi kalah pahit dewasa hadap,-1.0
851,tunggu masanya kpu hadap kpk,-1.0
852,nyata kpu salah input malaysia suara jokowi ditulis,-1.0
854,kpu kumpulnya pendunguan umum kumpul dungu ketuanya,-1.0
856,syamunghazi peyboy dianya nyasar beri parah kpu nyasar tahu,-1.0
858,cnnindonesia kpu lembaga negara rakyat caya padamu,-1.0
860,doncorleone kpuid ang mendisain umat balas brutal alas tentara mera,-1.0
861,nyazizalsaggaf jokowi mas agus ajak preskompres bahas korban kpu jadi diabj,-1.0
862,kpu jujur akur kpu curang berang sebuah spanduk surabaya,-1.0
863,ijtima ulama desak kpu diskualifikasi jokowi tkn kalap,-1.0
864,gemblung ulama suu diikuti jelas curang scra vulgar ditonton disaji kpu malah minta,-1.0
865,powerofreceh zarazettirazr bawasluri kpuid relawan jokowi pura gila,-1.0
867,hingga jumat malam kpu tugas kpps wafat total sakit gtgtgtgtgt,-1.0
869,dungu jadi pimpin negeri mungkin kpu laku bodoh bodoh,-1.0
870,msapunya kpuid bawasluri stres relawan jadi patok,-1.0
871,dhanihendy kpuid bawasluri kawalpemilu onnowpurbo sandiuno prabowo pemilu berbiaya mahal telan,-1.0
872,jangan tugas kpu bantu tik wkwkwkwkwk,-1.0
875,tunggu masanya kpu hadap kpk,-1.0
876,cnnindonesia data salah input caya kpuyang salah pidanakami caya ijtima ulama lll,-1.0
879,mbakyuevin zarazettirazr kpuid iya ratus istrisuami hilang pasang hidupnya ratus anak hilang org,-1.0
881,tolak belag dngn nyata nyata tunduk kpu mulai ngibul ingat azab allah kalau k,-1.0
883,lapor salah input situng kpu relawan it bpn desak bawaslu henti situng kpu,-1.0
884,ratus kpps gugur merc jangan kambing hitam lelah kpuid bawasluri,-1.0
890,fadlizon kpuid harusnya lgsg ditembak tempat tpstps salah input c c valid,-1.0
891,kpuid kalau tunduk undang dak ribut masyarakat nihstop curang kpu,-1.0
892,ponirahmujahid fadlizon lama jdi curiga jga y mlihat tingkah aneh bpn n relawan balik keraha,-1.0
898,salah input situng kpu jokowimaruf ditulis suara,-1.0
901,input data dibilang it haha,-1.0
902,vintenas aimarnst sabtu mei jam total data input data nasional tidik cocok data grafik,-1.0
903,semestalink garuda kpu ora wani mk ora wani paruh rakyat wani,-1.0
905,siapakita reftywf kpuid sy ajar sana sini om sy dapet justru org auto dungu bi,-1.0
907,akibat lacur intelektual sby presiden habibibbu presiden gusdur bu,-1.0
908,kpu salah entry data tdk hny timpa tp jadi emang betul tp salah entry data timpa,-1.0
909,kpu rilis jumlah tugas kpps tinggal dunia sakit,-1.0
911,the most serious allegation of electoral fraud so far jenni retno claims itb specialists identified intruder feed,-1.0
918,rmolco laskarsurajaya bawaslugakkumdupolisijaksahakimklo emang indikasi bukti komisioner kpu,-1.0
920,kpu salah data bantah kalau berani,-1.0
922,tsamaradki kpuid salah input human eror,-1.0
924,msaiddidu ilctv karniilyas libur dilibur soalnya versi kpuid kali tayang hari kelia,-1.0
925,kpu tunduk uu benarkah pdhl bilang mslh bilang mslh artinya curang kesalah,-1.0
928,angelone wsanzulanda kpuid rampok suara rakyat,-1.0
930,tuhan tugas kpps tewas sakit indonesia pesta demokrasi bencana naik ta,-1.0
931,akibat visa kpu jangkit nalar berefek selalu salah hitung dahsyat pengaruh visa,-1.0
933,wrunturambi zokowiek kpuid kerjanya nyurangin suara rakyat ngisep darah rakyat bajing,-1.0
935,fadlizon tonton bodoh caleg meisme atur sendiri ikut buatny,-1.0
936,unkwonmouse kpuid lihat lempem mahasiswa tahun akhir kritis intah aneh,-1.0
937,vivacoid gatotgeneral situng brutal kurang ajar rakyat dosa banyak meninggaltapi ko,-1.0
938,cipta kondisi seolaholah kpu curang,-1.0
939,hasil pleno kpu mulai direkap lets see buat banding versi pleno kpu versi situng kpu vers,-1.0
942,lantas siapa bertanggung jawab atas tinggal sebut berani kata pemilu sukses,-1.0
944,video kpu salah input data koreksi dilaku,-1.0
945,palsu c masuk tanda tangan palsu sebuah jahat kasus c tps gerung utara gerung,-1.0
946,kpuid pemilu kalian curang,-1.0
948,ngowatchindo minta jadi batu katanya kalau kpu curang kabul,-1.0
950,kpuid masabudiman masws viryanazis hsymasyari novidaevi pramonoutan ksetyawan kalian sakit jiwa,-1.0
954,iqrozen akuntofa kpuid seneng jokowi kalau salah input banyak nguntungin bapak sebut ketah,-1.0
955,berjamaah bohong surat suara bakar papua kpu ksp polri rentak kata surat suara pakai,-1.0
958,salah input laku kpuid selalu rugi kait pemambahan depa,-1.0
959,salah situng kpu x amp x salah x amp x curang x amp x curang masif x lebih jahat,-1.0
962,kenyoriee ddarpen kpuid pantang mundur,-1.0
964,buat tug input pidana pasal undangundang pemilu anggota kpu lalai men,-1.0
966,doncorleone kpuid kpu tdk beri beda salah input sengaja menginput salah,-1.0
967,coba inget pakakhir sering salah ngomongatau sby presiden ttg prosentase kesal,-1.0
968,bahan bakarnya kpu pke solar jd loyo input coba pke batu bara ngaciiii,-1.0
969,tempur lanjut bu versus alih kpubawaslu versus rakyat kuat siapa,-1.0
971,kpps tinggal dunia ketua kpu pd disorot kamera sakit jiwa,-1.0
972,hukum gantung ketua kpuid,-1.0
973,mohon kpuid jangan main suara rakyat juang suaranya didengar dicu,-1.0
974,ketua it bpn agus maksum bunya kurang sekarang situng malah tambah kacau brutal bu salah,-1.0
975,untung yah sidang isbat muibmkg lapan coba kpu hari jadi bu puasa wabah lapar,-1.0
976,biasav modal inspect element bilang kpu curang,-1.0
977,udah masabudiman jangan lalu bela kubu sebelahlamasih lupa kalau ketua kpu mati penuh misi,-1.0
979,kpu tolak mentahmentah minta mendiskualifikasi jokowimaruf amin bagai pilpres,-1.0
980,riasulaimani onnowpurbo kpuid buktinya buktinya mana berapa total tps ang punya bukti kr,-1.0
982,pramono anung sebut minta rizieq setop situng kpu aneh,-1.0
986,fadlizon kpuid langkah tepat untk langsung pantau mimimal kurang buruk sangka,-1.0
987,abdulrachim zarazettirazr kpuid moga prabowo sandi naikorang curang penghianat dihukum seb,-1.0
989,kapan beresnya kpuid kalau salah input trs rakyat kesal banyak salah rakyat sekar,-1.0
990,kpuid salah input hoax,-1.0
994,divhumaspolri mohon kpuid tangkap banyak hoax c banyak suai input datanya hoax jg,-1.0
995,kpuid tlg direvisi input utk tps kelkesenet banjarmangu banjarnegara jateng data diinput tp,-1.0
996,msapunya mayairma waduh kpu udh mmg g syg rakyat rupiah hlg semualalu pd sp rakyat taruh ke,-1.0
998,provinsi banten dikuasai tinggal situng kpuid dijaga situng kpu banten sen,-1.0
999,sore tadi bpn data fakta kait pola curang tsmb tps diverifikasi,-1.0
1003,lebih berat mana tugas kpps kpu pusat kkps tinggal kpu pusat,-1.0
1006,soepono hnurwahid kpuid jokowi cuci otak dulu bong pin dungu,-1.0
1009,soepono hnurwahid kpuid jokowi emang kumpul ebong dungu manen suruh nanya nanya sholat jumat,-1.0
1013,powerofreceh bawasluri kpuid ang begini protes medsos desak us jemput adil,-1.0
1014,sudrajatyusep namakuella detikcom adil mana bukti kpu curang diproses waras,-1.0
1015,siapin uang lembar buat dituker kpu sapa nominalnya nambah lumbago buat sodara ntr lebaran,-1.0
1017,kpu tunduk konstitusi uu pemilu,-1.0
1019,heydi indonesia musim human error jawab kpu,-1.0
1020,lawyer nasional tuntut kpuayoo kawan support dgn cara viral tiap portal medsos masing allahu akbar,-1.0
1021,soepono hnurwahid kpuid jokowi ebong dungu lama nanya jumat prabowo kaum cebong oposisi,-1.0
1024,bellysetiawan ratujunty rakyat sdh muncul bah emak tuntut hasil pemilu jurdilscr de facto,-1.0
1027,hukumdan harokah kpuid akuntofa kpuid lalu panik lupa foto c,-1.0
1028,situng kpu dinilai tambah kacau brutal,-1.0
1031,lama lama semut kitar kpu salah ni,-1.0
1033,saracenofficial mgkn kpuid nyambi jadi dukun setan ikut nyoblos break dulu,-1.0
1036,stop kpu curang kpu satu buat warga jabar marah lewat youtube,-1.0
1039,datangi bawaslu relawan it bpn bawa bukti salah entry situng kpu,-1.0
1040,tim it prabowo lapor salah input bawasluri coba kpuid tanya keseluruh rakyat indonesia,-1.0
1041,kpuid masabudiman masws viryanazis hsymasyari novidaevi pramonoutan ksetyawan salah entri ribu,-1.0
1042,ruang kpu vs warnet ruang kpu buat suara rakyat jadi sampah ruang warnet buat mata,-1.0
1043,paling cari salah kpu,-1.0
1044,riodamha dungu subsidi otak kalahnya bong kpu sering salah input data,-1.0
1045,update real count pilpres kpu mei jokowi prabowo kontan hingga jumat pukul,-1.0
1048,kpuid arti kalau tunduk hadap uu pasal dlm uu pemilu laku dong,-1.0
1049,karniilyas ruang kpu vs warnet ruang kpu buat suara rakyat jadi sampah ruang warnet buat mata,-1.0
1050,abdurahmansalim zarafaul libra kpuid wr fagtng bangzul bawa lapor jangan dibiar,-1.0
1053,jimmyatp kpudsumut kpu salah input berkali kalidan merekapun mengakuiapa buat caya kep,-1.0
1055,msaiddidu ruang kpu vs warnet ruang kpu buat suara rakyat jadi sampah ruang warnet buat mata,-1.0
1056,banyak propaganda negatif kpu pb hmi jangan mudah provokasi berita takjelas,-1.0
1057,patriotis nasionalis malah jadiin musibah tinggal org anak bangsa sbg alat propaganda utk lemah kpu,-1.0
1059,jaidun akibat kpu kena firus salah infut ri jdi ri,-1.0
1060,abiyyu cakkhum kpuid bangpino putrabanten maulanatigor mbahuyok lg proses kena karma habib rizieq e,-1.0
1063,he masabudiman paham kalimat keluar kpuid paksa utk kata kau anggota kpu adapu,-1.0
1066,anakragil azmi ferdinandhaean kpuid move on tu pemilu berani jujur lama curang namanya mun,-1.0
1067,powerofreceh bawasluri kpuid kpu giring opini publik rcount kpu sdh masuk input jawa tengah,-1.0
1069,invut data kpu salah otak atiik,-1.0
1070,rileks waspada ketua satgas bpn bpk toto nyata suara tggl tunggu putus kpu k,-1.0
1071,hasil demokrasi ujungnya milih bu rakyat kpu dungu bwrjamaah ai tu tel yu dad is awer,-1.0
1072,bpn prabowo serah bukti duga curang situng kpu bawasluri jamin,-1.0
1074,powerofreceh bawasluri kpuid massal salah input,-1.0
1077,jokowi pemilu curng kpu netrl lapor bawaslu via youtube,-1.0
1078,wah kalau audit forensik tahu siapa instruksi,-1.0
1079,tehtjemplung lucu nihjambi batanghari batinxxiv muara jangga tps input situng kpu sama,-1.0
1082,positof mungkin admin kpu ngetweet,-1.0
1084,msaiddidu kpuid sakit gigi labih sakit sakit hati,-1.0
1085,curang niat situng kpuid diinput c palsu saksi warganet punya c asli jelas kriminal,-1.0
1088,mulai klaim menang tuduh kpu curang bukti kalap,-1.0
1089,harusnya tuntut intah sebar luas wabah sakit nama pemilu lalu kpu,-1.0
1092,warning jangan hilang fokus prosesor dibayar m jokowi utk alih fokus rakyat hitung,-1.0
1093,kpuid wuahahahahha kalian oknumkpu tggu sampe ajal jemput kalian tanggung jawab semua hadap,-1.0
1094,jangan nah tunduk imam dagel ang layak dijadi teladan siapa d,-1.0
1096,dukung relawan kecewa andamengapa kata istana,-1.0
1097,bernikusen annasuezann kpuid disonansi kognitif berkeusan akibat pribadi ganda,-1.0
1098,kpuid berani sumpah sambar petir gk,-1.0
1099,aburasyid kpuid bawasluri salah suara salah juta suara,-1.0
1101,tanyoana kpuid us provokasi rakyat saatnya semua buka kpuid sdh buka,-1.0
1103,oasi cipta kondisi kpu curang,-1.0
1105,vivacoid baca judul coment intinya banyak tuduh kpd kpu bukti lapor bawaslu,-1.0
1106,kpuid masabudiman masws viryanazis hsymasyari novidaevi pramonoutan ksetyawan hrsny krisis cen,-1.0
1107,kpu becus kerja digaji ku kalau salah pecat arti siap siap pecat yan,-1.0
1108,haikalhassan pasutagar kpuid selalu ulang salah input ang niat,-1.0
1109,ardianza gerindra dahnilanzar kpuid bawasluri dituduh curang guoblok,-1.0
1110,hnurwahid micheladamnew paling bertanggung jawab atas curang dialah hancur indonesia,-1.0
1111,miris khatib khutbah jumat kemarin bilang sangkut paut kisah ang badar bulan ramadh,-1.0
1112,annasuezann kpuid psikolog sosial leon festinger sdh ingat lemah mentalitas sbg makhluk sosial kadang,-1.0
1114,ronavioleta paling bertanggung jawab atas curang dialah hancur indonesia kekuasaa,-1.0
1115,nakal tuan kpu,-1.0
1117,putraerlangga posisi kpubawaslu ang berat mungkin klausul khusus merubah patriotik n,-1.0
1119,situng kpu disusupi c palsu suara jokowi medan naik,-1.0
1122,akuntofa tegasssss kpu tunduk rizieq kpu tunduk undangundang imakasih kpu,-1.0
1124,alisunartii vivacoid cebong baru lahir nah ngikuti situng kpu lihat sendiri jangan minta disuapin,-1.0
1125,doncorleone kpuid c palsu pidana,-1.0
1133,kpuid surat suara ja korupsi gmana uang,-1.0
1136,hnurwahid kpuid makin kurang ajar kpuid tdk peka dgn kritisnya masyarakat stiap hari kritik bh maki,-1.0
1137,ijtima ulama iii hasil putus bhw pemilu curang ulama desak kpu coret nama jokowimaruf,-1.0
1138,tular kpu sby presiden bu,-1.0
1139,jamansulit kpuid salah suara salah juta suara salah,-1.0
1140,s dianggap giring opini publik open data dianggap giring opini publik sains dianggap giring opini publik,-1.0
1142,fadlizon merdekadotcom siapa gk awal jauh hri sblm pemilu mulai fremingnya sdh seting s,-1.0
1146,suara dprd jateng dapil iii kudus dasar hasil pleno kpu murianewscom,-1.0
1147,nafsu kali sekelas media online bilang tgl mei hari sdh hari sabtuitu nafsu menga,-1.0
1149,kpu peduli sdh bukti curang input data situng kpu banyak tps,-1.0
1152,alibi maling tetangkap basah msk rmh org mo namu tp bongkar gembok pagar amp kunci pintu rmh jg dilaku pd ja,-1.0
1153,denger kpuid dizhalimi kerja netral stop curang kasian anak kecil apah klo,-1.0
1154,hasil quick count akun diretas kerjaan admin mantan juru input kpu lupa sejarah gelap,-1.0
1156,gw mw tanya tanggap dek tsamaradki ttg bnyak korban tinggal dunia pemilu kemudian tangg,-1.0
1159,rileks waspada ketua satgas bpn bpk toto nyata suara tggl tunggu putus kpu,-1.0
1160,sdh tugas pemilu wafat doa moga arwah dimulia allah swt lu investigasi menyelu,-1.0
1167,kpuid masabudiman masws viryanazis hsymasyari novidaevi pramonoutan ksetyawan salah entri koq d,-1.0
1168,resmi bpn lapor data salah input situng kpu bawaslu,-1.0
1169,imayadewi teukatuah kpuid salah input tiap hari jeda,-1.0
1170,namanja ruang it kpu ruang karaoke mengambar ruang eliteyg dibayar mahal rakyat kerja kp,-1.0
1171,gua mesti turun tangan lihat curang pilpres sdh nyata faktaafdol via tvmedsostdk dibiar,-1.0
1172,mandatory garudaemasntb putus salah satu komisioner kpu p,-1.0
1174,dahnilanzar bang web kpu jam kurang tdk akses,-1.0
1177,maaf sibuk ngawasin kpu salah input data c salah input tiap hari hadeeuuuuuhhh,-1.0
1185,april mestiny djadi hari bencana nasional jiwa layang sebuah pesta demokrasi ujung dng kesa,-1.0
1186,jongmuslim ratuanissah bawasluri kpuid prabowo sandiuno auwas lindungi saksi jangan diracun pki,-1.0
1188,hilang suara kode kalbar kapuas hulu boyan tanjung mujan tps disitung scan c,-1.0
1189,vivacoid msaiddidu ngaku kpu salah sampe,-1.0
1190,efek dekat sama kpu salah melulu,-1.0
1192,kpuid masabudiman masws viryanazis hsymasyari novidaevi pramonoutan ksetyawan ngeles,-1.0
1199,syafrinkar kpuid joked dkindonesia stealth infonya intruder dpn gambir benarkah,-1.0
1200,adrianto pasal amp uu ttg pemilu tlh atur tegas ttg ancam thn pidana penjara bg coba utk menguta,-1.0
1201,kpuid habiburokhman msaiddidu cakkhum toendusara vascoruseimy reactips priyobudis salah input kak h,-1.0
1202,lampir tambah salah input kak sc web kpu scan c versi data input web kpu suara sah,-1.0
1206,curang tampak dimatakpuid bawasluri dkppri usut siapakah buat c aspal,-1.0
1207,kpuid msaiddidu zarazettirazr cakkhum tijabar joniirian salah input didepan jadi kpuid,-1.0
1208,said aqil kata kpu caya,-1.0
1209,kpu effect kurang kurang,-1.0
1210,siapa khianat padahl pks sandi ulama padahl dana kmpanyesandi lbh byk sumbang ktimba,-1.0
1211,hukumdan wakakakapantesan blg kpu tsm curangnyangitung presiden keberapa ngawur doi,-1.0
1213,kpuid jelas hoax malah minta bukti eh onoh menang kagak papa bukti,-1.0
1214,bpn prabowo sandi bangkit bawa bukti lebih salah input situng kpu it bpn desak bawasluri henti situng,-1.0
1215,sadisss edit subhanallah bu salah input edit hasil scannya bawasluri kpuid,-1.0
1217,abiyyu cakkhum kpuid bangpino putrabanten maulanatigor mbahuyok cari setan empuan,-1.0
1218,bu pemilunya curang selenggara kpu curang indikasi menang paslon dipesan,-1.0
1222,situng gaduh buat kpu kekeh tahan,-1.0
