,Tweet,Scores
1223,rakyat ramairamai koreksi salah input tugas kpu inilah the real people power suatu dibayang s,-1.0
1224,hati banyak alih isufokus kinerja kpu lengah dikit tewas taulani mahfud omdo pindah,-1.0
1226,negara buat jahat hadap rakyatnya hallo mk ma kamu praktisi intelijen cipta kondisi,-1.0
1227,ketua it bpn agus maksum bunya kurang sekarang situng malah tambah kacau brutal bu salah,-1.0
1228,jangan provokasi sama berita aneh biarin divhumaspolri kerja ikut komen masalah ibukota pindah ata,-1.0
1229,sesema maling saling mensupport satu maling duit rakyat satunya maling suara rakyat selamat datan,-1.0
1230,aprilialin situng kpu bu objek sengketa pemilu sama nuduh maling barang hilang d,-1.0
1231,nyata bapak mahfud udah tular sama kpu jadi salah entri yaaa sby buka,-1.0
1232,careandidin partaisocmed situng kpu bu objek sengketa pemilu sama nuduh maling barang hilang,-1.0
1233,geloraco bingung kpu,-1.0
1235,ariefbudiman rakyat banyak curang hasil hitung salah input sebut disengaja,-1.0
1236,msapunya fadlizon kpuid bawasluri luar binasa,-1.0
1237,kpuid masabudiman masws viryanazis hsymasyari novidaevi pramonoutan ksetyawan kpuid jgan cari du,-1.0
1240,kpuid jangan suka alih semua rakyat beri kinerjamu kembung suara danme,-1.0
1241,turut salah satu komisioner kpu salah entry lebih an diuntung human error sebut,-1.0
1242,kpuid masabudiman masws viryanazis hsymasyari novidaevi pramonoutan ksetyawan koyok wong goblok cu,-1.0
1243,tugas kpps wafat level jadi luar biasa bencana nasional rasa malu catat,-1.0
1244,kingpurwa wes wayahe ganti wasit tni jadi wasit gantiin kpu,-1.0
1246,abdulrachim kpuid kpuid kpkri bawasluri gerindra jokowi curang,-1.0
1248,hoax video orasi empuan kpu bu wali kotarisma,-1.0
1250,greenblack masifaturohmi masabudiman kpuid jadi giring opini publik bukti wasit berpih,-1.0
1251,jadi tps gerung utara gerung lombok barat ntb input diweb kpu tdk ssuai c asli janggal,-1.0
1252,kpu buat curang suara diambil dimasu tambah suara cara palsu c tugas kpu,-1.0
1255,karniilyas bang bongkar dong sitem it kpu ilc,-1.0
1256,rmolco mbok coba tabayun dulu kyai ngomong bukti curang kpu ramai jd omong rakyat,-1.0
1257,panik tim it prabowo datangi bawaslu serah bukti kecurngan kpu pemilu,-1.0
1258,sby presiden prof indonesia ko jadi sakit begini kpuid prof,-1.0
1262,kpuid urus kecil jangan keringetan gitu napa bang urus gede noh,-1.0
1263,massa bogor beri juluk kpu komplot khianat umat viva,-1.0
1264,alhamdulillah susup lacak cantum berita media online judul,-1.0
1266,hasil pleno kpu mulai direkap lets see buat banding versi pleno kpu versi situng kpu,-1.0
1271,suai fakta dilapangan omong tindak surat suara coblos malaysia dibilang sampah,-1.0
1272,situng kpuid makin gila suara angka,-1.0
1274,ahmadub syarman ustadtengkuzul menujudamai hahahha tai lu goblok data tkn udah dibuka data qui,-1.0
1278,msapunya kpuid bawasluri wah kriminal bu human eror lagipolisi nangkap ni,-1.0
1279,msapunya lookinglove kpuid bawasluri bkn curang rampok angan,-1.0
1280,dodylucas akuntofa sampah busuk dipatah kpu ribu formulir c dimil,-1.0
1281,detikcom berani riziek dtg sendiri kpu skalian bawa data ktnya punya croscek kl ema,-1.0
1282,msapunya ampaskopi kpuid bawasluri jahat demokrasi sembunyi jadi komisioner kpu,-1.0
1283,pidana seluruh komisioner kpuid sllu dalih salah input hingga ribu kali lebihkesalahan input,-1.0
1284,kpu tunduk kpu tunduk cukong,-1.0
1285,pantau proses input data situng kpu tugas dpr awas,-1.0
1286,januryanur kpuid goblok dungggu kibbik aiaaaap plcidn,-1.0
1287,msapunya munawartaufik kpuid bawasluri bawasluri tindaklanjuti lapor bpn jangan diemin kasia,-1.0
1289,pnjljh rizmawidiono usah berizik disana zik balik kesini trus datang kpu sendiri berani,-1.0
1291,kpu tugas kpps tinggal sakit detiknews,-1.0
1292,indikasi situng lambat tunggu c palsu upload,-1.0
1294,dapet sumber data salah mana kpuid artinya lapor bpn hirau,-1.0
1295,situng kpu dinilai tambah kacau brutal,-1.0
1298,bpn serah dokumen duga curang sistem hitung it kpu situng bawaslu kini bpn balik m,-1.0
1299,sapulidi dj kpuid kpuid ngeles us bajai,-1.0
1306,detikcom tlg kpuid update jumlah korban nah posting bawah tgl april,-1.0
1313,hermanat utk re begadang aneh data kpuri tps kel pangarengan kecrajeg,-1.0
1314,hnurwahid kpuid lapor usah curhat sosmed,-1.0
1315,ferrykoto prabowo kpuid analisa salah tetep inputnya jadi,-1.0
1317,salah input data kpu untung kubu jg banyak hari ditemu kitar salah input dgn stengahnya men,-1.0
1320,darurat curang kait c amp input data kpu aktivis tdk desak kpuid u tutup situng,-1.0
1321,tutup situng komisioner kpu dijerat pidana pihak tegak hukum seret muka huk,-1.0
1327,maulana kpuid nyinyir abis,-1.0
1328,doradong ketua kpu manipulasi pikir rakyat ajak rakyat ikut dungu tonton mo,-1.0
1331,hasil final pacitan dasar hasil rekapitulasi kpupacitan selasa hingga rabu,-1.0
1332,onnowpurbo lukah audit forensik it kpu turut g onnowpurbo,-1.0
1334,bangray akuntofa kpuid prabowo bukti curang untung dasar tkn dungu curang rugi,-1.0
1335,partai demokrat tetap konsisten sama prabowo prinsipnya pd tinggal teman sulit pd,-1.0
1336,hnurwahid kpuid jangan banyak cocok loe nur kalau ang bukti nyata lapor kamu pin goblokkkk,-1.0
1337,abdulrachim satriawaniwan kpuid kpuid ikut libat dlm jahat pemilu palsu c,-1.0
1346,gmeirza bentengnkri kpuid gdede cemar nama baik jokowi struktur sistematis masif,-1.0
1347,fadlizon kla emang salah kpu letak salah coba bukti,-1.0
1348,abdulrachim kpuid otak kalian palsu kpuid ehpudmelek pud lu melek,-1.0
1351,kpuid masabudiman masws viryanazis hsymasyari novidaevi pramonoutan ksetyawan pemilu paling parah maluin,-1.0
1352,audit forensik sistem situng c jawab tepis stigma konspirasi kpu kuasa,-1.0
1354,fadlizon advokatlk kpuid kyknya situngnya kpu pakai jin jin tsb ma tumbal sekuan ratus org kpps tinggal hhh,-1.0
1355,geloraco ap dgn rezim kpu,-1.0
1356,hoax mendegilitimasi kpu report postingan report gtgt,-1.0
1357,imayadewi ireneviena kpuid kpuid beda mana klo salah batas nyaklo batas namany,-1.0
1360,ayiepnano pras jackvardan kumpar c plano babinsa dijadi bukti hukum prosesnya y,-1.0
1361,doncorleone kpuid ang mendisain umat balas brutal alas te,-1.0
1362,namakuella detikcom trz caya kpu bukti curang waras,-1.0
1364,catat kpu salah entri data situngpemilu,-1.0
1365,ustadtengkuzul mending ngitung tug togel ajah lbh teliti jeliketimbang wkwkwkwkwk,-1.0
1366,hoax mendegilitimasi kpu report guys report gtgt,-1.0
1367,kunjungi kpu zon cek situng sering salah input bekasi online,-1.0
1368,doradong suai kicau lama pakar itb sebut situng dikendali intruder sebut be,-1.0
1371,kunjungi kpu zon cek situng sering salah input,-1.0
1372,doncorleone kpuid kpuid salah input lampir c palsu,-1.0
1374,minggu lebih pasca coblos bs salah input us gini kpuid logiy kalau ang human error or syst,-1.0
1375,bawa bukti lebih salah input situng kpu relawan it bpn desak bawaslu henti situng kpu,-1.0
1376,kpu tunduk rizieq,-1.0
1377,massif salah situng kpuid sinting fb pakar it univ airlangga prof soegianto soelistiono,-1.0
1379,kpuid hoak salah input tiap hari wkkk,-1.0
1380,anak kelas bobol situs kpuid pemilu hoax hatihati jadi sebut tah,-1.0
1381,situng kpu dinilai tambah kacau brutal viva kacau brutal liar,-1.0
1382,syarman bawasluri kpuid curang kecut ikut atur pemilu disqualifikasi,-1.0
1383,acc muliyopioneer donadam salehug kpuri curang matamu picak,-1.0
1384,ferrykoto prabowo kpuid sangkal salah input bah kubu yata temu rib,-1.0
1385,saracenofficial gawat banyak surat suara coblos setan kpu mnyelesainya lalu m,-1.0
1388,suai capai kpu partisipasi pilih pemilu garut gosip garut via gosipgarut,-1.0
1389,kpu doang salah input taunya toanya wkwkwkwkwk,-1.0
1390,maspiyuuu lisaamartatara kpuid makhluk biadab laku cela bongkar,-1.0
1391,mantap bang nahra akuntofa bongkar us kasus salah input jumlah dilaku kpu menger,-1.0
1392,kpuid masabudiman novidaevi hsymasyari viryanazis masws pramonoutan ksetyawan tdk malu bn,-1.0
1393,sorry satu foto nyangkut ni lanjutannyakeburu hapus kpu hasil pindainya,-1.0
1394,edan bener mulai bawa kabur kotak suara kpu sendiri udah kontaminasi sekarang berhara,-1.0
1397,jasonbourne abiyyu cakkhum kpuid bangpino putrabanten maulanatigor mbahuyok eh abiyyu tolol kapan r,-1.0
1398,salah input dilapor bpn semua rugi suara dibali salah input naik suara,-1.0
1400,koyo kpu wae salah us matamu,-1.0
1401,jangan provokasi sama berita aneh biarin divhumaspolri kerja ikut komen masalah ibukota pinda,-1.0
1402,kpuid masws jijik kali lihat kau kau kira kau it,-1.0
1404,aplpangeran kpuid bawasluri mungkin krn lama nyangkul sawah jd begini mulutnya penuh bohong,-1.0
1405,rmolco panca kpuid salah input situng bu arti curang situng rupa alat bantu hasil situng jug,-1.0
1406,rini bong cek pengen menang main curang cek kata curang amp brutal klo kamu waras web kpu,-1.0
1407,tembangsunyi padioyan begini mas prabowo kpu ang stop oknumnya diusut dimasu penjara da,-1.0
1408,tembangsunyi padioyan kpuid meng upload c dipalsu bu curang,-1.0
1409,newsjundi bertemanm kpuid bawasluri bongkar,-1.0
1411,siivyriau laknat allah mampus kpu curangi suara rakyat,-1.0
1412,oppositelinks hannaalawiyah kpuid bawasluri divhumaspolri kalau jumpa x bunuh rame,-1.0
1413,hadddeh efek bakawan jo cebong kunjung kpu salah input gaek ko haaa sby tu p,-1.0
1416,hati banyak alih isufokus kinerja kpu lengah dikit tewas taulani mahfud omdo,-1.0
1417,kpu tunduk pihak manapun so stop bilang kpu curang,-1.0
1418,jadi gua baca salah satu media statement gini tahu janggal jumlah tugas kpu meni,-1.0
1421,gerindra selalu hajar kpu lupa curang tim paslon mulai kepala desa kepala daerah kampanye,-1.0
1422,charlespambers keyce stop pemilu bubarin kpu atw korban kpps tinggal makin tambah,-1.0
1423,said aqil kata kpu caya,-1.0
1424,audit bentuk tpf kpuid lu pake duit rakyat bu duit toko mebeul,-1.0
1427,tegar ikhlas ima putus kpu apapun hasilnya tgl mei,-1.0
1428,kpu kata tutup diri koreksi pihak,-1.0
1429,stop pemilu bubarin kpu atw korban kpps tinggal makin tambah mediaindonesia andiarief,-1.0
1431,salah input situng kpu sentase kitar salah input koq banyak banyak,-1.0
1432,selisih suara jumat mei kpu tps kp tps jumat,-1.0
1433,gundidr jangan mampu kpu dlm manipulasi angka diajari prof,-1.0
1434,kalengi wahai kpuid kpuri bawasluri audit c tetap laku manipulasi data,-1.0
1435,selisih suara kpu tembus alhamdulillah,-1.0
1436,detikcom gimana gag sakit te cara psikis akibat kubu sdh x deklarasi menang sbg presi,-1.0
1438,palsu c cara brutal utk menanghina jorok cara kalian main,-1.0
1440,allah baiki kpu input jadi input jadi ke,-1.0
1441,audit bentuk tpf kpuid lu pake duit rakyat bu duit toko mebeul,-1.0
1443,lebih salah input,-1.0
1446,indrafathur aburizalbakrie logiya klo salah ciuramg dn disembunyi taku,-1.0
1447,nahcair milyar kpuid kabar barutim it bpn prabowo sandi bongkar atur entry data web kpu da,-1.0
1453,kpuid ciyuusss curiga akun dibajak,-1.0
1455,bbmcargo toyopah aryprasetyo kpuid bawasluri jokowi mylovenebe bu akuuuu lueis dadak jadi ngulama,-1.0
1456,mention akun rakyat drpd kpuid bawasluri tugas lapor sdh dilaku bpn,-1.0
1458,riyadiatmodjo relawanprosandi bawasluri kpuid fahrihamzah msaiddidu faldomaldini cakkhum dungu ang ng,-1.0
1460,arlexwu kpuid wuaaduuuhhh sekelas mmdbisa salah fatalya push,-1.0
1463,musniumar zulkifllubis pemiluupdate profudah kali sy beritau amp bukti kalau mrk sableng amp da,-1.0
1469,nalimnr arincattleya neonetizen loembok ane bantu viral status wa ane neeeeh trus group wa wkwk,-1.0
1475,sbsinews ijtima ulama tuduh jadi curang jahat pemilu ulama dukung prabowo,-1.0
1476,ijtima ulama minta kpu diskualifikasi joko widodomaruf amin acara disebut mendelegitimas,-1.0
1477,kpuid masabudiman masws viryanazis hsymasyari novidaevi pramonoutan ksetyawan salah input,-1.0
1480,sebuah busuk nama ijtimak ulama mrk sebut ustadz cebong tdk ikut ikut hrs caya curang kpu walaupu,-1.0
1481,kakaisyah follow akun twit chloetowntale kak moga buka mata amp hati ttg salah input it kpu,-1.0
1482,laman situng kpu lihat jarak suara jokowi maruf prabowo sandi makin jauh,-1.0
1483,kpuid salah infut misal jadi jadi malu emang ente matematika sd dulu,-1.0
1486,kpu sebut salah input data situng beda curang,-1.0
1487,aburasyid dulatips kpuid bawasluri bawasluri diam gerak mending lempar dang macan,-1.0
1491,kpuid masabudiman masws viryanazis hsymasyari novidaevi pramonoutan ksetyawan penghianat rakyat,-1.0
1492,sumpah gua kira prabowo udah menang tiba minta jokowi didiskualifikasi ancur total tu otak,-1.0
1494,innalillahi wa rajiun pemilu bencana alam kpu tugas kpps tinggal dunia jadi,-1.0
1495,bravo kpuid jangan tunduk provokasi kelompok tunggang kpu,-1.0
1498,partaisocmed kpuid tunduk trending topics riziek,-1.0
1500,movement gerombol prabowo makin bingung seru jokowi didiskualifikasi sekarang tuduh kp,-1.0
1501,tuduh curang kpu bkn penggiringan opinismua pnya buktiwjar mgnggap fitnahhoax dsbkrna set,-1.0
1502,engkongjali pdemokrat demokrattv kpu salah input kong,-1.0
1503,kpuid masabudiman masws viryanazis hsymasyari novidaevi pramonoutan ksetyawan jadi sampah suara ra,-1.0
1504,masbrewk ahmadchm kpuid sangat sedih tindak sebuah gagal awal tahun,-1.0
1505,abiyyu putrabanten kpuid cakkhum proftamburin zarazettirazr maulanatigor lisaamartatara nampak kali bangsat,-1.0
1508,dear aagym bilangin hrs kali hrs bohong tps kel petak kaja gianyar gian,-1.0
1510,hoax matamu nasa jebol kpu kalau beneran hoax buat nyata tv laa wooo,-1.0
1511,arifahmd titusekowibowo detikcom kpuid fadlizon fadlizon sekarang tugasnya berat brow jagain baliho,-1.0
1512,dear aagym bilangin hrs kali hrs bohong katanya suara jokowi kpu tu,-1.0
1514,anak kelas bobol situs kpuid pemilu hoax hatihati jadi sebu,-1.0
1515,shoumafitra kpuid bkn anak design grafis buat edit hasil scan ganti angka gampang beu,-1.0
1516,putriidachan kpuid sy doa ngomonghilang suaranya curang suara rakyat,-1.0
1517,cek website kpu nyata beneran riziek tug ngibul ngibul mekah azabnya yah kesamber petir,-1.0
1520,ha ha uplod c palsy jg bilang curang ye kpuid nanyaa,-1.0
1525,faoezanmuhamma basyaalika rockygerung hhhhhh makin jlas otak kebolak balik lhooo tooong bener kata,-1.0
1526,banyak enam tugas kpu kaltim tinggal dunia sakit,-1.0
1529,ardiriau hukumdan kpuid gw seneng bang ardi selalu fight dlm segala sekaligus tahan banting,-1.0
1530,lexyon ustadtengkuzul susah jelasin kl prcaya dg kpu pdhal realcount kpu sdh bs dihitung seme,-1.0
1533,komplek mega mai mana suaranya salah input kpu tps lurah padang sarai komplek mega mai k,-1.0
1536,kpu oohhh kpukenapa c palsu kau gunamedan amplasjgn macam macam kau kpu,-1.0
1540,doncorleone kpuid dibilang salah input data niat curang dasar malu muka tembokkpuid,-1.0
1541,kpuid klo baiki cara ngitungmu kalian dianggap curang,-1.0
1546,masyarakat digiring cayai kpu alas kpu curang fakta komisioner dipilih ditetap ole,-1.0
1548,kalau puas kinerja kpu jangan klaim menang lapor ang curang,-1.0
1549,dargalang priyobudis tps alas copy kubu sdh kongkalikong dng kpu minta c asli isi palsu,-1.0
1552,quick count ditolak zongos minta real count dihenti krn resah bakal hp layang,-1.0
1554,imayadewi ireneviena kpuid salah input ulang kaliitu namanya blooooooon,-1.0
1555,kurang kpuid lengkapi jd kesalahanbiar setan seneng,-1.0
1556,ardiriau hukumdan kpuid hajar uda duangsekalian hancur akunnya,-1.0
1557,makin tua makin pikun presiden siapa proflol otak mu sama kpu kpuid an,-1.0
1558,mochherianto ynkz satu janda dicerai suaminya mulutnya suwek koar nuduh kpu cu,-1.0
1559,jasonbourne abiyyu cakkhum kpuid bangpino putrabanten maulanatigor mbahuyok eh abiyyu tolol,-1.0
1561,lawanintolerans kpuid udah nyinyir sama pps,-1.0
1562,cnnindonesia turut bpn ribu baiknya mmg audit it kpu susah prinsipnya,-1.0
1564,care keluh nunggu hasil kpu yah,-1.0
1565,bongkar siapa bongkar hadih mudik geratis negara batavia,-1.0
1567,tular salah input kpu prof prof,-1.0
1569,kpuid jangan kpu hnya lapor curang dg tindak lanjut berita curang sebar krn tdk s,-1.0
1572,ditanya soal curang pendemo kpu diy bawa data,-1.0
1573,ismantengku prabowo sandiuno kpuid bawasluri kalau liat bgt cpt masivenya entry data salah it kpu,-1.0
1576,mengkhabar intah bahas lebih lanjut soal rencana pemindahanibu kotake luar pulaujawa rencana pemind,-1.0
1578,kalau salah input kali wajar ribu kali bossini jahat luar biasa kpuid nah te,-1.0
1581,zarafaul libra kpuid wr fagtng bangzul haha asli dungu wanita malu kali anak kelua,-1.0
1582,posisi satu diberi sayangnya kpu kata jokowi aka,-1.0
1584,wiwismbecak cakkhum bawasluri kpuid divhumaspolri fadlizon fahrihamzah curang busuk ad,-1.0
1585,kpu catat salah entridi situng pilpres,-1.0
1588,tular kpu jd slh inputkoreksi lg paksby presiden kberapa,-1.0
1590,bawa bukti ribu lebih salah input relawan it bpn desak bawaslu henti situngkpu,-1.0
1591,drkoko stop situng seret komisioner kpuid adil pemilu bohong rakyat m,-1.0
1592,kpuid salah inputsuara prabowo trs dikurangi kpu jngn main bodohi rakyat,-1.0
1594,ardiriau gara dekat dgn kpu bro jd salah input dehhehehe,-1.0
1596,iqrozen akuntofa kpuid horee tinggal ngambil milyar lupa sedekah yee,-1.0
1597,vivacoid te contoh sekarang kpu dite ulama diskualifikasi joko widodo maruf amin,-1.0
1598,mata kalian kpuid buta jelas vulgar curang input tempat kaliankalian laku minta b,-1.0
1599,maklambeturah kpuid pramonoutan masabudiman kpuid salah input dibetul,-1.0
1601,ferdinandhaean efeknyaa goreng mengoreng opini ujungnya buat alih isu kecuramgan kerja kpu mass,-1.0
1602,ronnierusli kpuid dite cam kampre dite c aspal salah it,-1.0
1605,donadam zarazettirazr kpuid libur awal ramadhan,-1.0
1606,kpu kata tutup diri koreksi pihak kubu belah makin takut lihat data s,-1.0
1607,askos cayai kinerja kpu dibilang gila diatas gila,-1.0
1608,caya kpu independen hadap te utama invensi habib rizieq independensi hadap inv,-1.0
1609,rakyat korban uang pajak rakyat korban waktu tps rakyat korban dirinya nentu masa d,-1.0
1611,kayaknya tular visa kpuid suka nambahin sendiri ngurangin sendiri sakpenak wudele dewe,-1.0
1613,intelijen eks kopassus oasi cipta kondisi kpu curang,-1.0
1614,detikcom kasus salah input jadi banyak fungsi situng kpu udah beegeser jadi alat pr,-1.0
1617,hukumdan kpuid nulis setan laknatuloh,-1.0
1619,masbrewk arena kpuid tonton kecewa,-1.0
1621,ferdinandhaean sabar mungkin prabowo tunggu gerak gerik kpu,-1.0
1623,vivacoid tuduh curang kpuid makin masif brutal,-1.0
1625,ferdinandhaean udah diumum us kamu rusuh jalan tor kpu pake s,-1.0
1628,rakyat lapor salah input akunnya nah ditanggapi admin kpuid gilir hina ib habi,-1.0
1629,intelfpi sungguh berat tugas dipikul fpi awas hasil pemilu curang bantu,-1.0
1631,update real count pileg kpu mei pdip raup suara,-1.0
1632,kpuid halaahhh kaooo kpu hoax iak hoax,-1.0
1633,kpu maju trus pantang stop amp pantang mundur rakyat waras msih ttap mnunggu hasilmu jngan pedulikn mrka,-1.0
1634,putraerlangga dinodachi kpuid bawasluri buat kalian kpu dungu bodohkarna uang jabatanpasti,-1.0
1636,usah dite ble kegencet ketidakwarasannya sendiri harusnya diganti mundur semua k,-1.0
1637,jsrachman mediaindonesia prabowo nanya mngintimidasi nyuruh org jwb pake model paksa gitu a,-1.0
1638,dodylucas akuntofa rakyat ganti presiden suara rakyat ditilep kpuid emang komis,-1.0
1640,alas coba ang punya otak baik gitu maunya sihkalo curang tinggal lapor,-1.0
1641,vivacoid tp mayoritas media amp kubu jokowi trus giring opini masyarakat kpu tdk curang jokowi menan,-1.0
1643,ulama ajak masyarakat ciamis pangandaran tunggu ima hasil putus kpu,-1.0
1645,kpuid dasar munafikbilang tunduk prabowojelas,-1.0
1647,haikalhassan kpuid udah lama beeeeh habis coblos karna c foto udah dipegang sampe detik web,-1.0
1648,wiwismbecak ronnierusli bawasluri kpuid divhumaspolri fadlizon fahrihamzah banwaslu tidur d,-1.0
1649,hukumdan kpuid seret om,-1.0
1651,waduhh ngambek prabowo rekonsiliasi aceh gam prakarsa intah sby jk helsinki,-1.0
1652,vivacoid gk kacau brutal hancur situng kpu,-1.0
1653,syahganda situng kpu sengaja dibuat rentan manipulasi,-1.0
1658,kpuri bawasluri ditindaklanjuti bu langgar pidana pemilu sdh sgt je,-1.0
1659,bogabogas republikaonline lalai diprogramnya proteksi salah input dlm aplikasi situng kpu ind,-1.0
1660,berlama dgn entry data unfaedah diduga hindar silpasitung publikasi tdk bermanfaatpen,-1.0
1663,firdhanugraha kpuid kpu hebat dlm koar dg seringnya salah input tunduk pd pa,-1.0
1664,msapunya kpuid bawasluri trus tindak lanjuti opo ima doang lapor,-1.0
1666,situng mulai melambat signifi naik suara suara  situs kpuid kayaknya berat input,-1.0
1668,relawanpas ngehilawu gimana kpuid klaim curang bukti pihak sep,-1.0
1670,tsamaradki kpuid gilir protes pura budeg,-1.0
1671,zarafaul libra kpuid wr fagtng bangzul mulutnya ngeri kali coba tunju bukti video n,-1.0
1673,komnasham coba investigasi tinggal pemilu kata kpuid jokodut baik,-1.0
1674,geloraco jd tanya it t kalah sama kompu kasirnya indomaret salah input indomaret kasir bs teko,-1.0
1679,doradong dilacak ip adress server kpu aksess ip address server sbg intruder remot setel angka kpu,-1.0
1680,kpuid moga komisioner kpuid buta mata tuli telingay cara nyatakrn slma p,-1.0
1681,klau ang kpu tdk rasa curang yaa tinggal siap audit forensik bgtu dibuat ribet,-1.0
1682,tsamaradki ireneviena kpuid udah maki angmaki jelas kl kapeu berat belah,-1.0
1684,garuda analisamu wae mbah kpu wani menangke rayen ora mk wani ora yen ora wani yo wes paruh rakyat,-1.0
1685,server kpu hacker luar hackernya mungkin didalam,-1.0
1686,tuding bermasalah zon minta situng kpu dihenti via katadatacoid,-1.0
1687,banyak salah input data zon cek proses situng kpu ri,-1.0
1688,newsjundi bertemanm kpuid bawasluri bentuk tim tpf server kpu,-1.0
1689,ulama ajak masyarakat ciamis pangandaran tunggu ima hasil putus kpu,-1.0
1690,kkpgoid dude susipudjiastuti humaspsdkp lupa oknum kpu laku curang input data c tenggelam jg,-1.0
1691,kpuid klw bantah bantah sana tv tayang anak dasar kapeu,-1.0
1695,kpuid trus tunduk siapa cuk,-1.0
1697,greenblack bangpino masabudiman kpuid udah jelas keberpihanyakita sdh lu pura pura lg,-1.0
1698,rizmawidiono kpuid rijik siapa chat enaena ketauan us balik awokawokawok,-1.0
1700,be smart netizen edar broadcast media chat whatsapp isi konten gila nyata bareskrim mab,-1.0
1701,pesta demokrasi pesta ujung petaka indonesia tangis,-1.0
1704,massa emakemak bapakbapak jalan tuju tor kpu jakarta tadi siang tolak pemilu curang,-1.0
1705,bagai banding caya kpu data pantau suara nasional pilpres tanggal,-1.0
1707,oasi cipta kondisi kpu curang,-1.0
1708,bertemanm cuman kpu salah input padahal padahal,-1.0
1709,kpu kontrol kamu punya pindah pindah tempatotak kotor,-1.0
1711,hnurwahid kpuid hapus lghapuus lg hapuuuuuuus lg,-1.0
1712,sakit kpu tular,-1.0
1714,wes lapor ng kpu nomor dpt web kpu,-1.0
1716,ang tdk hrs tunduktp kpu hrs tunduk pd uu pemilu disitu sebut lalai pengitungan,-1.0
1717,kpuid kpuri sandiuno rockygerung marierteman fahrihamzah gerindra endangprs rakyat kecil bingung,-1.0
1719,lapor bawaslu bpn prabowosandi minta situng kpu dihenti,-1.0
1720,orangberiman tsamartsamar kpuid pakai duit cina sembayan kubur,-1.0
1723,kalau ang situng kpu salah input us nai tagar mohon ijin,-1.0
1724,alamakk bocah butuh menit bobol situs kpu,-1.0
1725,partaisocmed kingpurwa heraloebs pdemokrat ferdinandhaean alih isu fokus situng k,-1.0
1726,kpuid masabudiman masws viryanazis hsymasyari novidaevi pramonoutan ksetyawan salah i,-1.0
1728,kpuid masabudiman masws viryanazis hsymasyari novidaevi pramonoutan ksetyawan kalian curang,-1.0
1729,bpn prabowo sandi bangkit bawa bukti lebih salah input situng kpu it bpn desak bawasluri hentika,-1.0
1731,kpuid masabudiman viryanazis masws novidaevi hsymasyari pramonoutan ksetyawan kau kira rakyat,-1.0
1732,galihgading budigembok audit it kpu diminta bawaslu jurus rame nggruduk se,-1.0
1734,tsamaradki kpuid tanam mreka tuai,-1.0
1736,ferrykoto prabowo kpuid bongkar bangdi fb sdh rami goreng jelanta bekas,-1.0
1737,akhir salah hitung kpu tular sby bilang presiden haha mungkin kua,-1.0
1740,kpuid jangan bohong kau kpuentar tinggal silamsakit siksa kubur uang,-1.0
1743,yan frizarn ustadtengkuzul seluruh rakyat rakyat mana woee jangan kamu kata selur,-1.0
1745,kpu tolak mentah ijtima ulama,-1.0
1750,doncorleone kpuid sudahhh malessssss liat curang allah azablah dg sepedihnyajika,-1.0
1751,galihgading budigembok tgl diberi c bawaslu tgl lapor data bawaslu coba note berita kenap,-1.0
1754,abdulrachim coddamona kpuid moga allah laknat dukung curang,-1.0
1756,tsamaradki bangpino kpu sma bawslu sma ja udh jdi cbong uga susah rkyt ja mngrti gmna crangi,-1.0
1759,abdulrachim kpuid tugas kpu mengentry data c palsu hrs ditangkap palsu c palsu jg hrs ditangk,-1.0
1761,abdulrachim gmulbae kpuid moga allah swt laknat kalian laku curang hina kalian sehi,-1.0
1762,dyaraysari dapitdong hardcopy diberi kawan bpn bagai simbol bentuk nyata kl kpu bawaslu ni,-1.0
1765,abdulrachim kpuid asslm saudaraku abdul rahim screenshoot c palsu berhologram shere tks w,-1.0
1766,sanjaya maya jangan liat metro tipu mulu liat kpu salah input ribu kali udah cinta buta,-1.0
1767,abdulrachim kpuid moga salah input entah sengajatdk sllu tahu,-1.0
1768,abdulrachim kpuid salah input kata kpu jancoookk,-1.0
1769,abdulrachim kpuid bawasluri kalau c dipalsu salah entry tindak pidana,-1.0
1771,detikcom briziek siapa ente pake ngatur kpunoh urusin harim ente cundang lagu,-1.0
1773,fahrihamzah mungkin org kpu tiap hari doa minta ampun sm allah tdk bs hindar curang,-1.0
1774,tofa melpor duga curang it kpu cara resmi bawasluri lu kalau bantah pake analisa,-1.0
1775,real count kpu suram mak uwoo,-1.0
1777,mediaindonesia jadi uda kebukti blum klo kpu curang bang,-1.0
1780,suara bogor shared banyak keluh curang pemilu wakil ketua komisi i kunjungi kpu,-1.0
1781,twittizen sahred banyak keluh curang pemilu wakil ketua komisi i kunjungi kpu,-1.0
1784,kpu putus tunggu komando hrs,-1.0
1786,kpuid serius no bohong,-1.0
