,Unnamed: 0,Tweet,Scores
1318,2049,republikaonline hahahahahaada residivis rizieq mesum minta apapun hasil kpu penting prabowo dilantik jad,1.0
1319,2051,darurat curang kait c amp input data kpu aktivis tdk desak kpuid u tutup situng,-1.0
1320,2052,tutup situng komisioner kpu dijerat pidana pihak tegak hukum seret muka huk,-1.0
1321,2053,ronnierusli karniilyas ngk bklan berani mngka ny cuti pnjang padahal momen tepat mmbukti ku,1.0
1322,2054,impambudi fattuh kurang ilmu ilmu sehebat penemuandurianjika thn p,1.0
1323,2055,wiwindilevo akuntofa kpuid prabowo omdo emang hnya curangi rasa paling jujur padahal preettttt,1.0
1324,2056,om banyak gaul sama kpu hehee,1.0
1325,2057,tsamaradki sundaroe kpuid lu kpu tipu sana tipu,1.0
1326,2059,maulana kpuid nyinyir abis,-1.0
1327,2061,doradong ketua kpu manipulasi pikir rakyat ajak rakyat ikut dungu tonton mo,-1.0
1328,2064,kpu kaltim gelar doa sama tugas yangmeninggal,1.0
1329,2066,dolipsum pututekojati garuda kpuid kabupatenkota masuk semua jadi data,1.0
1330,2067,hasil final pacitan dasar hasil rekapitulasi kpupacitan selasa hingga rabu,-1.0
1331,2068,onnowpurbo lukah audit forensik it kpu turut g onnowpurbo,-1.0
1332,2069,putraerlangga kpuid bawasluri jokowi prabowo fakta lapangansuara bpk prabowo unggul menang,1.0
1333,2070,bangray akuntofa kpuid prabowo bukti curang untung dasar tkn dungu curang rugi,-1.0
1334,2074,partai demokrat tetap konsisten sama prabowo prinsipnya pd tinggal teman sulit pd,-1.0
1335,2075,hnurwahid kpuid jangan banyak cocok loe nur kalau ang bukti nyata lapor kamu pin goblokkkk,-1.0
1336,2076,abdulrachim satriawaniwan kpuid kpuid ikut libat dlm jahat pemilu palsu c,-1.0
1337,2078,tsamaradki kpuid baru join maksudnys,1.0
1338,2080,tsamaradki kpuid tamara baru bulan maret followers tiga ribu lebih how,1.0
1339,2082,baru bpn nama dukung penuh alhamdulillah,1.0
1340,2083,detikcom oalah rizieq bagai ulama dukung biayar cepat selesai malah elambat kalau,1.0
1341,2084,rqthea ev kpuid masabudiman viryanazis lihat dulu baru bicara,1.0
1342,2085,hasil hitung suara real count kpu pilpres sabtu mei suara jo via youtube,1.0
1343,2086,kpuid tetap semangat kpu sy cara pribadi tetap dukung kpu dlm selesai pemilu cara jujur a,1.0
1344,2089,makin dunguyg kalah sapa menang sapa hasil real count kpu msh langsung,1.0
1345,2093,gmeirza bentengnkri kpuid gdede cemar nama baik jokowi struktur sistematis masif,-1.0
1346,2095,fadlizon kla emang salah kpu letak salah coba bukti,-1.0
1347,2098,abdulrachim kpuid otak kalian palsu kpuid ehpudmelek pud lu melek,-1.0
1348,2100,ronnierusli trus layak jd pnentu rizik kabur anggar sangat transparan bs diaudit klo lu matamu,1.0
1349,2101,gureschannel suprisinto muhamma dahnilanzar gunanya relawan cong iksa hasil transparansi kpu,1.0
1350,2103,kpuid masabudiman masws viryanazis hsymasyari novidaevi pramonoutan ksetyawan pemilu paling parah maluin,-1.0
1351,2104,audit forensik sistem situng c jawab tepis stigma konspirasi kpu kuasa,-1.0
1352,2106,papihamlet priyobudis dargalang artikel hari dijawab kpu kabupaten blitar masalah tt,1.0
1353,2107,fadlizon advokatlk kpuid kyknya situngnya kpu pakai jin jin tsb ma tumbal sekuan ratus org kpps tinggal hhh,-1.0
1354,2110,kpuid iya benar kpu klo anak kecil bobol emg hoax paling msk akal tiap hari utak atik situs tsb,1.0
1355,2111,geloraco ap dgn rezim kpu,-1.0
1356,2112,hoax mendegilitimasi kpu report postingan report gtgt,-1.0
1357,2114,imayadewi ireneviena kpuid kpuid beda mana klo salah batas nyaklo batas namany,-1.0
1358,2120,putraerlangga kpuid bawasluri lihat jadi laku jujur adil tiap daerah provinsi s,1.0
1359,2121,msapunya kpuid bawasluri prof m bilang data masuk ksalahan data mas,1.0
1360,2122,ayiepnano pras jackvardan kumpar c plano babinsa dijadi bukti hukum prosesnya y,-1.0
1361,2124,doncorleone kpuid ang mendisain umat balas brutal alas te,-1.0
1362,2127,namakuella detikcom trz caya kpu bukti curang waras,-1.0
1363,2128,revisi jawa barat kota sukabumi lembursitu situmekar tps hasil pindai dihapus situng kpu,1.0
1364,2129,catat kpu salah entri data situngpemilu,-1.0
1365,2130,ustadtengkuzul mending ngitung tug togel ajah lbh teliti jeliketimbang wkwkwkwkwk,-1.0
1366,2131,hoax mendegilitimasi kpu report guys report gtgt,-1.0
1367,2133,kunjungi kpu zon cek situng sering salah input bekasi online,-1.0
1368,2134,doradong suai kicau lama pakar itb sebut situng dikendali intruder sebut be,-1.0
1369,2135,moslimcommunity guru besar ui kpu layak jadi hasil pemilu,1.0
1370,2137,mulai keturan visa kpu sm prof jahit baju moga prof hidayah moga sehat sll salam sejahtra,1.0
1371,2139,kunjungi kpu zon cek situng sering salah input,-1.0
1372,2144,doncorleone kpuid kpuid salah input lampir c palsu,-1.0
1373,2149,hitung cepat diprotes sekarang situng diprotes wakil ketua dpr waketum gerindra zon kata,1.0
1374,2150,minggu lebih pasca coblos bs salah input us gini kpuid logiy kalau ang human error or syst,-1.0
1375,2151,bawa bukti lebih salah input situng kpu relawan it bpn desak bawaslu henti situng kpu,-1.0
1376,2152,kpu tunduk rizieq,-1.0
1377,2154,massif salah situng kpuid sinting fb pakar it univ airlangga prof soegianto soelistiono,-1.0
1378,2156,cyberarmy rumijombang sekedar ucap mana tanggepin sama kapeu meski istigjfar juta kali,1.0
1379,2157,kpuid hoak salah input tiap hari wkkk,-1.0
1380,2160,situng kpu dinilai tambah kacau brutal viva kacau brutal liar,-1.0
1381,2161,syarman bawasluri kpuid curang kecut ikut atur pemilu disqualifikasi,-1.0
1382,2163,acc muliyopioneer donadam salehug kpuri curang matamu picak,-1.0
1383,2164,ferrykoto prabowo kpuid sangkal salah input bah kubu yata temu rib,-1.0
1384,2165,saracenofficial gawat banyak surat suara coblos setan kpu mnyelesainya lalu m,-1.0
1385,2167,buram sumber situng kpuid jelas sumber,1.0
1386,2168,revluf wah dipilih kpu ngumumin rasa,1.0
1387,2169,sis situng kpuid semua angka pake discount ansalah input lahtanya anak sd alaz,1.0
1388,2170,suai capai kpu partisipasi pilih pemilu garut gosip garut via gosipgarut,-1.0
1389,2171,kpu doang salah input taunya toanya wkwkwkwkwk,-1.0
1390,2172,maspiyuuu lisaamartatara kpuid makhluk biadab laku cela bongkar,-1.0
1391,2174,mantap bang nahra akuntofa bongkar us kasus salah input jumlah dilaku kpu menger,-1.0
1392,2175,kpuid masabudiman novidaevi hsymasyari viryanazis masws pramonoutan ksetyawan tdk malu bn,-1.0
1393,2177,sorry satu foto nyangkut ni lanjutannyakeburu hapus kpu hasil pindainya,-1.0
1394,2178,edan bener mulai bawa kabur kotak suara kpu sendiri udah kontaminasi sekarang berhara,-1.0
1395,2179,mantap betul dukung jokowi prabowo ikrar bareng bakal hormati keputusankpu,1.0
1396,2180,dpr wakil bpn ketua cek kesiapan rekapitulasi hitung suara kpu tps pimpin moga alhamdulilah benak,1.0
1397,2182,jasonbourne abiyyu cakkhum kpuid bangpino putrabanten maulanatigor mbahuyok eh abiyyu tolol kapan r,-1.0
1398,2185,salah input dilapor bpn semua rugi suara dibali salah input naik suara,-1.0
1399,2187,akunny resmi biru atas nama lembaga negara kpu like cuitan buzzer paslon cuitanny ngejekin hrs,1.0
1400,2188,koyo kpu wae salah us matamu,-1.0
1401,2191,jangan provokasi sama berita aneh biarin divhumaspolri kerja ikut komen masalah ibukota pinda,-1.0
1402,2193,kpuid masws jijik kali lihat kau kau kira kau it,-1.0
1403,2198,imakasih warga purwakarta jabar kalian pilih pimpin dipilih ulama insyaallah berkah,1.0
1404,2199,aplpangeran kpuid bawasluri mungkin krn lama nyangkul sawah jd begini mulutnya penuh bohong,-1.0
1405,2201,rmolco panca kpuid salah input situng bu arti curang situng rupa alat bantu hasil situng jug,-1.0
1406,2202,rini bong cek pengen menang main curang cek kata curang amp brutal klo kamu waras web kpu,-1.0
1407,2203,tembangsunyi padioyan begini mas prabowo kpu ang stop oknumnya diusut dimasu penjara da,-1.0
1408,2204,tembangsunyi padioyan kpuid meng upload c dipalsu bu curang,-1.0
1409,2205,newsjundi bertemanm kpuid bawasluri bongkar,-1.0
1410,2206,zarafaul libra kpuid wr fagtng bangzul cebong ngomong akal sehatnya,1.0
1411,2212,siivyriau laknat allah mampus kpu curangi suara rakyat,-1.0
1412,2213,oppositelinks hannaalawiyah kpuid bawasluri divhumaspolri kalau jumpa x bunuh rame,-1.0
1413,2214,hadddeh efek bakawan jo cebong kunjung kpu salah input gaek ko haaa sby tu p,-1.0
1414,2217,datang kpu zon cek cara kerja situng kpu via post,1.0
1415,2218,mantabbb daerah sianp nyusulgera pasang baleho didaerah menang prabowosandibiar jelas tulis,1.0
1416,2220,hati banyak alih isufokus kinerja kpu lengah dikit tewas taulani mahfud omdo,-1.0
1417,2221,kpu tunduk pihak manapun so stop bilang kpu curang,-1.0
1418,2222,jadi gua baca salah satu media statement gini tahu janggal jumlah tugas kpu meni,-1.0
1419,2223,tetappancasila tunggu umum resmi kpu semua pihak harap tahan diri,1.0
1420,2225,zaein relawanprosandi bawasluri kpuid fahrihamzah msaiddidu faldomaldini cakkhum kalau rasa me,1.0
1421,2230,gerindra selalu hajar kpu lupa curang tim paslon mulai kepala desa kepala daerah kampanye,-1.0
1422,2233,charlespambers keyce stop pemilu bubarin kpu atw korban kpps tinggal makin tambah,-1.0
1423,2234,said aqil kata kpu caya,-1.0
1424,2235,audit bentuk tpf kpuid lu pake duit rakyat bu duit toko mebeul,-1.0
1425,2236,haikalhassan msaiddidu kpuid lalu gk bs beda angka dgn,1.0
1426,2238,doa revisi nyata revisi situng kpu revisi naah ckckk,1.0
1427,2239,tegar ikhlas ima putus kpu apapun hasilnya tgl mei,-1.0
1428,2241,kpu kata tutup diri koreksi pihak,-1.0
1429,2242,stop pemilu bubarin kpu atw korban kpps tinggal makin tambah mediaindonesia andiarief,-1.0
1430,2244,aplpangeran jokowi kpuid bawasluri hehey apakn segera mampus sendirin,1.0
1431,2245,salah input situng kpu sentase kitar salah input koq banyak banyak,-1.0
1432,2249,selisih suara jumat mei kpu tps kp tps jumat,-1.0
1433,2252,gundidr jangan mampu kpu dlm manipulasi angka diajari prof,-1.0
1434,2253,kalengi wahai kpuid kpuri bawasluri audit c tetap laku manipulasi data,-1.0
1435,2254,selisih suara kpu tembus alhamdulillah,-1.0
1436,2255,detikcom gimana gag sakit te cara psikis akibat kubu sdh x deklarasi menang sbg presi,-1.0
1437,2258,hasbunallah jayabay justru kalah mangya iak hasil innal tanya rekapan,1.0
1438,2259,palsu c cara brutal utk menanghina jorok cara kalian main,-1.0
1439,2261,tribunnews pecah belah masyarakat kpu jujur ribu kali salah input lebih tepat sengaja,1.0
1440,2262,allah baiki kpu input jadi input jadi ke,-1.0
1441,2263,audit bentuk tpf kpuid lu pake duit rakyat bu duit toko mebeul,-1.0
1442,2265,seahnegri emang kpuid sdh nyata menang,1.0
1443,2266,lebih salah input,-1.0
1444,2268,tugcendol akuntofa mestinya kpu setop situng jadi menang lebih hormat akui pe,1.0
1445,2269,pegawe kpu jam segini pulang besok jadi bener jam segini belom pulang sam bener,1.0
1446,2270,indrafathur aburizalbakrie logiya klo salah ciuramg dn disembunyi taku,-1.0
1447,2274,nahcair milyar kpuid kabar barutim it bpn prabowo sandi bongkar atur entry data web kpu da,-1.0
1448,2275,layak gelar hormat sbg bapak pancasila krn dgn penuh yakin nyata,1.0
1449,2276,hanmas prabowo hasil akhir c manual jenjang hitung manual kpu menang telak saksi,1.0
1450,2277,imayadewi kpuid hasil pemungutan voting urut mba tp bkn urut suara tbyk atas,1.0
1451,2280,segera sadar keluarlah kolam sebaikbaik rekayasa hny miliknya mrp ingat kpuid kalian,1.0
1452,2282,fadlizon kpuid skrg gantian dong bawaslu cek tempat rekap ghoib bpn,1.0
1453,2285,kpuid ciyuusss curiga akun dibajak,-1.0
1454,2286,ngg msk akal bila nuduh kpu curangnya coz masyarakt bs temu ksalahn,1.0
1455,2288,bbmcargo toyopah aryprasetyo kpuid bawasluri jokowi mylovenebe bu akuuuu lueis dadak jadi ngulama,-1.0
1456,2289,mention akun rakyat drpd kpuid bawasluri tugas lapor sdh dilaku bpn,-1.0
1457,2291,msuk akal bila nuduh kpu curangnya krna masyaralkat bs temu ksalahn,1.0
1458,2292,riyadiatmodjo relawanprosandi bawasluri kpuid fahrihamzah msaiddidu faldomaldini cakkhum dungu ang ng,-1.0
1459,2294,ikut update real count sistem informasi hitung suara situng kpu suara pilpres jumat hingga,1.0
1460,2295,arlexwu kpuid wuaaduuuhhh sekelas mmdbisa salah fatalya push,-1.0
1461,2298,hnurwahid kpuid c banyak ngincarhati main camat,1.0
1462,2301,nggal msuk akal bila nuduh kpu curangnya bcoz masyrkt bs temu ksalahn,1.0
1463,2307,musniumar zulkifllubis pemiluupdate profudah kali sy beritau amp bukti kalau mrk sableng amp da,-1.0
1464,2310,ora suk akal bila nuduh kpu curangnya karna masyrakat bsa temu ksalahan,1.0
1465,2312,asdwin zarazettirazr tehtjemplung lisaamartatara nadiku menang telak jawa barat jawa timur dki,1.0
1466,2320,powerofreceh kpuid bawasluri bppri kalian mana sdah tdak hukum tegak negr,1.0
1467,2324,wijayaento kpu kagak sadar kalau jam segitu belah dunia segar bugar fit pelotot ha,1.0
1468,2326,kpu sadar situs kpu dihati us jam ahliahli statistik r,1.0
1469,2330,nalimnr arincattleya neonetizen loembok ane bantu viral status wa ane neeeeh trus group wa wkwk,-1.0
1470,2336,pleno gini jadi dasar akhir pleno rekap hitung manual kpu pusat,1.0
1471,2337,kpu awalnya suka salah sengaja ceroboh begini datang cean,1.0
1472,2340,deddyferdana tugcendol akuntofa jelas proteslahkpu cuman nunggu kirim,1.0
1473,2342,dijadi dialat sbg stempel sah menang hampir diumumksn sbg peme,1.0
1474,2344,suasana buka rekapitulasi tingkat kabupaten hari tama gor pdam dibuka komis,1.0
1475,2345,sbsinews ijtima ulama tuduh jadi curang jahat pemilu ulama dukung prabowo,-1.0
1476,2346,ijtima ulama minta kpu diskualifikasi joko widodomaruf amin acara disebut mendelegitimas,-1.0
1477,2347,kpuid masabudiman masws viryanazis hsymasyari novidaevi pramonoutan ksetyawan salah input,-1.0
1478,2351,kpuid riskameliaag bicara benar,1.0
1479,2352,kpu mana sadar benar dikalah,1.0
1480,2353,sebuah busuk nama ijtimak ulama mrk sebut ustadz cebong tdk ikut ikut hrs caya curang kpu walaupu,-1.0
1481,2355,kakaisyah follow akun twit chloetowntale kak moga buka mata amp hati ttg salah input it kpu,-1.0
1482,2358,laman situng kpu lihat jarak suara jokowi maruf prabowo sandi makin jauh,-1.0
1483,2360,kpuid salah infut misal jadi jadi malu emang ente matematika sd dulu,-1.0
1484,2362,sejak mahfud md datang kpu gk idola buat alam jadi indonesia,1.0
1485,2365,jelas kpuid prov jawa barat kotakab kota sukabumi lembursitu kel situmekar tps,1.0
1486,2367,kpu sebut salah input data situng beda curang,-1.0
1487,2368,aburasyid dulatips kpuid bawasluri bawasluri diam gerak mending lempar dang macan,-1.0
1488,2369,insya allah senin besok mulai puasa ramadhan dgn mohon maaf lahir batin moga semua menjalank,1.0
1489,2370,ferdinandhaean bunya demokrat tdk tuju cara konstitusional mas ahy ima keputusa,1.0
1490,2373,orangberiman monotkun kpuid pecinta one piece tpi klo salah joker kalah sama aliansi anggap d,1.0
1491,2374,kpuid masabudiman masws viryanazis hsymasyari novidaevi pramonoutan ksetyawan penghianat rakyat,-1.0
1492,2376,sumpah gua kira prabowo udah menang tiba minta jokowi didiskualifikasi ancur total tu otak,-1.0
1493,2381,bener berita ane sangat apresiasi kali sikap bijak mardanialisera benar pemilu usai skrg,1.0
1494,2386,innalillahi wa rajiun pemilu bencana alam kpu tugas kpps tinggal dunia jadi,-1.0
1495,2387,bravo kpuid jangan tunduk provokasi kelompok tunggang kpu,-1.0
1496,2388,tsamaradki putriocto kpuid gemeesssssandai punya kuat kaya thanos udah ilangin kep,1.0
1497,2389,siahaanjohan aplpangeran jokowi kpuid bawasluri lebih baik bethot kacuke mesum,1.0
1498,2391,partaisocmed kpuid tunduk trending topics riziek,-1.0
1499,2392,newzepret kpuid bawasluri mantap suroboyo,1.0
1500,2393,movement gerombol prabowo makin bingung seru jokowi didiskualifikasi sekarang tuduh kp,-1.0
1501,2394,tuduh curang kpu bkn penggiringan opinismua pnya buktiwjar mgnggap fitnahhoax dsbkrna set,-1.0
1502,2395,engkongjali pdemokrat demokrattv kpu salah input kong,-1.0
1503,2398,kpuid masabudiman masws viryanazis hsymasyari novidaevi pramonoutan ksetyawan jadi sampah suara ra,-1.0
1504,2399,masbrewk ahmadchm kpuid sangat sedih tindak sebuah gagal awal tahun,-1.0
1505,2400,abiyyu putrabanten kpuid cakkhum proftamburin zarazettirazr maulanatigor lisaamartatara nampak kali bangsat,-1.0
1506,2401,ustadtengkuzul zul tlg hitung lihat pd data realcount kpu dihitung jumlah provinsi dim,1.0
1507,2402,titojalu lebih lillahi,1.0
1508,2403,dear aagym bilangin hrs kali hrs bohong tps kel petak kaja gianyar gian,-1.0
1509,2404,kesalahaninputdata baik malah makin bertambahtambah kesalahanya situng kpu dinilai tambah kac,1.0
1510,2406,hoax matamu nasa jebol kpu kalau beneran hoax buat nyata tv laa wooo,-1.0
1511,2408,arifahmd titusekowibowo detikcom kpuid fadlizon fadlizon sekarang tugasnya berat brow jagain baliho,-1.0
1512,2409,dear aagym bilangin hrs kali hrs bohong katanya suara jokowi kpu tu,-1.0
1513,2410,dear aagym bilangin hrs katanya suara jokowi kpu suara masa tanah suci boh,1.0
1514,2416,putriidachan kpuid sy doa ngomonghilang suaranya curang suara rakyat,-1.0
1515,2417,cek website kpu nyata beneran riziek tug ngibul ngibul mekah azabnya yah kesamber petir,-1.0
1516,2419,maulana kpuid klw sy gk heran kpuid bawasluri rosisilalahi kabarpetangone k,1.0
1517,2420,arlexwu kpuid lahan allah swt mulai tunjuk kuasanya,1.0
1518,2421,ha ha uplod c palsy jg bilang curang ye kpuid nanyaa,-1.0
1519,2422,gelar ulama habib tanah suci mekah us bohong gimana aagym cek yah website kpu ps,1.0
1520,2424,zaein relawanprosandi bawasluri kpuid fahrihamzah msaiddidu faldomaldini cakkhum masa,1.0
1521,2426,kpuid kalau benar begituallohuakbarallohuakbatallohuakbarsemoga kpu benar benar amanahdan i,1.0
1522,2428,cek yuk website kpu benar suara jokowi diubah jadi yah ampun habib riziek shihab nyata berbohon,1.0
1523,2429,faoezanmuhamma basyaalika rockygerung hhhhhh makin jlas otak kebolak balik lhooo tooong bener kata,-1.0
1524,2430,banyak enam tugas kpu kaltim tinggal dunia sakit,-1.0
1525,2434,gontaliem ferdinandhaean kpuid yakin berani divhumaspolri ccicpolri,1.0
1526,2435,kpu pasti setop situng,1.0
1527,2436,ardiriau hukumdan kpuid gw seneng bang ardi selalu fight dlm segala sekaligus tahan banting,-1.0
1528,2440,lexyon ustadtengkuzul susah jelasin kl prcaya dg kpu pdhal realcount kpu sdh bs dihitung seme,-1.0
1529,2442,lelahmu bayar presiden real count kpu jalan dg unggul petahana,1.0
1530,2443,tsamaradki kpuid asli caya neng tsamara coba stasiun tv undang talk show gitu cara,1.0
1531,2445,komplek mega mai mana suaranya salah input kpu tps lurah padang sarai komplek mega mai k,-1.0
1532,2446,saracenofficial rusydiriau kpuid sehat,1.0
1533,2447,kpu nyata prabowo menang bengkulu caya kpu kpu nyata jokowi menang pilpres caya kpu,1.0
1534,2449,kpu oohhh kpukenapa c palsu kau gunamedan amplasjgn macam macam kau kpu,-1.0
1535,2450,hasil situng kpu jokowi unggul,1.0
1536,2452,bingkai hbs kpu cinta allah swt,1.0
1537,2456,prof m mahfud md nilai kpu tunjuk sikap profesional buka transparan selenggara,1.0
1538,2457,doncorleone kpuid dibilang salah input data niat curang dasar malu muka tembokkpuid,-1.0
1539,2458,kpuid klo baiki cara ngitungmu kalian dianggap curang,-1.0
1540,2460,zarafaul libra kpuid wr fagtng bangzul hati hati tar viral lho krn tetap hukum u,1.0
1541,2461,newsjundi kpuid bawasluri namanya kpu kerja penuh ulok,1.0
1542,2462,tsamaradki kpuid langsung akunnya buat cek nyata benar,1.0
1543,2464,kpu punya tugas berat sdg jalan tugasnya doa amanah dlm tugas amp selalu diberi sehat imakasih,1.0
1544,2466,masyarakat digiring cayai kpu alas kpu curang fakta komisioner dipilih ditetap ole,-1.0
1545,2467,anggota kpu dipilih dpr bagai partai dalamnya partai sebut jg koalisi dgn paslon capres baik,1.0
1546,2468,kalau puas kinerja kpu jangan klaim menang lapor ang curang,-1.0
1547,2470,dargalang priyobudis tps alas copy kubu sdh kongkalikong dng kpu minta c asli isi palsu,-1.0
1548,2471,masifaturohmi yennynuraziza glrhn zoelfick seminggu mata lihat anak banyak tinggal gara kal,1.0
1549,2474,kpuid sistem aman rendah kpu andai syaimbara milyar jebol situs kpu gw ikut syaimbara,1.0
1550,2475,detikcom transparansi peneanpemilik kpu,1.0
1551,2477,quick count ditolak zongos minta real count dihenti krn resah bakal hp layang,-1.0
1552,2480,ainunnajib meilany abdulrachim kawalpemilu fadlizon fahrihamzah akuntofa ainun masa kes,1.0
1553,2483,imayadewi ireneviena kpuid salah input ulang kaliitu namanya blooooooon,-1.0
1554,2484,kurang kpuid lengkapi jd kesalahanbiar setan seneng,-1.0
1555,2486,ardiriau hukumdan kpuid hajar uda duangsekalian hancur akunnya,-1.0
1556,2487,makin tua makin pikun presiden siapa proflol otak mu sama kpu kpuid an,-1.0
1557,2494,mochherianto ynkz satu janda dicerai suaminya mulutnya suwek koar nuduh kpu cu,-1.0
1558,2495,jasonbourne abiyyu cakkhum kpuid bangpino putrabanten maulanatigor mbahuyok eh abiyyu tolol,-1.0
1559,2499,kpu baik bawaslu betul betul jujur adiljgn pihak baik,1.0
1560,2500,lawanintolerans kpuid udah nyinyir sama pps,-1.0
1561,2501,cnnindonesia turut bpn ribu baiknya mmg audit it kpu susah prinsipnya,-1.0
1562,2503,admin kpu suka twit semvak huni kolam curiga admin ngincer kursi jaksa agung kek kapitra,1.0
1563,2505,care keluh nunggu hasil kpu yah,-1.0
1564,2506,bongkar siapa bongkar hadih mudik geratis negara batavia,-1.0
1565,2507,kpuid rata komentarnya kpu baik ngaca,1.0
1566,2509,tular salah input kpu prof prof,-1.0
1567,2512,kpuid salut buat kpu,1.0
1568,2513,kpuid jangan kpu hnya lapor curang dg tindak lanjut berita curang sebar krn tdk s,-1.0
1569,2516,jangan harap damai pihak jutru seharusnye damai malah ikut pantik tikai kpu jujur,1.0
1570,2517,baik bakar kl eneg lihat kelakuaan mrk sengsara jg kl petahana nyata menang,1.0
1571,2519,ditanya soal curang pendemo kpu diy bawa data,-1.0
1572,2520,ismantengku prabowo sandiuno kpuid bawasluri kalau liat bgt cpt masivenya entry data salah it kpu,-1.0
1573,2522,monikaalif menang sudahkah putus menang mk menang quickon menang salah input kpu menang curang,1.0
1574,2524,andiarief sy yakin curang kalah prabowo menang krn kpu sengaja lambat pengitungn,1.0
1575,2525,mengkhabar intah bahas lebih lanjut soal rencana pemindahanibu kotake luar pulaujawa rencana pemind,-1.0
1576,2526,fbu muslimpribumi kpuid kpuri bawaslu upaya legitimasi stigma caya lembaga qc sdh seha,1.0
1577,2529,kalau salah input kali wajar ribu kali bossini jahat luar biasa kpuid nah te,-1.0
1578,2530,chloetowntale kpuid bro chloetowntale situ cermat taktis banget yak nemu begini,1.0
1579,2531,maaf saudaraku numpang tanya masuk salah entri data masa baru jadi jubir,1.0
1580,2533,posisi satu diberi sayangnya kpu kata jokowi aka,-1.0
1581,2535,prof m mahfud md nilai kpu tunjuk sikap profesional buka transparan menyelen,1.0
1582,2540,wiwismbecak cakkhum bawasluri kpuid divhumaspolri fadlizon fahrihamzah curang busuk ad,-1.0
1583,2541,kpu catat salah entridi situng pilpres,-1.0
1584,2544,donadam relawanprosandi sy jg bingung masuk akal utk prabowo lbh unggul stengah jmlah provinsi tp,1.0
1585,2546,temu presiden jokowi ahy harap semua pihak dewasa sikapi hasil resmi kpu siaransbertemupresidenjokow,1.0
1586,2548,tular kpu jd slh inputkoreksi lg paksby presiden kberapa,-1.0
1587,2552,kpuid lidah tulang tuan omong jadi beda realita,1.0
1588,2554,bawa bukti ribu lebih salah input relawan it bpn desak bawaslu henti situngkpu,-1.0
1589,2555,drkoko stop situng seret komisioner kpuid adil pemilu bohong rakyat m,-1.0
1590,2556,kpuid salah inputsuara prabowo trs dikurangi kpu jngn main bodohi rakyat,-1.0
1591,2558,baik pilih org baik komentar selamat kpu laksana pemilu jurdil viva,1.0
1592,2559,ardiriau gara dekat dgn kpu bro jd salah input dehhehehe,-1.0
1593,2560,diantara dana ima kampanye paslon sumbang masyarakat sebesar m serah lppdk kpd kpu m,1.0
1594,2563,iqrozen akuntofa kpuid horee tinggal ngambil milyar lupa sedekah yee,-1.0
1595,2565,vivacoid te contoh sekarang kpu dite ulama diskualifikasi joko widodo maruf amin,-1.0
1596,2567,mata kalian kpuid buta jelas vulgar curang input tempat kaliankalian laku minta b,-1.0
1597,2569,maklambeturah kpuid pramonoutan masabudiman kpuid salah input dibetul,-1.0
1598,2571,masyarakat ciamis pangandaran masuk dukung capres nomor urut diminta sabar tunggu hasil real count k,1.0
1599,2572,ferdinandhaean efeknyaa goreng mengoreng opini ujungnya buat alih isu kecuramgan kerja kpu mass,-1.0
1600,2573,ronnierusli kpuid dite cam kampre dite c aspal salah it,-1.0
1601,2578,dodylaksmito kpuid bawasluri dkppri fokus lawan curang sama krn data direkayasa m,1.0
1602,2580,assala mualaikum kpu bawaslu jujur adil pemilu presiden wakil presiden,1.0
1603,2581,donadam zarazettirazr kpuid libur awal ramadhan,-1.0
1604,2583,kpu kata tutup diri koreksi pihak kubu belah makin takut lihat data s,-1.0
1605,2585,askos cayai kinerja kpu dibilang gila diatas gila,-1.0
1606,2588,caya kpu independen hadap te utama invensi habib rizieq independensi hadap inv,-1.0
1607,2589,rakyat korban uang pajak rakyat korban waktu tps rakyat korban dirinya nentu masa d,-1.0
1608,2591,kacau banyak jadi beda hasil pleno vs situng kpu,1.0
1609,2592,kayaknya tular visa kpuid suka nambahin sendiri ngurangin sendiri sakpenak wudele dewe,-1.0
1610,2594,abiyyu cakkhum kpuid bangpino putrabanten maulanatigor mbahuyok sy kasih caption petaka jempol kpu,1.0
1611,2595,intelijen eks kopassus oasi cipta kondisi kpu curang,-1.0
1612,2596,detikcom kasus salah input jadi banyak fungsi situng kpu udah beegeser jadi alat pr,-1.0
1613,2598,alhamdulillah hr sdh selesai rapat pleno buka hulu sungai utara kalsel hasil resmi kpu,1.0
1614,2599,dpt sosialisasi logistik jadwal kampanye coblos hitung bla bla bla omongkosong s,1.0
1615,2600,hukumdan kpuid nulis setan laknatuloh,-1.0
1616,2602,adraantau kpuid bawasluri yakin mas,1.0
1617,2603,masbrewk arena kpuid tonton kecewa,-1.0
1618,2605,senanglemak bunya sampe atas atas bawaslu kpu dkpp yes wkwk,1.0
1619,2607,ferdinandhaean sabar mungkin prabowo tunggu gerak gerik kpu,-1.0
1620,2610,apresiasi transparansi kpu jokowi maruf unggul probolinggo,1.0
1621,2613,vivacoid tuduh curang kpuid makin masif brutal,-1.0
