,Tweet
528,saya datang untuk pasti butuh warga dampak bencana penuh sebab bencana banjir bandang di lebak seperti pe
529,dpw pkb jakarta belum lihat langkah konkrit anies antisipasi banjir susul
530,kirim 5 mobil bantu barang untuk korban longsor dan banjir bandang di sukajaya bogor biar jalan yg jau
531,kirim 5 mobil bantu barang untuk korban longsor dan banjir bandang di sukajaya bogor biar jalan yg jau
532,sama mas ifan sempat papar scr lebih detail apa yang jadi dengan banjir jakarta kemarin kepada pak djali
533,tuhan ga sekali kelen gugat gitu biar lebih greget wow nya atau noh gw kasih saran proyek kereta cepat juga sekali
534,nenek 71 th tinggal dlm rumah sendiri di green ville blok bn pas banjir kemaren viralkan biar sampai ke mendagri pak
535,dulu lbh jakarta kritis hadap jokowi lbh jakarta jadi tanggung jawab aksi cor kaki yg tinggal dunia saat demo ganja
536,pasca koordinasi rutin kendali operasi darurat banjir longsor di jakarta jabar banten di menteng raya 62 jakart
537,anies sebut banyak 85 persen wilayah jakarta tidak landa banjir salah satu wilayah kemang jaksel fakta keman
538,wagimandeep kasihan ya juang nya sampai jungkir balik gara2 banjir
539,surprise gubernur aniesbaswedan datang resepsi nikah di rumah yg sempat dampak banjir di rt 0307 lurah
540,banjir bandang landa jumlah desa di lebak banten di awal tahun 19 sekolah dan 1410 rumah rusak ribu warga ungsi
541,bangun2 ada kasus jakarta banjir tidur besok ada isu perang dunia tiga abis itu bakar di australia dajjal2 je
542,banyak 12 perintah daerah tetap status tanggap darurat telah landa bencana banjir dan longsor
543,luar biasa pak basuki menteri puprbasuki hadimuljonotelah terjun 285 pegawai ke 180 titik banjir selam
544,dki jabar banten area hulu dan hilir masingmasing punya tugas kait banjir bekerjasama dengan perintah pus
545,senin 6119 hadir wakil ketua dpr ri gus muhaimin sambut ketua rt013 dan jumlah warga korban banjir sama ketua
546,jalin silaturahmi ko5 ariekei2171 indr1wh13n4 untukmu25 andhihatta masgr prof3song rennyd2019 sakuralover2 r
547,banjir bandang landa jumlah desa di lebak banten di awal tahun 19 sekolah dan 1410 rumah rusak ribu warga ungsi
548,kerja proyek kereta cepat indonesia china kcic buat salur air di ruas tol sumbat so ini salah siap
549,banjir jakarta bakar hutan di australia mungkin ww iii masalah pulau natuna dan laut cina selatan ria ir
550,giat cek dan kontrol debit air sungai di camat halong waspada bencana banjir senin malam 06012020
551,beneran kayak parasite kalau dipikirpikir jakarta banjir dan timpang yang nyata
552,anggi gak boleh sedih lagi karena banjir adalah musibah yg datang dari yang maha kuasa kita harus tetap selalu tabah dala
553,surprise gubernur aniesbaswedan datang resepsi nikah di rumah yg sempat dampak banjir di rt 0307 lurah
554,giveaway pulsaovogopay buat 3 orang karena banjir udah surut dan alhamdulillah ip ku smt5 di luar ekspektasi bener
555,igjinyoung94 gabakal ksih tu mentab oppa tanpa banjir bandang dr akuu
556,cara citra aniesbaswedan ini sdh terlalu kasar amp norak dia pilih sbg gubernur bukan untuk jadi tukang sampah justr
557,salur air kampung yg guna trashblock nyaring sampah untuk cegah sumbat salur dan banjir
558,waktu di ilc saya tidak akan jawab kata dengan perkataantapi saya akan jawab tanya sebut dengan kerja
559,banjir bandang landa jumlah desa di lebak banten di awal tahun 19 sekolah dan 1410 rumah rusak ribu warga ungsi
560,akan tingkat intensitas tega hukum kait kelola sampah yang masih belum kelola dengan baik
561,guys barangkali ada keluarga tetangga kerabat dampak banjir yg butuh bantu sabun mandi aku ken bantu den
562,banjir jakarta hari ini presiden jokowi selamat warga nomor satu
563,analisis lebih dalam banjir jakarta utas ini buat untuk jabar analisis cara lebih dalam kait banjir j
564,lundaye1 thearieair wagimandeep sondoromusic dodykasp3mdprb ktoucgh timungsurjo ferdibillah indra03158937 yed
565,banjir fpi longsor fpi bakar fpi fpi lagi fpi lagi gaji ga bayar ga memang ikhlas nya radikal bupati
566,salah satu desa yg lewat rawan pks bogor saat tuju lokasi isolir dampak banjir bandang di kp sarongge desa cisarua
567,poskokemuning halo saya bencana bot untuk lapor banjir di sekitar sila balas dengan
568,yaallah ini semarang deres bgt hujan moga ga banjir kaya jakarta yaallah
569,twitter please do your magic aku minta bantu ke kalian semua buat temen kampus ku yang kena banjirlongsor rumah ru
570,era ahok lebih parah ya apalagi era jokowi gubernur korban tewas banyak padahal curah hujan lebih kecil
571,nenek 71 th tinggal dlm rumah sendiri di green ville blok bn pas banjir kemaren viralkan biar sampai ke mendagri pak
572,jelas yang sangat baik tentang banjir jakarta dari remaja usia 17 tahun saskia gladys cerah
573,banjir bandang landa jumlah desa di lebak banten di awal tahun 19 sekolah dan 1410 rumah rusak ribu warga ungsi
574,makanya jaga bacot lo dennysiregar7 kemarin lo bilang kirim bu risma ke jkt soal banjir pasti beres noh jawab
575,tangan dulu apa sebab banjir itu jangan salah yg lain misal kalo udh d tutup itu tempat maksiat dan penyeb
576,dennysiregar7 hajar terus pokok nya jgn sampe aniesbaswedan naik nama nya banjir moment kita hancurin nama nya a
577,banjir bandang landa jumlah desa di lebak banten di awal tahun 19 sekolah dan 1410 rumah rusak ribu warga ungsi
578,banjir bandang landa jumlah desa di lebak banten di awal tahun 19 sekolah dan 1410 rumah rusak ribu warga ungsi
579,banjir bandang landa jumlah desa di lebak banten di awal tahun 19 sekolah dan 1410 rumah rusak ribu warga ungsi
580,ibu2 muslimat ini sungguh luar biasa militansi tuk manusia tak perlu ragu kawal banser kab lebak ibu2 ppmuslim
581,aagym tidak semua laki laki salah pada contoh aku mau komentar tapi mengapa kau masih ragu meng
582,kirim 5 mobil bantu barang untuk korban longsor dan banjir bandang di sukajaya bogor biar jalan yg jau
583,di hidup ini tak ada yg abadi dinamis berubah2 impermanence seringkali kita perlu tampar nyata dulu agar be
584,udah bodoh tukang bohong pula apa sih yang bisa bangga dari sosok orang aniesbaswedan ini bagai pimpin publik
585,yang jebak banjir di tol japek kemarin mana suara proyek kereta cepat jakartabandung jadi alesannya
586,banjir bandang landa jumlah desa di lebak banten di awal tahun 19 sekolah dan 1410 rumah rusak ribu warga ungsi
587,josss
588,dulu lbh jakarta kritis hadap jokowi lbh jakarta jadi tanggung jawab aksi cor kaki yg tinggal dunia saat demo ganja
589,when citizen knows jakarta goverment didnt take their job seriouly affecting big floods material loss and may death
590,saya datang untuk pasti butuh warga dampak bencana penuh sebab bencana banjir bandang di lebak seperti pe
591,nenek 71 th tinggal dlm rumah sendiri di green ville blok bn pas banjir kemaren viralkan biar sampai ke mendagri pak
592,asyeeem
593,jika sebab banjir di tol cikampek adalah benar akibat krn proyek kereta api cepat bagaimana dgn izin amdal nya ap
594,sssttephanie agi nyaring genang banjir nichh
595,makin banyak libat warga dki maka akan makin besar potensi gagal 4nies ungkap dlm me
596,banjir jakarta bakar hutan di australia mungkin ww iii masalah pulau natuna dan laut cina selatan ria ir
597,kepala dinas di panggil polisi urus bisa jadi pidana soal banjir karena ada lalai dan akibat keru
598,jokowi banjir bandang landa jumlah desa di lebak banten di awal tahun 19 sekolah dan 1410 rumah rusak rib
599,banjir jakarta bakar hutan di australia mungkin ww iii masalah pulau natuna dan laut cina selatan ria ir
600,jokowi saya datang untuk pasti butuh warga dampak bencana penuh sebab bencana banjir bandang
601,listianisasopi1 musim hujan tar banjir
602,hari ini selasa 7 januari 2020 tim tni puspentni dan bagana banser siaga bencana pc gp ansor lebak dan bagana a
603,siang malam buzzerp dan curut2nya sibuk nyalahin aniesbaswedan karena banjir yang janji jadi presiden bisa atas b
604,siang malam buzzerp dan curut2nya sibuk nyalahin aniesbaswedan karena banjir yang janji jadi presiden bisa atas b
605,electrizen hari ini pln baru saja unjung adikadik di sd harap jaya cengkareng sekolah mereka ikut dam
606,sudah paham fungsi hutan bumi mampus kau banjir hutan kau gundul sampah kau buang sembarang memang kau tak
607,korban tewas akibat banjir banyak di jabar kok ridwan kamil nggak dibully
608,banjir bandang landa jumlah desa di lebak banten di awal tahun 19 sekolah dan 1410 rumah rusak ribu warga ungsi
609,banjir bandang landa jumlah desa di lebak banten di awal tahun 19 sekolah dan 1410 rumah rusak ribu warga ungsi
610,rezim gak mutu infrastruktur program andal pun gak mutu tuju rezim ini rezim gak mutu proyek kereta cepat indo
611,jelas yang sangat baik tentang banjir jakarta dari remaja usia 17 tahun saskia gladys cerah
612,sudah ada jln tol jakarta cikampek pakai segala buat tol japek elevated sudah ada kereta jurus jakarta bandung
613,orang klw uda hobi boong ya susah klw dpaksa utk jadi jujur curi masih bisa lu sadarin candu narkoba masih bi
614,banjir bandang landa jumlah desa di lebak banten di awal tahun 19 sekolah dan 1410 rumah rusak ribu warga ungsi
615,lumayaaaaaanditanggepin sama 0000000000002 guna twitter
616,enih senetron eang gagal orbit di stasiyen tipi tetangga critanye ada sorang warga korban banjir eang mau nuntut tanggung
617,saya datang untuk pasti butuh warga dampak bencana penuh sebab bencana banjir bandang di lebak seperti pe
618,banjir bandang landa jumlah desa di lebak banten di awal tahun 19 sekolah dan 1410 rumah rusak ribu warga ungsi
619,pemprov dki jakarta antisipasi gugat class action masyarakat yang jadi korban banjir ayo kita d
620,tangan banjir anies kerja dengan senyap tanpa gembargembor
621,saya suka kalimat akhir presiden ku
622,janji anies emang manis kali ini yg jadi korban janji manis perintah kota bogor dan kali ini wali kota bogor
623,dari wag rt rw soal pa anis klw ke kemangbangka datang nya hanya ke mesjid mesjid gak banjir oh gitu
624,vivacoid banjir itu bencana tiap tahun jangan salah sepenuh dengan gubernur
625,1716 banjir di benjeng gresik jatim mulai dari kantor camat sudah tinggi via rezkypratama
626,apakah lbh berani aku sih pesimis
627,dulu lbh jakarta kritis hadap jokowi lbh jakarta jadi tanggung jawab aksi cor kaki yg tinggal dunia saat demo ganja
628,ajisawandala halo saya bencana bot untuk lapor banjir di sekitar sila balas dengan
629,laiyooo
630,banjir bandang landa jumlah desa di lebak banten di awal tahun 19 sekolah dan 1410 rumah rusak ribu warga ungsi
631,amiyatulalyh halo saya bencana bot untuk lapor banjir di sekitar sila balas dengan
632,ini jg sangat informatif sekali
633,jrkw19 kram air bocor jg bisa jd sebab banjir lho
634,korban tewas akibat banjir banyak di jabar kok ridwan kamil nggak dibully
635,ijazah rusak saat banjir atau sertifikat rumah jangan sedih arsip nasional republik indonesia anri beri
636,parmusi obat warga kalideres yang kena banjir
637,share gugat class action korban banjir dki jakarta di tahun 2020 pemprov dki amp anies baswedan nilai lalai amp tidak
638,untuk para kadrun yang bilang jokowi tidak unjung banjir lihat ini yaa ini bukan citra k
639,restorasi baik gratis di gedung arsip untuk dokumen penting yang rusak karena bencana banjir ikut adalah infony
640,kirim 5 mobil bantu barang untuk korban longsor dan banjir bandang di sukajaya bogor biar jalan yg jau
641,beneran kayak parasite kalau dipikirpikir jakarta banjir dan timpang yang nyata
642,twitter please do your magic aku minta bantu ke kalian semua buat temen kampus ku yang kena banjirlongsor rumah ru
643,twitter please do your magic aku minta bantu ke kalian semua buat temen kampus ku yang kena banjirlongsor rumah ru
644,salur air kampung yg guna trashblock nyaring sampah untuk cegah sumbat salur dan banjir
645,cc aniesbaswedan hahaha si anies
646,300 warga jakarta korban banjir gugat anies jumlah masih bisa tambah
647,presiden jokowi perintah gub banten tertib praktek tambang ilegal yg nilai jadi sebab musibah banjir
648,giveaway pulsaovogopay buat 3 orang karena banjir udah surut dan alhamdulillah ip ku smt5 di luar ekspektasi bener
649,nenek 71 th tinggal dlm rumah sendiri di green ville blok bn pas banjir kemaren viralkan biar sampai ke mendagri pak
650,makanya jaga bacot lo dennysiregar7 kemarin lo bilang kirim bu risma ke jkt soal banjir pasti beres noh jawab
651,anggota tim tgupp muslim muim jelas konsep naturalisasi anies yang dapat selamat jakarta dari banjir tangkap
652,disdik dki salur 250 ribu buku tulis untuk siswa korban banjir tahun baru
653,nenek 71 th tinggal dlm rumah sendiri di green ville blok bn pas banjir kemaren viralkan biar sampai ke mendagri pak
654,anies jumat mana ini venesia udah minggu kena banjir gin kok anies ga liat suaraanies kami warga depok rasa
655,jelas yang sangat baik tentang banjir jakarta dari remaja usia 17 tahun saskia gladys cerah
656,maraaku banjir mar
657,dulu lbh jakarta kritis hadap jokowi lbh jakarta jadi tanggung jawab aksi cor kaki yg tinggal dunia saat demo ganja
658,luar biasa pak basuki menteri puprbasuki hadimuljonotelah terjun 285 pegawai ke 180 titik banjir selam
659,anies sebut banyak 85 persen wilayah jakarta tidak landa banjir salah satu wilayah kemang jaksel fakta keman
660,nenek 71 th tinggal dlm rumah sendiri di green ville blok bn pas banjir kemaren viralkan biar sampai ke mendagri pak
661,banjir jakarta bakar hutan di australia mungkin ww iii masalah pulau natuna dan laut cina selatan ria ir
662,atas banjir dedi mulyadi usul tata ruang dki jabar dan banten satu
663,ketika banjir tidak sedikit kendara yang jebak di dalam mobil perlu tahu bahwa ada beberapa tips untuk pengendar
664,presiden joko widodo unjung langsung lokasi banjir bandang dan longsor di sukajaya bogor datang juga untu
665,ini alas anies baswedan gugat karena banjir tim advokasi korban banjir dki jakarta laku
666,halo sobat muda pada tanggal 6 januari 2020 universitas pertamina lalu giat salur bantu
667,korban tewas akibat banjir banyak di jabar kok ridwan kamil nggak dibully netizen karena ridwan kamil adalah main
668,selain salur bantu beri juga suluh oleh dosen program studi prodi ilmu komunikasi dr farah m
669,banjir jakarta bakar hutan di australia mungkin ww iii masalah pulau natuna dan laut cina selatan ria ir
670,serta oleh dosen prodi teknik elektro oleh dr eng wahyu kunto wibowo st meng aulia rahma annisa mt dan he
671,nenek 71 th tinggal dlm rumah sendiri di green ville blok bn pas banjir kemaren viralkan biar sampai ke mendagri pak
672,beneran kayak parasite kalau dipikirpikir jakarta banjir dan timpang yang nyata
673,makin banyak libat warga dki maka akan makin besar potensi gagal 4nies ungkap dlm me
674,twitter please do your magic aku minta bantu ke kalian semua buat temen kampus ku yang kena banjirlongsor rumah ru
675,kantayu sampah hilir banjir hilir macet hilir polusi hilir longsor hilir
676,ember bocorjd mikir ni orang salah minum obat x
677,jauh jauh kata sekolah di new zealand tapi no hpnya no indonesia tapi ilmu batas manfaatin musibah untu
678,dearfiaformulae at least 60 people killed by this flood disaster that probablycaused by the jakarta governor had cut dow
679,mumbul gaeeees
680,twitter please do your magic aku minta bantu ke kalian semua buat temen kampus ku yang kena banjirlongsor rumah ru
681,big respect buat ibu iti octavia jayabaya bupati lebak lebak yg jauh dari hiruk pikuk berita siapa yg salah hadap banji
682,banjir bandang landa jumlah desa di lebak banten di awal tahun 19 sekolah dan 1410 rumah rusak ribu warga ungsi
683,nenek 71 th tinggal dlm rumah sendiri di green ville blok bn pas banjir kemaren viralkan biar sampai ke mendagri pak
684,banjir bandang landa jumlah desa di lebak banten di awal tahun 19 sekolah dan 1410 rumah rusak ribu warga ungsi
685,pesantren nya mantan wkwk
686,giveaway pulsaovogopay buat 3 orang karena banjir udah surut dan alhamdulillah ip ku smt5 di luar ekspektasi bener
687,ini akibat bala hutan laburaku1 potretlabura
688,saya datang untuk pasti butuh warga dampak bencana penuh sebab bencana banjir bandang di lebak seperti pe
689,paska hujan lebat dan banjir bandang kondisi daerah alir air sangat labil mohon warga dan para rawan agar lebih hati
690,aku baca ya
691,saya datang untuk pasti butuh warga dampak bencana penuh sebab bencana banjir bandang di lebak seperti pe
692,beneran kayak parasite kalau dipikirpikir jakarta banjir dan timpang yang nyata
693,ini ketua rw 11 telah dapat lapor dari warga bahwa pompa mati sedang banjir sudah setinggi 2 meter seta
694,lagi2 sampah yang tutup gorong2 sampah sumbat alir air sehingga naik ke muka masih yakin gorong2 juga mau d
695,anakanak tidak kalah semangat sama rawan sih sisasisa banjir di sekolah tepat di sdn 3 sukasari k
696,guys barangkali ada keluarga tetangga kerabat dampak banjir yg butuh bantu sabun mandi aku ken bantu den
697,beautiful help from hanbin bantu sosial bagi para saudara kita yang kena banjir ulur tangan kalian sangat ber
698,sosok satpol pp cantik hijab nama apriliawati jadi viral karena bantu bersih lumpur tebal saat jadi ban
699,woe dia nyemplung nya udah kek atlet renang
700,hari ini selasa 7 januari 2020 tim tni dan bagana banser siaga bencana pc gp ansor lebak dan bagana jawa tengah mel
701,twitter please do your magic aku minta bantu ke kalian semua buat temen kampus ku yang kena banjirlongsor rumah ru
702,kab tegal 72 bantu atur lalu lintas di depan masjid al haq slawi yang banjir
703,tito sebut mukim puncak bogor sebab banjir jabodetabek
704,unk apa alih pilpres sdh lewat jokowi sdh menang dan kasus itu sdh tangan aparat hukum kami tdk seperti kalian
705,banjir jakarta bakar hutan di australia mungkin ww iii masalah pulau natuna dan laut cina selatan ria ir
706,guntur romli edan anies baswedan sebar hoax kemang tidak banjir gubernur dki jakarta anies b
707,video lbh jakarta beri bantu untuk warga dampak banjir
708,lawan kelah sjk kecil akhir kelahi pas sy smp masuk pukul ke ulu hati sy tadangek sy sesak nafas rawa
709,twitter please do your magic aku minta bantu ke kalian semua buat temen kampus ku yang kena banjirlongsor rumah ru
710,gileee tangkap aer ujan anggota tugpp yg di gaji besar cuma gin papar ide kemampuanya pantesan gabener gak ada solus
711,1 minggu di 2020 banjir jabodetabek bakar hutan australia natuna world war 3 reynhard sinaga wew
712,arti petisi nya harus ganti dong pak turunkancopot siapa
713,1 minggu di 2020 banjir jabodetabek bakar hutan australia natuna world war 3 reynhard sinaga wew
714,ngeliat teel sambil dengerin beautiful light hhuhuhuhuhu banjirrrrrr
715,nenek 71 th tinggal dlm rumah sendiri di green ville blok bn pas banjir kemaren viralkan biar sampai ke mendagri pak
716,dulu lbh jakarta kritis hadap jokowi lbh jakarta jadi tanggung jawab aksi cor kaki yg tinggal dunia saat demo ganja
717,biaibiai131 halo saya bencana bot untuk lapor banjir di sekitar sila balas dengan
718,beneran kayak parasite kalau dipikirpikir jakarta banjir dan timpang yang nyata
719,sosok satpol pp cantik hijab nama apriliawati jadi viral karena bantu bersih lumpur tebal saat jadi ban
720,hari ini selasa 7 januari 2020 tim tni dan bagana banser siaga bencana pc gp ansor lebak dan bagana jawa tengah mela
721,jadi simpul banjir datang karena panggil wkwkw
722,rob masih jadi momok bagi warga di pesisir utara jakarta begini tampak naik muka air laut yang aba
723,share gugat class action korban banjir dki jakarta di tahun 2020 pemprov dki amp anies baswedan nilai lalai amp tidak
724,wni dr amerika pun turut empat thd korban banjir jakarta serta kecam kerja gabener wanaibon yg buruk menghamburka
725,guys barangkali ada keluarga tetangga kerabat dampak banjir yg butuh bantu sabun mandi aku ken bantu den
726,guys barangkali ada keluarga tetangga kerabat dampak banjir yg butuh bantu sabun mandi aku ken bantu den
727,yg mau sumbangsi aqua monggo ingat bukan sumbangsi untuk korban banjir bandang ya biar ga ada monyet lg yg nyinyir
728,christwamea nggak mau kalah dg jkw dirut kai lagi survei banjir kawal marawisan sedang htt
729,sahabatsahabat banser kota cilegon usaha tembus daerah isolir gunung julang kab lebak banten yg dampak ba
730,timpang memang nyata dan sudah jadi sejak lama saya miris dan tepukul baca berita ini tapi apa daya i
731,kritik anis di bilang gak mup on ato bela nista agama ndasmu lah aq bukan warga dki cuk bagi jkw menangwowo jadi
732,siang malam buzzerp dan curut2nya sibuk nyalahin aniesbaswedan karena banjir yang janji jadi presiden bisa atas b
733,baru ingat jakarta banjir sudah bertahuntahun tapi belum ada sosialisasi pandu selamat saat banjir seperti ini
734,ab bekyun ini lg ospek trus kasi muhasabah diri tapi bosen krna dah sering dia mlh kaget liat temen nya pada banj
735,hoaks banjir bandang di tayu kabupaten pati jawa tengah
736,siang malam buzzerp dan curut2nya sibuk nyalahin aniesbaswedan karena banjir yang janji jadi presiden bisa atas b
737,warganet harap anies baswedan tanggung jawab hadap korban banjir yang jadi di jakarta tagar
738,tangan banjir anies kerja dengan senyap tanpa gembargembor
739,dpnetizen oh jadi sebab banjir jakarta bukan bang anis yah
740,ciluukkbaa apresiasi bijak aniesbaswedan tangan banjir pakar hidrodinamika gubernur luar biasa please jangan
741,banjir bandang landa jumlah desa di lebak banten di awal tahun 19 sekolah dan 1410 rumah rusak ribu warga ungsi
742,tuhan ga sekali kelen gugat gitu biar lebih greget wow nya atau noh gw kasih saran proyek kereta cepat juga sekali
743,banjir jakarta bakar hutan di australia mungkin ww iii masalah pulau natuna dan laut cina selatan ria ir
744,turun gengsi pak aniesbaswedan nggak usah malu kemang memang banjir kenapa wan anies tutuptutupi
745,dalam beberapa bulan ke depan pasar mobil bekas pasti akan saki dengan membludaknya mobil bekas rendam banjir na
746,kasus jiwasraya mereka coba salah sby kasus banjir jabodetabek3 provinsi mereka salah dan bully anies kasus
747,saya datang untuk pasti butuh warga dampak bencana penuh sebab bencana banjir bandang di lebak seperti pe
748,januari 2020 negeri ini sedang tidak baikbaik saja mulai dari banjir jakarta polemik indoch
749,surprise gubernur aniesbaswedan datang resepsi nikah di rumah yg sempat dampak banjir di rt 0307 lurah
750,twitter please do your magic aku minta bantu ke kalian semua buat temen kampus ku yang kena banjirlongsor rumah ru
751,korban tewas akibat banjir banyak di jabar kok ridwan kamil nggak dibully
752,maha yeuh wa roniadie
753,anies jumat mana ini venesia udah minggu kena banjir gin kok anies ga liat suaraanies kami warga depok rasa
754,bila lmbaga hukum independen udah gak netral namun lbih brkeperpihakan pd kkuatan politik trtentumaka hukum akan h
755,cerita balik bencana banjir ada yg kerja tanpa pamrih ada jabat yg cuma cari muka kronologis cerita ada di bawah
756,kantayu sampah hilir banjir hilir macet hilir polusi hilir longsor hilir lengser
757,ums kirim rawan bantu korban banjir di jabodetabek wilayah jabodetabek dan sekitar landa bencana banjir awal tahu
758,guys barangkali ada keluarga tetangga kerabat dampak banjir yg butuh bantu sabun mandi aku ken bantu den
759,twitter please do your magic aku minta bantu ke kalian semua buat temen kampus ku yang kena banjirlongsor rumah ru
760,di hidup ini tak ada yg abadi dinamis berubah2 impermanence seringkali kita perlu tampar nyata dulu agar be
761,talk show rpk fm 9630 netizen united on air tolong pertama pasca banjir selasa 7 januari 2020 jam 190
762,marquezradja wr4ag226 bego luar biasa tanah kalau sudah jenuh air mau tangkap pakai apa ya banjir tet
763,stevaniehuangg hadeeuh otak2 isi aer got emang ye coba waktu banjir kemaren kalian bawa banjir gitu biar jkt be
764,waktu bencana gempa lombok kadrun rame2 salah pimpin dan paksa segera bayar ganti rugi skrng mereka kata banjir
765,orang pinter banjir ini krn normalisasi kita hambat orang bodoh maaf bp ini smua krn air dr selatan tdk kendali
766,assalamualaikum teman2 twitter please do your magic jadi aku punya teman yang tinggal di lebak banten dia cerita ada
767,guys barangkali ada keluarga tetangga kerabat dampak banjir yg butuh bantu sabun mandi aku ken bantu den
768,ini surat dari tim advokasi banjir mohon untuk sebar kpd yg kena musibah barangkali ingin minta ganti rugi
769,hello
770,tuhan mereka tahan dengan semangat tak padam dalam derita dan tanggung untuk buah mantra sakti dalam kalbu
771,lagi2 sampah yang tutup gorong2 sampah sumbat alir air sehingga naik ke muka masih yakin gorong2 juga mau d
772,tidak kembali pulang belum belum kita yg menang mars semangat sahabatsahabat banser kota cilegon yg usaha me
773,daripada jakarta bandung tampak lebih seram jika sangkut tentang banjir bahkan yang kecil sekalipun apabila banjir
774,ikut bbrapa media yg duga telah terima siram rohani dari anies 1 2 h
775,moga jadi inspirasi
776,ibu tum bhayangkari sama wakil bhayangkari lintas angkat dalam beri bantu kepada korban banjir
777,orang bohong itu belum tentu bodoh minimal dia pintar bicara
778,kala banjir timpa jabodetabek dan udah jelas gabener gak becus dan gak bisa kerja ada loh yg muji2 anies ehhh ternyat
779,ab bekyun ini lg ospek trus kasi muhasabah diri tapi bosen krna dah sering dia mlh kaget liat temen nya pada banj
780,banjir bandang landa jumlah desa di lebak banten di awal tahun 19 sekolah dan 1410 rumah rusak ribu warga ungsi
781,pesantren nya mantan
782,korban tewas akibat banjir banyak di jabar kok ridwan kamil nggak dibully
783,ayooo kisanak kita berpratisipasi jadi rumah kita bagai perangkap air jebak air biar gak keluar rumah dan bi
784,banjir bandang landa jumlah desa di lebak banten di awal tahun 19 sekolah dan 1410 rumah rusak ribu warga ungsi
785,saya datang untuk pasti butuh warga dampak bencana penuh sebab bencana banjir bandang di lebak seperti pe
786,saya datang untuk pasti butuh warga dampak bencana penuh sebab bencana banjir bandang di lebak seperti pe
787,dpp hilmi mabes laskar fpi dan rubyntang adri salur bantu tahap ii untuk banjir bandang lebak
788,sadar ini main setan knp kalian tdk sekali gugat presiden krn dia sebab bangun ugal2an atau knp kal
