,Tweet
268,guys barangkali ada keluarga tetangga kerabat dampak banjir yg butuh bantu sabun mandi aku ken bantu den
269,makanya jaga bacot lo dennysiregar7 kemarin lo bilang kirim bu risma ke jkt soal banjir pasti beres noh jawab
270,saya datang untuk pasti butuh warga dampak bencana penuh sebab bencana banjir bandang di lebak seperti pe
271,demokrat nyata banjir tol cikampek sebab proyek kereta cepat bukan hoax htt
272,yusufdumdum bamsbulaksumur ekokuntadhi dennysiregar7 gunromli
273,ikut bbrapa media yg duga telah terima siram rohani dari anies 1 2 h
274,lembaga bantu heunceut
275,tahun kemarin banyak plat2 f mobil bekas tebar di solo jangan2 tahun ini tambah banyak gara2 banjir
276,kepada kadistan kadal istana yang baru muncul kembang biak telah hujan dan sekadar ingat h
277,anggi gak boleh sedih lagi karena banjir adalah musibah yg datang dari yang maha kuasa kita harus tetap selalu tabah dala
278,jajar polres tasikmalaya kota sisih rizki bantu korban banjir gtgtgt
279,tito sebut mukim puncak bogor sebab banjir jabodetabek pak kalo bikin statement kordinasi dulu sama buzzerbuzzer m
280,saya datang untuk pasti butuh warga dampak bencana penuh sebab bencana banjir bandang di lebak seperti pe
281,banjir bandang landa jumlah desa di lebak banten di awal tahun 19 sekolah dan 1410 rumah rusak ribu warga ungsi
282,ibu2 muslimat ini sungguh luar biasa militansi tuk manusia tak perlu ragu kawal banser kab lebak ibu2 ppmuslim
283,makanya jaga bacot lo dennysiregar7 kemarin lo bilang kirim bu risma ke jkt soal banjir pasti beres noh jawab
284,jakarta banjir warga marah ke gubernur baru inget gue bekas banjir kaga ada tu yg marah ke gubernur
285,e100ss banjir benjeng gresikmulai dari kantor camat sudah tinggi
286,twitter please do your magic aku minta bantu ke kalian semua buat temen kampus ku yang kena banjirlongsor rumah ru
287,4y4nkz jokowi aniesbaswedan ngiler aja dilapin gimana kalo muntah pas ngebersiin bekas banjir
288,sidang kabinet paripurna pertama 2020 hari ini di jakarta jajar perintah kait saya perintah turun bantu penangana
289,wni dr amerika pun turut empat thd korban banjir jakarta serta kecam kerja gabener wanaibon yg buruk menghamburka
290,hebat sekali warga kemang yg bisa tangkap dan tahan air agar tidak kemanamana
291,tuhan ga sekali kelen gugat gitu biar lebih greget wow nya atau noh gw kasih saran proyek kereta cepat juga sekali
292,makanya jaga bacot lo dennysiregar7 kemarin lo bilang kirim bu risma ke jkt soal banjir pasti beres noh jawab
293,kresek merah itu isi pampers bayi penuh mbok yo kiro2 lek ate nyampah ngko lek banjir nyalahno perintah lha laku
294,tidak ada dalil baik dalam al quran maupun hadist orang gubernur harus atas banjir bahlul ente
295,banjir bandang landa jumlah desa di lebak banten di awal tahun 19 sekolah dan 1410 rumah rusak ribu warga ungsi
296,salah satu desa yg lewat rawan pks bogor saat tuju lokasi isolir dampak banjir bandang di kp sarongge desa cisarua
297,jrkw19 wah nyata usaha anis utk atas banjir di dki dg cara berselfy ria di pinggir sungai tsb ini baru s
298,aniesbaswedan dkijakarta humasdki korban ini warga jakarta kan
299,saya datang untuk pasti butuh warga dampak bencana penuh sebab bencana banjir bandang di lebak seperti pe
300,rezim gak mutu infrastruktur program andal pun gak mutu tuju rezim ini rezim gak mutu proyek kereta cepat indo
301,kasus jiwasraya mereka coba salah sby kasus banjir jabodetabek3 provinsi mereka salah dan bully anies kasus
302,salur air kampung yg guna trashblock nyaring sampah untuk cegah sumbat salur dan banjir
303,aagym benar gampang aa tinggal minta maaf soal nyinyir masalah banjir di jaman ahokbagaimanapun aa ngele
304,nenek 71 th tinggal dlm rumah sendiri di green ville blok bn pas banjir kemaren viralkan biar sampai ke mendagri pak
305,lbh jakarta pernah serang basukibtp soal gusur jelang pilkada dki 2017 bhkan ikut2an serang ganjarpranowo soal se
306,giveaway pulsaovogopay buat 3 orang karena banjir udah surut dan alhamdulillah ip ku smt5 di luar ekspektasi bener
307,banjir jakarta bakar hutan di australia mungkin ww iii masalah pulau natuna dan laut cina selatan ria ir
308,miris lihat tapi itu hidup karena kita manusia paksa untuk hidup seperti ini lihat hal yang ba
309,stevaniehuangg padahal yg banyak jadi korban tewas saat banjir amp tanah longsor propinsi jabar kok warga jabar ga ada y
310,banjir pun tetep sange karena efek dingin
311,saya duka untuk mereka karena saya bagi dari mereka juga manusia saya hanya bisa doa selamat untu
312,gabener 4nies sangat layak dan penuh syarat untuk di gugat atas kebijakanya yg potong anggar tanggulang banjir di
313,pimpin oleh panglima laskar ustad maman dalam maksimal bantu bagi korban bencana banjir dan longsor di banten
314,temen2 suporter persib bandung bantu korban banjir di jakarta dari bung ferry
315,knp lbh dki tdk bela warga jkt dlm kasus banjir nyata tokoh lbh dki nursyahbani katjasungkana adalah anggota tgupp
316,sssttbpk rapat dulu yaa kait optimalisasi mitigasi banjir semangat pak aniesbaswedan
317,yg pertama di indonesia ganjarpranowo terbit pergub didik anti korupsi gaosaah bilang di dki kapan yaa solar
318,1 minggu di 2020 banjir jabodetabek bakar hutan australia natuna world war 3 reynhard sinaga wew
319,beneran kayak parasite kalau dipikirpikir jakarta banjir dan timpang yang nyata
320,makanya jaga bacot lo dennysiregar7 kemarin lo bilang kirim bu risma ke jkt soal banjir pasti beres noh jawab
321,giveaway pulsaovogopay buat 3 orang karena banjir udah surut dan alhamdulillah ip ku smt5 di luar ekspektasi bener
322,betul hok kata ente ahkirnya wan bebal juga akan laku normalisasi tp tunggu 2 th telah ente ngomong video iniju
323,tong hilap pak tambang illegal ditewakan weh meh teu ngaruksak hutan deui
324,ini wujud gorong raksasa yg gagas pak jokowi untuk atas banjir bagi daerahsudah pakai ide ini hanya g
325,urus dharma wanita satu menteri tahan dwp kemhan laku giat bakti sosial tinjau dan unjung
326,wagimandeep basukibtp ganjarpranowo andrinovsmg hoohh hajar terus mbeib sumpeh ane ga ade kata kata lag
327,kayamiskin
328,banjir bandang landa jumlah desa di lebak banten di awal tahun 19 sekolah dan 1410 rumah rusak ribu warga ungsi
329,buah ikhtiar dari sahabatsahabat kami dalam rangka bantu ringan beban saudara kita yang kena dampak benca
330,bangun prasarana kendali banjir pada empat sungai kendala sejak 2017 karena soal bebas lahan sungai ciliwu
331,waktu pagi ke ragunan zoo bus tj ga lewat kemang krn banjir
332,tau gue ada bnyak gubernur di nkri ada bnyak wilayah yg trkena bncana banjir kmrin nmun media amp wrga net lbh trtarik
333,video hujan saat tinjau korban banjir jokowi pakai jas hujan kresek rp10 ribu
334,mashedpotahoess halo saya bencana bot untuk lapor banjir di sekitar sila balas dengan
335,tegas mendagri tito mukim puncak bogor sebab banjir jabodetabek
336,dari orba reformasi neo reformasi sampai orba 40 kartun ttg sebab banjir mungkin selalu sama narasi orang duga
337,bersih lumpur pasca banjir di jl di panjaitan oleh sdbm jakarta timur
338,sangat tdk martabat beda dapat sila tp tdk elok saling ngejek seperti ini mau jadi apa negeri ini pers
339,banjir jakarta bakar hutan di australia mungkin ww iii masalah pulau natuna dan laut cina selatan ria ir
340,guys barangkali ada keluarga tetangga kerabat dampak banjir yg butuh bantu sabun mandi aku ken bantu den
341,kereeeeen coy aduuuuuuh gustiiiii presiden gua pas banget slogan nya maju bangsa bahagia rakyat
342,yg lain padahal ga pakai jas hujan ini pakai jas hujan masih di payung
343,gin loh pak muin sebab banjir itu ada dua 1 karena ada aer 2 gabener gk becus tanggap anggota tugpp kait class
344,korban tewas akibat banjir banyak di jabar kok ridwan kamil nggak dibully
345,share gugat class action korban banjir dki jakarta di tahun 2020 pemprov dki amp anies baswedan nilai lalai amp tidak
346,hadap banjir di jumlah wilayah di tanah air yang perlu utama adalah selamat warga saya perintah semua
347,nenek 71 th tinggal dlm rumah sendiri di green ville blok bn pas banjir kemaren viralkan biar sampai ke mendagri pak
348,twitter please do your magic aku minta bantu ke kalian semua buat temen kampus ku yang kena banjirlongsor rumah ru
349,kemenhub ungkap sebab banjir tol cikampek proyek kereta cepat jakarta bandung
350,salur air kampung yg guna trashblock nyaring sampah untuk cegah sumbat salur dan banjir
351,hebat yah gubernur aniesbaswedan nyata turut aniesbaswedan dan buzzer 5m tak lama hanya 30 me
352,fasilitas umum dan obyek vital dampak banjir seperti bandara halim agar segera normalisasi selain itu perintah pusat
353,lanjut giat bersih sampah pasca banjir di rw 12 kel kramat jati oleh sdbm kec kramat jati
354,twitter please do your magic aku minta bantu ke kalian semua buat temen kampus ku yang kena banjirlongsor rumah ru
355,diet suku suku paruh susah eh nak jaga makan benar tak susah kalau praktik dari sekarangkita pun tengah be
356,kota bekas tetap status tanggap darurat bencana banjir dan tanah longsor 1 7 januari 2020
357,banjir jakarta bakar hutan di australia mungkin ww iii masalah pulau natuna dan laut cina selatan ria ir
358,al habib abu bakar bin hasan al attas az zabidi turun langsung salur makan bagi korban banjir nu depokon
359,twitter please do your magic aku minta bantu ke kalian semua buat temen kampus ku yang kena banjirlongsor rumah ru
360,twitter please do your magic aku minta bantu ke kalian semua buat temen kampus ku yang kena banjirlongsor rumah ru
361,wilayah kemang jaksel jadi salah satu daerah yang landa banjir pada awal tahun 2020 namun aniesbaswedan sempat meny
362,guntur romli edan anies baswedan sebar hoax kemang tidak banjir gubernur dki jakarta anies b
363,kenapa si anjir muka nya lawak banget itu tuh lagi sedih baek lagi sedih
364,demokrat nyata banjir tol cikampek sebab proyek kereta cepat bukan hoax htt
365,banjir jakarta bakar hutan di australia mungkin ww iii masalah pulau natuna dan laut cina selatan ria ir
366,anis repot serepotrepotnya kami layan rakyat repot kena banjir
367,akhir akhir ini ujan dari jam 34 sore sampe 10 malem untung ga gampang banjir
368,salur air kampung yg guna trashblock nyaring sampah untuk cegah sumbat salur dan banjir
369,banjir bandang landa jumlah desa di lebak banten di awal tahun 19 sekolah dan 1410 rumah rusak ribu warga ungsi
370,jelas yang sangat baik tentang banjir jakarta dari remaja usia 17 tahun saskia gladys cerah
371,ketua mpr ri bambang soesatyo alias bamsoet sempat makan sama dengan para ungsi korban banjir
372,salah satu desa yg lewat rawan pks bogor saat tuju lokasi isolir dampak banjir bandang di kp sarongge desa cisarua
373,kenapa gak pas kampanye dulu bilang soal banjir dki akan saya serah ke perintah pusat kata gampang atas banjir can
374,banjir yang landa bekas beberapa hari lalu tidak hanya sisa lumpur tetapi juga sampah seperti salah satu sampah
375,saya datang untuk pasti butuh warga dampak bencana penuh sebab bencana banjir bandang di lebak seperti pe
376,banjir bandang landa jumlah desa di lebak banten di awal tahun 19 sekolah dan 1410 rumah rusak ribu warga ungsi
377,saya datang untuk pasti butuh warga dampak bencana penuh sebab bencana banjir bandang di lebak seperti pe
378,banjir bandang landa jumlah desa di lebak banten di awal tahun 19 sekolah dan 1410 rumah rusak ribu warga ungsi
379,gur akan closedown untuk hindar semua banjir ritwat ini wslm
380,bagi yg rasa jadi korban banjir jakarta 1 januari 2020 ada yg mau advokasi laku class action untuk
381,layan darurat israel temu dua wargayang jebak banjirdalam lift di buah gedung wilayah tel aviv selatan sem
382,banjir bandang landa jumlah desa di lebak banten di awal tahun 19 sekolah dan 1410 rumah rusak ribu warga ungsi
383,anggi gak boleh sedih lagi karena banjir adalah musibah yg datang dari yang maha kuasa kita harus tetap selalu tabah dala
384,waw berita yg sangat penting
385,warga dki siap utk tuntut atau akibat banjir sementara ada warga bersih2 rumah dpt reje
386,korban tewas akibat banjir banyak di jabar kok ridwan kamil nggak dibully
387,la tansa tempat aku dulu nyantren guys
388,janji anies emang manis kali ini yg jadi korban janji manis perintah kota bogor dan kali ini wali kota bogor
389,budiyono97 dwiyanadkm dia bilang rumah dia banjir tp gk alir keluar coba semua warga suruh tampung banjir arti
390,nenek 71 th tinggal dlm rumah sendiri di green ville blok bn pas banjir kemaren viralkan biar sampai ke mendagri pak
391,fpi pancn oy
392,anies baswedan gugat korban banjir jakarta ancam harus ganti rugi rp 1 triliun
393,1 minggu di 2020 banjir jabodetabek bakar hutan australia natuna world war 3 reynhard sinaga wew
394,banjir bandang landa jumlah desa di lebak banten di awal tahun 19 sekolah dan 1410 rumah rusak ribu warga ungsi
395,saat jokowi pakai jas hujan rp 10 ribu saat tinjau banjirlongsor di sukajaya bogor jas hujan plastik itu biasa dij
396,banjir bandang landa jumlah desa di lebak banten di awal tahun 19 sekolah dan 1410 rumah rusak ribu warga ungsi
397,akan tingkat intensitas tega hukum kait kelola sampah yang masih belum kelola dengan baik
398,kisah di balik banjir dki pak aniesbaswedan lagi inspeksi banjir malah di ajak nyambangi orang walimah sama warga
399,banjir bandang landa jumlah desa di lebak banten di awal tahun 19 sekolah dan 1410 rumah rusak ribu warga ungsi
400,banjir bandang landa jumlah desa di lebak banten di awal tahun 19 sekolah dan 1410 rumah rusak ribu warga ungsi
401,sobri80965387 ilctv1 karniilyas pea loh penting jiwasraya lah skala indonesia sedang tema yg anda sarank
402,dampak banjir bandang di desa urug camat sukajaya kabupaten bogor kecewa warga atas berita soal banjir
403,banjir bandang landa jumlah desa di lebak banten di awal tahun 19 sekolah dan 1410 rumah rusak ribu warga ungsi
404,nang endonesia ki seng pikir nek ra gawuk tempik mek nek ra yo selangkang berita ngene ki seng payu dol
405,siapsiap aja pak aniesbaswedan jadi gubernur dunia pak an
406,saya datang untuk pasti butuh warga dampak bencana penuh sebab bencana banjir bandang di lebak seperti pe
407,saya datang untuk pasti butuh warga dampak bencana penuh sebab bencana banjir bandang di lebak seperti pe
408,enih senetron eang gagal orbit di stasiyen tipi tetangga critanye ada sorang warga korban banjir eang mau nuntut tanggung
409,gin loh pak muin sebab banjir itu ada dua 1 karena ada aer 2 gabener gk becus tanggap anggota tugpp kait class
410,4y4nkz banjir lbh besar gedung roboh angin puting beliung tp yg rda cium bau bakal ada yg turun
411,ngomong apa ini orang udah banjir masih aja naturalisasi naturalisasi itu omong kosong sudah 2 tahun apa bukti n
412,saya datang untuk pasti butuh warga dampak bencana penuh sebab bencana banjir bandang di lebak seperti pe
413,saya datang untuk pasti butuh warga dampak bencana penuh sebab bencana banjir bandang di lebak seperti pe
414,kerja tutup lubang pasca banjir oleh sdbm jakarta timur
415,video hujan saat tinjau korban banjir jokowi pakai jas hujan kresek rp10 ribu
416,surprise gubernur aniesbaswedan datang resepsi nikah di rumah yg sempat dampak banjir di rt 0307 lurah
417,guys barangkali ada keluarga tetangga kerabat dampak banjir yg butuh bantu sabun mandi aku ken bantu den
418,wajar ajah jkt banjir org tgupp ny lg jogeg chchotimah anakkolong airinnz 7intaputih yradianto ariess67
419,sebwah cakap bocil2 pasca ciliwung banjir ihih ada lele jumbo raksasa ge aku pernah liat noh sono gue dal
420,korban tewas akibat banjir banyak di jabar kok ridwan kamil nggak dibully
421,beneran kayak parasite kalau dipikirpikir jakarta banjir dan timpang yang nyata
422,makanya jaga bacot lo dennysiregar7 kemarin lo bilang kirim bu risma ke jkt soal banjir pasti beres noh jawab
423,ini alas anies baswedan gugat karena banjir tim advokasi korban banjir dki jakarta laku
424,kirim 5 mobil bantu barang untuk korban longsor dan banjir bandang di sukajaya bogor biar jalan yg jau
425,giveaway pulsaovogopay buat 3 orang karena banjir udah surut dan alhamdulillah ip ku smt5 di luar ekspektasi bener
426,korban tewas akibat banjir banyak di jabar kok ridwan kamil nggak dibully
427,1 minggu di 2020 banjir jabodetabek bakar hutan australia natuna world war 3 reynhard sinaga wew
428,share gugat class action korban banjir dki jakarta di tahun 2020 pemprov dki amp anies baswedan nilai lalai amp tidak
429,sambang korban banjir bamsoet beri bantu dan makan sama
430,geloraco yg lalu biar lalu jangan di ungkit2 lagi karena pilih dan ganti gubernur tak mungkin di l
431,beneran kayak parasite kalau dipikirpikir jakarta banjir dan timpang yang nyata
432,beneran kayak parasite kalau dipikirpikir jakarta banjir dan timpang yang nyata
433,banjir di jabodetabek sebab variasi snack tambah di rumah sakit
434,buat adil itu memang sulit hanya bisa laku kalau ikhlas beril dan faham fakta orang iman wajib sikap adi
435,gabener psikopat
436,bupati lebak iti octavia jayabaya dengan heli langsung temu warga yang dampak banjir dan isolir karena akses b
437,surprise gubernur aniesbaswedan datang resepsi nikah di rumah yg sempat dampak banjir di rt 0307 lurah
438,davidwijaya82 judul pimpin nakal mati bawa arus banjir belum ke pentok trotoar
439,dari data yang oleh banser tanggap bencana per tanggal 4 januari 2020 wilayah bekas dan bogor ada titik rendam
440,when citizen knows jakarta goverment didnt take their job seriouly affecting big floods material loss and may death
441,dua piano pak fadlizon jadi korban banjir salah satu steinway yang sudah usia 100 tahun siapa steinway dan men
442,surprise gubernur aniesbaswedan datang resepsi nikah di rumah yg sempat dampak banjir di rt 0307 lurah
443,kemarenkemaren mana yak koq baru ada statment bqiniakyu herman ekhh
444,karena selamat dan aman rakyat adalah bukti fungsi lembaga perintah untuk itu presiden jokowi turun la
445,bekas kurang alat berat untuk kelola sampah sisa banjir
446,muslim muin anggota tgupp bentuk wan zigzag betul singkat tangkap air rumah sy banjir tampung sementara a
447,saya datang untuk pasti butuh warga dampak bencana penuh sebab bencana banjir bandang di lebak seperti pe
448,giveaway pulsaovogopay buat 3 orang karena banjir udah surut dan alhamdulillah ip ku smt5 di luar ekspektasi bener
449,ngak ikut class action ke pemda dki aja sekali kami lagi surati sih belum gugat in
450,korban tewas akibat banjir banyak di jabar kok ridwan kamil nggak dibully netizen karena ridwan kamil adalah main
451,dpp hilmi mabes laskar fpi dan rubyntang adri salur bantu tahap ii untuk banjir bandang lebak
452,1 minggu di 2020 banjir jabodetabek bakar hutan australia natuna world war 3 reynhard sinaga wew
453,diet suku suku paruh susah eh nak jaga makan benar tak susah kalau praktik dari sekarangkita pun tengah be
454,nenek 71 th tinggal dlm rumah sendiri di green ville blok bn pas banjir kemaren viralkan biar sampai ke mendagri pak
455,gugat class action korban banjir dki jakarta di tahun 2020
456,tito sebut mukim puncak bogor sebab banjir jabodetabek pak kalo bikin statement kordinasi dulu sama buzzerbuzzer m
457,twitter please do your magic aku minta bantu ke kalian semua buat temen kampus ku yang kena banjirlongsor rumah ru
458,banjir bandang landa jumlah desa di lebak banten di awal tahun 19 sekolah dan 1410 rumah rusak ribu warga ungsi
459,pp muhammadiyah siaga ratus personil dalam rakor tangan banjir di gedung pusat dakwah muhammadiyah menteng raya
460,salur air kampung yg guna trashblock nyaring sampah untuk cegah sumbat salur dan banjir
461,banjir bandang landa jumlah desa di lebak banten di awal tahun 19 sekolah dan 1410 rumah rusak ribu warga ungsi
462,rupa ahmad maslan masih mahu unggul title sbg lawak bangang abad ini satu dunia dah tahu india kurang
463,jaqchrome anomali buah batu cocok untuk gambar otak yg seperti batu goblok ngg sadar moga depan bukan a
464,sahabatsahabat banser kota cilegon usaha tembus daerah isolir gunung julang kab lebak banten yg dampak banjir b
465,sudinhubutara pak jasa derek kendara yg rendam banjir masih ga saya udh telp ke sudinnya ga ada yg angkat m
466,ayooo kisanak kita berpratisipasi jadi rumah kita bagai perangkap air jebak air biar gak keluar rumah dan bi
467,saya datang untuk pasti butuh warga dampak bencana penuh sebab bencana banjir bandang di lebak seperti pe
468,jelas yang sangat baik tentang banjir jakarta dari remaja usia 17 tahun saskia gladys cerah
469,kang daud achmad hadir rapat tangan banjir di wilayah provinsi dki jakarta jawa barat dan banten di kanto
470,please tvonenews metrotv sctv tanyoana bertemanm jhonkosmik msaiddidu
471,banjir bandang landa jumlah desa di lebak banten di awal tahun 19 sekolah dan 1410 rumah rusak ribu warga ungsi
472,jelas yang sangat baik tentang banjir jakarta dari remaja usia 17 tahun saskia gladys cerah
473,banjir rendam 2 desa di kec dawarblandong kab mojokerto pagi tadi banjir ini jadi kare
474,gin loh pak muin sebab banjir itu ada dua 1 karena ada aer 2 gabener gk becus tanggap anggota tugpp kait class
475,korban tewas akibat banjir banyak di jabar kok ridwan kamil nggak dibully
476,data baru 67 orang tewas akibat banjir jabodetabek
477,dprd provinsi jabar kunjung korban bencana banjir perum pondokgede permai bekas
478,mendagri tito cek posko ganti dokumen duduk warga korban banjir
479,banjir jakarta bakar hutan di australia mungkin ww iii masalah pulau natuna dan laut cina selatan ria ir
480,pemprov dki gugat karena banjir senator jakarta saya ketawa baca
481,walikota bekas minta bantu anies atas masalah pasca banjir
482,saya datang untuk pasti butuh warga dampak bencana penuh sebab bencana banjir bandang di lebak seperti pe
483,yang jebak banjir di tol japek kemarin mana suara proyek kereta cepat jakartabandung jadi alesannya
484,gresik punya mobil amfibi untuk tanggulang banjir
485,sosok satpol pp cantik hijab nama apriliawati jadi viral karena bantu bersih lumpur tebal saat jadi ban
486,siang malam buzzerp dan curut2nya sibuk nyalahin aniesbaswedan karena banjir yang janji jadi presiden bisa atas b
487,saat jokowi pakai jas hujan rp 10 ribu saat tinjau banjirlongsor di sukajaya bogor jas hujan plastik itu biasa dij
488,guys barangkali ada keluarga tetangga kerabat dampak banjir yg butuh bantu sabun mandi aku ken bantu den
489,banjir jakarta bakar hutan di australia mungkin ww iii masalah pulau natuna dan laut cina selatan ria ir
490,lihat kalau nilai d bawah rata rata bukan depan nilai pancasila tapi malah depan ego sektoral norakkk r
491,ini wujud gorong raksasa yg gagas pak jokowi untuk atas banjir bagi daerahsudah pakai ide ini hanya g
492,bersih lumpur pasca banjir di jl halim cawang oleh sdbm jakarta timur
493,telah sempat laku madam pt pln persero nyata kini 6234 gardu sudah fungsi kembali sementara 8
494,ada pemukimanresor villa vh milik grup ap di ciawi bogor bangun mulai 2013 tertib ayo pak
495,kemenhub ungkap proyek kereta cepat china jadi picu banjir tol jakartacikampek buat cebong salah anies jauh
496,widarto72094379 aagym intensitas hujan ngak sampe separoh halim dan ngak sampai 14 lama di halim saja ring
497,sudah paham fungsi hutan bumi mampus kau banjir hutan kau gundul sampah kau buang sembarang memang kau tak
498,ngomong apa ini orang udah banjir masih aja naturalisasi naturalisasi itu omong kosong sudah 2 tahun apa bukti natural
499,ngak ikut class action ke pemda dki aja sekali kami lagi surati sih belum gugat in
500,tiap hari aja dengerin podcast ampe banjir
501,tim advokasi korban banjir dki jakarta kata tidak operasi sistem ingat dini banjir akan jadi poin gug
502,kampung makassar di desain untuk syuting rodiyah yg sebut anies good bener gubernur rasa presiden kata rodiyah m
503,giveaway pulsaovogopay buat 3 orang karena banjir udah surut dan alhamdulillah ip ku smt5 di luar ekspektasi bener
504,banjir jakarta bakar hutan di australia mungkin ww iii masalah pulau natuna dan laut cina selatan ria ir
505,ternyaya jadi presiden itu lebih mudah sebab jadi banjir daripada atas jadi banjir
506,beneran kayak parasite kalau dipikirpikir jakarta banjir dan timpang yang nyata
507,muka twiter banjir facebook banjir na tipi banjir na wa banjir gan dina dompet weh nu garing teh
508,wagimandeep maaf ini sy jg dpt berita gin jd salah byk orang bukn si
509,demokrat nyata banjir tol cikampek sebab proyek kereta cepat bukan hoax htt
510,gur akan closedown untuk hindar semua banjir ritwat ini wslm
511,wisnukunt gue mau dapetin tiket krn gue mau refreshing dari banjir kmrn cape gila cuy ngeruk lumpur nyuci ba
512,horor ini mah
513,di hidup ini tak ada yg abadi dinamis berubah2 impermanence seringkali kita perlu tampar nyata dulu agar be
514,sadar ini main setan knp kalian tdk sekali gugat presiden krn dia sebab bangun ugal2an atau knp kal
515,1 minggu di 2020 banjir jabodetabek bakar hutan australia natuna world war 3 reynhard sinaga wew
516,mungkin banyak yg sirik pada pak anis hingga bilang ga bisa kerja padahal tangan banjir jakarta juga lebih baik pak
517,tito sebut mukim puncak bogor sebab banjir jabodetabek pak kalo bikin statement kordinasi dulu sama buzzerbuzzer m
518,banjir bandang landa jumlah desa di lebak banten di awal tahun 19 sekolah dan 1410 rumah rusak ribu warga ungsi
519,ijazah rusak saat banjir atau sertifikat rumah jangan sedih arsip nasional republik indonesia anri beri
520,anies sebut banyak 85 persen wilayah jakarta tidak landa banjir salah satu wilayah kemang jaksel fakta keman
521,mendagri tito bagi ktpkk saat pantau posko banjir di adegan
522,guys barangkali ada keluarga tetangga kerabat dampak banjir yg butuh bantu sabun mandi aku ken bantu den
523,korban tewas akibat banjir banyak di jabar kok ridwan kamil nggak dibully
524,nenek 71 th tinggal dlm rumah sendiri di green ville blok bn pas banjir kemaren viralkan biar sampai ke mendagri pak
525,namasayasakti halo saya bencana bot untuk lapor banjir di sekitar sila balas dengan
526,saya datang untuk pasti butuh warga dampak bencana penuh sebab bencana banjir bandang di lebak seperti pe
527,enam hari telah banjir anggota dprd dki jakarta datang salah satu daerah dampak di lurah seman kalideres
