,Tweet
0,lembaga bantu heunceut
1,reynaldybgskr halo saya bencana bot untuk lapor banjir di sekitar sila balas dengan
2,banjir jakarta bakar hutan di australia mungkin ww iii masalah pulau natuna dan laut cina selatan ria ir
3,cebong mana loe
4,warga korban banjir siap gugat perintah lanjut lbh saja sebut ini sangat dasar karena tidak ada sistem ingat
5,dennysiregar7 warga dki dampak banjir susah dan gubernur malah sibuk shooting good bener
6,dengan pindah ibukota ke kalimantan rezim sdg ubah kalimantan jadi jakarta dua yg di kalimantan bersiap2l
7,tips bersih rumah usai banjir a thread
8,korban tewas akibat banjir banyak di jabar kok ridwan kamil nggak dibully
9,mantan gub dki sutiyoso 2002 kena banjir yg parah 2007 tapi banjir yg skrg jaman gubernur aniesbaswedan paling ekstrim
10,1 minggu di 2020 banjir jabodetabek bakar hutan australia natuna world war 3 reynhard sinaga wew
11,banjir jakarta bakar hutan di australia mungkin ww iii masalah pulau natuna dan laut cina selatan ria ir
12,twitter please do your magic aku minta bantu ke kalian semua buat temen kampus ku yang kena banjirlongsor rumah ru
13,cc aniesbaswedan hahaha si anies
14,enak tu pas di mentokin didiemin nancep kayak paku jangan pernah harap jeda kalo king top belum crot walau pun
15,chchotimah rizmawidiono hei bong gempa lombok intuh bencana nasional ya wajar masyarakat minta ganti rugi ke
16,foodfess2 nanti jadi sari air banjir nder
17,dodollllll
18,tito sebut mukim puncak bogor sebab banjir jabodetabek pak kalo bikin statement kordinasi dulu sama buzzerbuzzer m
19,alterbasensfw dibantuu biar banjir haha
20,bencana banjir dan tanah longsor 12 daerah sudah tetap status tanggap darurat
21,sadar ini main setan knp kalian tdk sekali gugat presiden krn dia sebab bangun ugal2an atau knp kal
22,gabener gugat 1 triliun tim advokasi korban banjir jakartabeberkan kesalahangubernurdkijakarta aniesyang dian
23,kampung makassar di desain untuk syuting rodiyah yg sebut anies good bener gubernur rasa presiden kata rodiyah m
24,dulu lbh jakarta kritis hadap jokowi lbh jakarta jadi tanggung jawab aksi cor kaki yg tinggal dunia saat demo ganja
25,gubernur bodoh nyerah belum kekeh ngibul sana sini tipu warga dki hingga banjir seperti tsunami makan bany
26,partaiperindo juang untuk anak2 yg kena banjir
27,korban tewas akibat banjir banyak di jabar kok ridwan kamil nggak dibully
28,kemenhub ungkap sebab banjir tol cikampek proyek kereta cepat netizen proyek kereta cepat harus henti karena bi
29,siang malam buzzerp dan curut2nya sibuk nyalahin aniesbaswedan karena banjir yang janji jadi presiden bisa atas b
30,berkalikali saya sampai tak usah banding jokowi dgn gabener dki ndak aple to aple tapi aple to dos foto pres
31,banjir jakarta bakar hutan di australia mungkin ww iii masalah pulau natuna dan laut cina selatan ria ir
32,bubbbbb
33,rickyhf hahahah bayang klo dia tinjau lokasi banjir bandang pake jas ujan gituan trus naik pelampung dari ba
34,1 minggu di 2020 banjir jabodetabek bakar hutan australia natuna world war 3 reynhard sinaga wew
35,aku ada di2020 dan awal banjir dijakarta bakar diaustralia isu world war 3 kasus reynhard sinaga natuna dan
36,tito sebut mukim puncak bogor sebab banjir jabodetabek pak kalo bikin statement kordinasi dulu sama buzzerbuzzer m
37,beneran kayak parasite kalau dipikirpikir jakarta banjir dan timpang yang nyata
38,selamat 3 anak saat banjir orang ayah tinggal di tangerang
39,1 minggu di 2020 banjir jabodetabek bakar hutan australia natuna world war 3 reynhard sinaga wew
40,janji anies emang manis kali ini yg jadi korban janji manis perintah kota bogor dan kali ini wali kota bogor
41,siang malam buzzerp dan curut2nya sibuk nyalahin aniesbaswedan karena banjir yang janji jadi presiden bisa atas b
42,gubernur bodoh nyerah belum kekeh ngibul sana sini tipu warga dki hingga banjir seperti tsunami makan bany
43,banjir bandang landa jumlah desa di lebak banten di awal tahun 19 sekolah dan 1410 rumah rusak ribu warga ungsi
44,banjir bandang landa jumlah desa di lebak banten di awal tahun 19 sekolah dan 1410 rumah rusak ribu warga ungsi
45,banjir bandang landa jumlah desa di lebak banten di awal tahun 19 sekolah dan 1410 rumah rusak ribu warga ungsi
46,sahabatsahabat banser kota cilegon usaha tembus daerah isolir gunung julang kab lebak banten yg dampak banjir b
47,banjir jakarta bakar hutan di australia mungkin ww iii masalah pulau natuna dan laut cina selatan ria ir
48,salam hormat untuk militansi muslimat nu ats abdi pada manusia salut ibu semangat untuk bantu sama
49,kerja nyata pkb untuk korban banjir
50,jokowi pak lihat tuh pak
51,ini surat dari tim advokasi banjir mohon untuk sebar kpd yg kena musibah barangkali ingin minta ganti rugi
52,siang malam buzzerp dan curut2nya sibuk nyalahin aniesbaswedan karena banjir yang janji jadi presiden bisa atas b
53,banjir bandang landa jumlah desa di lebak banten di awal tahun 19 sekolah dan 1410 rumah rusak ribu warga ungsi
54,saya datang untuk pasti butuh warga dampak bencana penuh sebab bencana banjir bandang di leba
55,alhamdulillah
56,dearfiaformulae at least 60 people killed by this flood disaster that probablycaused by the jakarta governor had cut dow
57,95
58,wilayah kemang jaksel jadi salah satu daerah yang landa banjir pada awal tahun 2020 namun aniesbaswedan sempat meny
59,banjir bandang landa jumlah desa di lebak banten di awal tahun 19 sekolah dan 1410 rumah rusak ribu warga ungsi
60,layan darurat israel temu dua wargayang jebak banjirdalam lift di buah gedung wilayah tel aviv selatan sem
61,igjinyoung94 banjir
62,salur air kampung yg guna trashblock nyaring sampah untuk cegah sumbat salur dan banjir
63,tempodotco iya dong anggota dewan datang harus gak ada banjir lg lah
64,rt keras pak rw di rawa buaya jakarta barat ini kesal karena pompa air untuk sedot banjir tida
65,jadi ini hestek gimana dong tito sebut mukim puncak bogor sebab banjir jabodetabek
66,banjir bandang landa jumlah desa di lebak banten di awal tahun 19 sekolah dan 1410 rumah rusak ribu warga ungsi
67,banjir bandang landa jumlah desa di lebak banten di awal tahun 19 sekolah dan 1410 rumah rusak ribu warga ungsi
68,konfirmasi team adi hidayat official kait donasi banjir lebakbanten
69,anies sebut banyak 85 persen wilayah jakarta tidak landa banjir salah satu wilayah kemang jaksel fakta keman
70,anggota tim tgupp muslim muim jelas konsep naturalisasi anies yang dapat selamat jakarta dari banjir tangkap
71,waktu di ilc saya tidak akan jawab kata dengan perkataantapi saya akan jawab tanya sebut dengan kerja
72,banjir bandang landa jumlah desa di lebak banten di awal tahun 19 sekolah dan 1410 rumah rusak ribu warga ungsi
73,korban tewas akibat banjir banyak di jabar kok ridwan kamil nggak dibully netizen karena ridwan kamil adalah main
74,jemput ojol motor beda kata banjir ga bisa nyala sunter mah enak ga banjir jaman ahok juga tempat s
75,banjir bandang landa jumlah desa di lebak banten di awal tahun 19 sekolah dan 1410 rumah rusak ribu warga ungsi
76,jokowi tinjau lokasi banjir bandang lebak
77,jokowi tinjau lokasi banjir bandang lebak
78,mana ya bani kolam yg suka koar2 kaya anjing komplek yg lapar liat nih ferdinandhaean2 dennysiregar7 tsamaradki
79,banjir bandang landa jumlah desa di lebak banten di awal tahun 19 sekolah dan 1410 rumah rusak ribu warga ungsi
80,salh satu tampak pintu manggarai tumpu sampah yang gunung ni bukti nyata pak jokowi benar adanyajgn
81,kemendagriri dprddkijakarta dprddki dkijakarta berani 300 rb lebih petisi
82,update 61 67 tinggal 36419 ungsi butuh saat ini terpal selimut tikar pakai ganti hyg
83,wagimandeep tolol macam apa ini banjir ko minta ganti rugi di jabar dan banten korban banyak knpa kli
84,banjir jakarta bakar hutan di australia mungkin ww iii masalah pulau natuna dan laut cina selatan ria ir
85,salah satu desa yg lewat rawan pks bogor saat tuju lokasi isolir dampak banjir bandang di kp sarongge desa cisarua
86,polling polling
87,siang malam buzzerp dan curut2nya sibuk nyalahin aniesbaswedan karena banjir yang janji jadi presiden bisa atas b
88,banjir tol japek basuki aku drainase tutup proyek kereta cepat salah bang aniesbaswedan l
89,jelas yang sangat baik tentang banjir jakarta dari remaja usia 17 tahun saskia gladys cerah
90,ayooo kisanak kita berpratisipasi jadi rumah kita bagai perangkap air jebak air biar gak keluar rumah dan bi
91,banjir bandang landa jumlah desa di lebak banten di awal tahun 19 sekolah dan 1410 rumah rusak ribu warga ungsi
92,rumah teman saya di villa nusa indah bekas masih belum pulih telah banjir surut nyata lumpur masih tertingg
93,share gugat class action korban banjir dki jakarta di tahun 2020 pemprov dki amp anies baswedan nilai lalai amp tidak
94,foodfess2 anyut bawa banjir kali
95,di hidup ini tak ada yg abadi dinamis berubah2 impermanence seringkali kita perlu tampar nyata dulu ag
96,guys barangkali ada keluarga tetangga kerabat dampak banjir yg butuh bantu sabun mandi aku ken bantu den
97,banjir jakarta bakar hutan di australia mungkin ww iii masalah pulau natuna dan laut cina selatan ria ir
98,anies jumat mana ini venesia udah minggu kena banjir gin kok anies ga liat suaraanies kami warga depok rasa
99,banjir bandang landa jumlah desa di lebak banten di awal tahun 19 sekolah dan 1410 rumah rusak ribu warga ungsi
100,9
101,ndrews1162011 avatarcs999 qshareina sandalista1789 alfiracahyo msaiddidu gmgm psiid ya lu tolol mana a
102,halo sobat polri ini dia tips untuk kurang risiko sakit akibat banjir jaga sehat segera sih diri d
103,halo kami super junior kami turut empat untuk semua yang kena dampak dari hujan deras dan banjir di indonesia kam
104,jokowi semangat pak jokowi sehat selalu buat yg dampak banjir moga cpt pulih
105,banjir bandang landa jumlah desa di lebak banten di awal tahun 19 sekolah dan 1410 rumah rusak ribu warga ungsi
106,kasus jiwasraya mereka coba salah sby kasus banjir jabodetabek3 provinsi mereka salah dan bully anies kasus
107,xx
108,banjir bandang landa jumlah desa di lebak banten di awal tahun 19 sekolah dan 1410 rumah rusak ribu warga ungsi
109,riskan halo saya bencana bot untuk lapor banjir di sekitar sila balas dengan
110,saya datang untuk pasti butuh warga dampak bencana penuh sebab bencana banjir bandang di lebak seperti pe
111,ciluukkbaa apresiasi bijak aniesbaswedan tangan banjir pakar hidrodinamika gubernur luar biasa please jangan
112,banjir bandang landa jumlah desa di lebak banten di awal tahun 19 sekolah dan 1410 rumah rusak ribu warga ungsi
113,barakallah ustadzah umikulsumas cc pksejahtera pksjakarta mardanialisera
114,jangdaraa banjir tempo hr gmn kbrmu
115,akan tingkat intensitas tega hukum kait kelola sampah yang masih belum kelola dengan b
116,banjir bandang landa jumlah desa di lebak banten di awal tahun 19 sekolah dan 1410 rumah rusak ribu warga ungsi
117,banjir bandang landa jumlah desa di lebak banten di awal tahun 19 sekolah dan 1410 rumah rusak ribu warga ungsi
118,banjir bandang landa jumlah desa di lebak banten di awal tahun 19 sekolah dan 1410 rumah rusak ribu warga ungsi
119,viral video rawan fpi pinjam dayung evakuasi korban banjir dicuekin oknum polisi
120,banjir bandang landa jumlah desa di lebak banten di awal tahun 19 sekolah dan 1410 rumah rusak ribu warga ungsi
121,mudzakmodjo halo saya bencana bot untuk lapor banjir di sekitar sila balas dengan
122,banjir bandang landa jumlah desa di lebak banten di awal tahun 19 sekolah dan 1410 rumah rusak ribu warga ungsi
123,beneran kayak parasite kalau dipikirpikir jakarta banjir dan timpang yang nyata
124,maspiyuuu komplek gw di bintaro dari dulu langgan banjirgw bicara pasca banjir ajapenanganan era gubanis lebih baik
125,status tanggap darurat bencana banjir di bekas panjang
126,detikcom tenang pak sampah kan bukan sebab banjir
127,masih tinggi curah hujan yang jadi di jabodetabek buat badan kaji dan terap teknologi bppt ber
128,halo dalam hadap cuaca ekstrem yang potensi sebab bencana banjir yuk kita tingkat ke
129,saya datang untuk pasti butuh warga dampak bencana penuh sebab bencana banjir bandang di lebak seperti pe
130,surprise gubernur aniesbaswedan datang resepsi nikah di rumah yg sempat dampak banjir di rt 0307 lurah
131,salur air kampung yg guna trashblock nyaring sampah untuk cegah sumbat salur dan banjir
132,rt keras bukti bahwa aniesbaswedan ga bisa kerja anak buah tdk bisa tanggung jawab utk men
133,wkwkwkw pekatt
134,siang malam buzzerp dan curut2nya sibuk nyalahin aniesbaswedan karena banjir yang janji jadi presiden bisa atas b
135,1 minggu di 2020 banjir jabodetabek bakar hutan australia natuna world war 3 reynhard sinaga wew
136,kerjasama dgn kemenhub temen temen ojol bantu distribusi bantu ke korban banjir jakarta
137,desa wamendes budimuni98 pasti juga sudah aktif beberapa poskodi beberapa lokasi yang tedampak
138,saya datang untuk pasti butuh warga dampak bencana penuh sebab bencana banjir bandang di lebak seperti pe
139,enih senetron eang gagal orbit di stasiyen tipi tetangga critanye ada sorang warga korban banjir eang mau nuntut tanggung
140,banjir bandang landa jumlah desa di lebak banten di awal tahun 19 sekolah dan 1410 rumah rusak ribu warga ungsi
141,kereeeeen coy aduuuuuuh gustiiiii presiden gua pas banget slogan nya maju bangsa bahagia rakyat
142,banjir bandang landa jumlah desa di lebak banten di awal tahun 19 sekolah dan 1410 rumah rusak ribu warga ungsi
143,beneran kayak parasite kalau dipikirpikir jakarta banjir dan timpang yang nyata
144,saya datang untuk pasti butuh warga dampak bencana penuh sebab bencana banjir bandang di lebak seperti pe
145,beneran kayak parasite kalau dipikirpikir jakarta banjir dan timpang yang nyata
146,banjir bandang landa jumlah desa di lebak banten di awal tahun 19 sekolah dan 1410 rumah rusak ribu warga ungsi
147,presiden kena jas hujan plastik untuk lindung tubuh dari guyur air hujan
148,sutanmangkut0 mataka81760170 ini chat dari kakak sepupu pagi ini sama kondisi rumah pasca banjir 2 ponakan
149,demokrat nyata banjir tol cikampek sebab proyek kereta cepat bukan hoax htt
150,saya datang untuk pasti butuh warga dampak bencana penuh sebab bencana banjir bandang di lebak seperti pe
151,kritik anis di bilang gak mup on ato bela nista agama ndasmu lah aq bukan warga dki cuk bagi jkw menangwowo jadi
152,tito sebut mukim puncak bogor sebab banjir jabodetabek pak kalo bikin statement kordinasi dulu sama buzzerbuzzer m
153,banjir bandang landa jumlah desa di lebak banten di awal tahun 19 sekolah dan 1410 rumah rusak ribu warga ungsi
154,banjir bandang landa jumlah desa di lebak banten di awal tahun 19 sekolah dan 1410 rumah rusak ribu warga ungsi
155,budiyono97 dwiyanadkm ini orang sekolah di mana ya kok lebih pinter anak tk di banding diawoiiii henti memainkn s
156,jabodetabek banjir air kalian berisik tengah mati tapi saat jiwasraya indikasi banjir korupsi trilyunan kali
157,tito sebut mukim puncak bogor sebab banjir jabodetabek pak kalo bikin statement kordinasi dulu sama buzzerbuzzer m
158,turut juru bicara tim advokasi korban banjir dki jakarta 2020 alvon kurnia palma ajak korban banjir utk gugat
159,kabupaten bogor tetap status tanggap darurat bencana banjir dan tanah longsor 2 16 januari 2020
160,1 minggu di 2020 banjir jabodetabek bakar hutan australia natuna world war 3 reynhard sinaga wew
161,tuhan ga sekali kelen gugat gitu biar lebih greget wow nya atau noh gw kasih saran proyek kereta cepat juga sekali
162,saya datang untuk pasti butuh warga dampak bencana penuh sebab bencana banjir bandang di lebak seperti pe
163,normalisasi sungai tdk jalan anggar tanggulang banjir rang pompa tdk kerja maksimal sistem drainase y
164,share gugat class action korban banjir dki jakarta di tahun 2020 pemprov dki amp anies baswedan nilai lalai amp tidak
165,saya datang untuk pasti butuh warga dampak bencana penuh sebab bencana banjir bandang di lebak seperti pe
166,halo sobat polri ikut adalah sebar posko logistik banjir di jakarta bagi anda yang ingin beri bantu berup
167,alir kali ciliwung lintas 34 lurah di jakarta data podes 2018 ada 16 lurah langgan banjir sedih cuma 8
168,saya datang untuk pasti butuh warga dampak bencana penuh sebab bencana banjir bandang di lebak seperti pe
169,stevaniehuangg brkemungkinan org yg ikut menandatangani ini dpt nasi bungkus org yg gak paham soal bhw banjir di
170,orang pinter banjir ini krn normalisasi kita hambat orang bodoh maaf bp ini smua krn air dr selatan tdk kendali
171,diet suku suku paruh susah eh nak jaga makan benar tak susah kalau praktik dari sekarangkita pun tengah be
172,crazgomchun percaya air adalah anugrah dunia tumbuh karna air arti banyak anugrah yg ingin buat tumbu
173,kenal engine water hammer dan klaim asuransi saat banjir usai jabodeta
174,knp lbh dki tdk bela warga jkt dlm kasus banjir nyata tokoh lbh dki nursyahbani katjasungkana adalah anggota tgupp
175,kata anggota tim tgupp banjir jakarta adalah banjir kirim dan siklus 200 tahun klo sdh tau begitu knapa tdk diantis
176,memeidl nitip barang receh syopi gue yang ancur gegara banjir ntar gue balik lagi jangan dipungutin yak
177,1 minggu di 2020 banjir jabodetabek bakar hutan australia natuna world war 3 reynhard sinaga wew
178,banjir bandang landa jumlah desa di lebak banten di awal tahun 19 sekolah dan 1410 rumah rusak ribu warga ungsi
179,tuhan ga sekali kelen gugat gitu biar lebih greget wow nya atau noh gw kasih saran proyek kereta cepat juga sekali
180,ab bekyun ini lg ospek trus kasi muhasabah diri tapi bosen krna dah sering dia mlh kaget liat temen nya pada banj
181,banjir bandang landa jumlah desa di lebak banten di awal tahun 19 sekolah dan 1410 rumah rusak ribu warga ungsi
182,ngak ikut class action ke pemda dki aja sekali kami lagi surati sih belum menggug
183,nih ya kalau mau ngurus surat krn banjir di tangerang urus ke tangerang kota atau tangerang kabupaten jgn ke
184,ab bekyun ini lg ospek trus kasi muhasabah diri tapi bosen krna dah sering dia mlh kaget liat temen nya pada banj
185,edan aniesbaswedan sebar kabar bohong hoax kemang tidak banjir
186,geloraco singapur banjir teu
187,nenek 71 th tinggal dlm rumah sendiri di green ville blok bn pas banjir kemaren viralkan biar sampai ke mendagri pak
188,1 nkcthi 2020 awal tahun memang paling pas nonton film keluarga yg sedihsedih dah panjang nonton ra
189,wacana hapus imb dan amdal demi lancar investasi nilai tidak relevan telah banjir besar terjang jakarta dan
190,kasus jiwasraya mereka coba salah sby kasus banjir jabodetabek3 provinsi mereka salah dan bully anies kasus
191,dari wag rt rw soal pa anis klw ke kemangbangka datang nya hanya ke mesjid mesjid gak banjir oh gitu
192,banjir bandang landa jumlah desa di lebak banten di awal tahun 19 sekolah dan 1410 rumah rusak ribu warga ungsi
193,dewapuci bagai netijen yg berliterasi rendah tuju program sebut benar apa ya nabung air atau kura
194,anyaselalubenar sampe banjir dan kelaperan gtu bilang kata kemang gak kebanjiranlaaahh bijimanaaahhh
195,idcfcindonesia tuanwicak baik min terima kasih banyak saya kira takut hanyut karena banjir makasih ya min
196,banjir bandang landa jumlah desa di lebak banten di awal tahun 19 sekolah dan 1410 rumah rusak ribu warga ungsi
197,diet suku suku paruh susah eh nak jaga makan benar tak susah kalau praktik dari sekarangkita pun tengah be
198,banjir bandang landa jumlah desa di lebak banten di awal tahun 19 sekolah dan 1410 rumah rusak ribu warga ungsi
199,kira2 wajar tdk masyarakat jakarta gugat pak anies karna lalai sehingga terjd dampak yg bgt besar karna
200,selamat datang di negara santuy dmn saat ada banjir bukan ngungsi malah asik2n renang pake pakai bikini
201,antara mereka ada orang penting di majelis ulama indonesia mui beliau komentar nyata lawan anies kerja sistem
202,akan tingkat intensitas tega hukum kait kelola sampah yang masih belum kelola dengan baik
203,drkoko28 kayak banjir di jakarta akan lebih mudah di atas klo pak anie jadi presiden
204,dulu lbh jakarta kritis hadap jokowi lbh jakarta jadi tanggung jawab aksi cor kaki yg tinggal dunia saat demo ganja
205,bersih lumpur pasca banjir di jl di panjaitan oleh sdbm jakarta timur
206,banjir jakarta bakar hutan di australia mungkin ww iii masalah pulau natuna dan laut cina selatan ria ir
207,amat bagai presiden pun jokowi tak mampu beres banjir
208,muslim muin anggota tgupp bentuk wan zigzag betul singkat tangkap air rumah sy banjir tampung sementara a
209,smart dikit gog klo mau nyerang dan buat framing jangan telan bulat bulat pesan katak bina demi nasi bungkus
210,atas banjir jabodetabek dua super volunteer turun ke lapang
211,korban banjir akan dapat uang tunai
212,sangat tdk martabat beda dapat sila tp tdk elok saling ngejek seperti ini mau jadi apa negeri ini
213,moga segera akhir bencana
214,giveaway pulsaovogopay buat 3 orang karena banjir udah surut dan alhamdulillah ip ku smt5 di luar ekspektasi bener
215,kemenhub ungkap proyek kereta cepat china jadi picu banjir tol jakartacikampek buat cebong salah anies jauh
216,dengan semangat tni polri bantu korban banjir di sangihe
217,pardedereza cok banjir
218,ngga ada yg berani nge blame tanggung jawab siapae banjir longsor lebak dan bogor ya
219,kirim 5 mobil bantu barang untuk korban longsor dan banjir bandang di sukajaya bogor biar jalan yg jau
220,yradianto class action wan aibon tim garong untuk poya poya
221,fpi pasuk daerah cigudeg yg dampak banjir bandang
222,banjir bandang landa jumlah desa di lebak banten di awal tahun 19 sekolah dan 1410 rumah rusak ribu warga ungsi
223,hahaha kerja kerja anggota dpr mirip unjuk kerja masyarakat jepang sumaui bemsi lbhjakarta
224,di hidup ini tak ada yg abadi dinamis berubah2 impermanence seringkali kita perlu tampar nyata dulu agar be
225,terimakasih kami ucap kpd anggota dprd dki wabil khusus ibu desiecsari yg mn dpt luang waktu utk berkunju
226,banjir bandang landa jumlah desa di lebak banten di awal tahun 19 sekolah dan 1410 rumah rusak ribu warga ungsi
227,ungsi korban banjir di lebak mulai serang sakit
228,ibu2 muslimat ini sungguh luar biasa militansi tuk manusia tak perlu ragu kawal banser kab lebak ibu2 ppmuslim
229,yohandewa dennysiregar7 yg kerja bu risma lebih baik ketimbang anies aibon angin topan gak bisa di atas dongok t
230,kita suport acara kondang hotman paris untuk layang gugat class action atas banjir di dki jakarta mim
231,saya datang untuk pasti butuh warga dampak bencana penuh sebab bencana banjir bandang di lebak seperti pe
232,tuhan ga sekali kelen gugat gitu biar lebih greget wow nya atau noh gw kasih saran proyek kereta cepat juga sekali
233,banjir bandang landa jumlah desa di lebak banten di awal tahun 19 sekolah dan 1410 rumah rusak ribu warga ungsi
234,beneran kayak parasite kalau dipikirpikir jakarta banjir dan timpang yang nyata
235,demi kunjung korban banjir dan longsor presiden jokowi terobos hujan deras pakai jas hujan rp 10000
236,korban tewas akibat banjir banyak di jabar kok ridwan kamil nggak dibully netizen karena ridwan kamil adalah main
237,normalisasi sungai tdk jalan anggar tanggulang banjir rang pompa tdk kerja maksimal sistem drainase y
238,menko pmk muhadjir effendy terima kasih kepada perintah daerah karena tangan banjirtanah longsor dengan baik
239,warga korban banjir siap gugat perintah lanjut lbh saja sebut ini sangat dasar karena tidak ada sistem ingat
240,gara2 banjir anis bakal di gugat oleh warga jakarta tuntut aja masyarakat hak ko kita lihat berapa jauh dia bi
241,ed dan
242,banjir bandang landa jumlah desa di lebak banten di awal tahun 19 sekolah dan 1410 rumah rusak ribu warga ungsi
243,dari orba reformasi neo reformasi sampai orba 40 kartun ttg sebab banjir mungkin selalu sama narasi orang duga
244,nenek 71 th tinggal dlm rumah sendiri di green ville blok bn pas banjir kemaren viralkan biar sampai ke mendagri pak
245,tito sebut mukim puncak bogor sebab banjir jabodetabek pak kalo bikin statement kordinasi dulu sama buzzerbuzzer m
246,surprise gubernur aniesbaswedan datang resepsi nikah di rumah yg sempat dampak banjir di rt 0307 lurah
247,idtodayco singapur banjir teu
248,jelas yang sangat baik tentang banjir jakarta dari remaja usia 17 tahun saskia gladys cerah
249,diet suku suku paruh susah eh nak jaga makan benar tak susah kalau praktik dari sekarangkita pun tengah be
250,stevaniehuangg gmn klo bikin petisi jg buat gub yg gagal tanggulang banjir klo udh jd presiden kt lihat banyak mana
251,banjir bandang landa jumlah desa di lebak banten di awal tahun 19 sekolah dan 1410 rumah rusak ribu warga ungsi
252,twitter please do your magic aku minta bantu ke kalian semua buat temen kampus ku yang kena banjirlongsor rumah ru
253,saya datang untuk pasti butuh warga dampak bencana penuh sebab bencana banjir bandang di lebak seperti pe
254,banjir jakarta bakar hutan di australia mungkin ww iii masalah pulau natuna dan laut cina selatan ria ir
255,janji anies emang manis kali ini yg jadi korban janji manis perintah kota bogor dan kali ini wali kota bogor
256,anies baswedan gagal tangan banjir dki
257,saya datang untuk pasti butuh warga dampak bencana penuh sebab bencana banjir bandang di lebak seperti pe
258,saya datang untuk pasti butuh warga dampak bencana penuh sebab bencana banjir bandang di lebak seperti pe
259,dokumen rusak rendam banjir tak usah panik kini kamu bisa restorasi dokumen yang rendam banjir seperti ijazah
260,setujuuuuuuuu
261,banjir bandang landa jumlah desa di lebak banten di awal tahun 19 sekolah dan 1410 rumah rusak ribu warg
262,nenek 71 th tinggal dlm rumah sendiri di green ville blok bn pas banjir kemaren viralkan biar sampai ke mendagri pak
263,ab bekyun ini lg ospek trus kasi muhasabah diri tapi bosen krna dah sering dia mlh kaget liat temen nya pada banj
264,banjir bandang landa jumlah desa di lebak banten di awal tahun 19 sekolah dan 1410 rumah rusak ribu warga ungsi
265,akibat banyak ngerokok super nih
266,moga air cepat surut dan sebab banjir yang sering landa bojonegara selesai
267,surprise gubernur aniesbaswedan datang resepsi nikah di rumah yg sempat dampak banjir di rt 0307 lurah
