,Tweet
789,korban tewas akibat banjir banyak di jabar kok ridwan kamil nggak dibully
790,salur air kampung yg guna trashblock nyaring sampah untuk cegah sumbat salur dan banjir
791,musim hujan bpbd imbau masyarakat untuk waspada bencana banjir dan tanahlongsor
792,aagym suruh tabah saat kena banjir jaman dulu langaung melaknant
793,saya datang untuk pasti butuh warga dampak bencana penuh sebab bencana banjir bandang di lebak seperti pe
794,bicara soal warga jakarta yg hak soal ganti rugi ini kata si pria panas
795,nenek 71 th tinggal dlm rumah sendiri di green ville blok bn pas banjir kemaren viralkan biar sampai ke mendagri pak
796,anggi gak boleh sedih lagi karena banjir adalah musibah yg datang dari yang maha kuasa kita harus tetap selalu tabah dala
797,gmn gk banjir parah pompa bnyk yang mati kita liat az tgl 811 ini ktnya ujan extrim amp rob banjir lg pasti
798,banjir jakarta bakar hutan di australia mungkin ww iii masalah pulau natuna dan laut cina selatan ria ir
799,kasus nmax terjang banjir mesin kena water hammer sampai setang piston bengkok
800,big respect buat ibu iti octavia jayabaya bupati lebak lebak yg jauh dari hiruk pikuk berita siapa yg salah hadap banji
801,anies sebut banyak 85 persen wilayah jakarta tidak landa banjir salah satu wilayah kemang jaksel fakta keman
802,knp lbh dki tdk bela warga jkt dlm kasus banjir nyata tokoh lbh dki nursyahbani katjasungkana adalah anggota tgupp
803,banjir bandang landa jumlah desa di lebak banten di awal tahun 19 sekolah dan 1410 rumah rusak ribu warga ungsi
804,saya datang untuk pasti butuh warga dampak bencana penuh sebab bencana banjir bandang di lebak seperti pe
805,sudah paham fungsi hutan bumi mampus kau banjir hutan kau gundul sampah kau buang sembarang memang kau tak
806,twitter please do your magic aku minta bantu ke kalian semua buat temen kampus ku yang kena banjirlongsor rumah ru
807,lbh jakarta pernah serang basukibtp soal gusur jelang pilkada dki 2017 bhkan ikut2an serang ganjarpranowo soal se
808,janji anies emang manis kali ini yg jadi korban janji manis perintah kota bogor dan kali ini wali kota bogor
809,banjir bandang landa jumlah desa di lebak banten di awal tahun 19 sekolah dan 1410 rumah rusak ribu warga ungsi
810,pln123 min tolong dong ini di jln tridarma kenapa mati listrik lagi ya padahal di bawah engga ada banjir dan ma
811,1 minggu di 2020 banjir jabodetabek bakar hutan australia natuna world war 3 reynhard sinaga wew
812,dokumen rusak rendam banjir tak usah panik kini kamu bisa restorasi dokumen yang rendam banjir seperti ijazah
813,yang luap lekas surut lenyap cemas akan hanyut tetap bagi kabar dan kondisi lekas baik segala situasi
814,waktu bencana gempa lombok kadrun rame2 salah pimpin dan paksa segera bayar ganti rugi skrng mereka kata banjir
815,giveaway pulsaovogopay buat 3 orang karena banjir udah surut dan alhamdulillah ip ku smt5 di luar ekspektasi bener
816,bupati itu lari hampir ia peluk dan tenang warga ia tak selfie ia yang gegas nama iti octavia jay
817,kek gilir semarang yang banjir deh
818,jalin silaturahmi ko5 ariekei2171 indr1wh13n4 untukmu25 andhihatta masgr prof3song rennyd2019 sakuralover2 r
819,banjir bandang landa jumlah desa di lebak banten di awal tahun 19 sekolah dan 1410 rumah rusak ribu warga ungsi
820,sambang korban banjir bamsoet beri bantu dan makan sama
821,infopasundan halo saya bencana bot untuk lapor banjir di sekitar sila balas dengan
822,betul hok kata ente ahkirnya wan bebal juga akan laku normalisasi tp tunggu 2 th telah ente ngomong video iniju
823,banjir bandang landa jumlah desa di lebak banten di awal tahun 19 sekolah dan 1410 rumah rusak ribu warga ungsi
824,wacana hapus imb dan amdal demi lancar investasi nilai tidak relevan telah banjir besar terjang jakarta dan
825,twitter please do your magic aku minta bantu ke kalian semua buat temen kampus ku yang kena banjirlongsor rumah ru
826,banjir bandang landa jumlah desa di lebak banten di awal tahun 19 sekolah dan 1410 rumah rusak ribu warga ungsi
827,banjir bandang landa jumlah desa di lebak banten di awal tahun 19 sekolah dan 1410 rumah rusak ribu warga ungsi
828,allahumma hawaalainaa wa laa alainaa baca doa ketika banjir dan turun hujan deras yang ajar oleh nabi stay safe
829,saya datang untuk pasti butuh warga dampak bencana penuh sebab bencana banjir bandang di lebak seperti pe
830,2 jakarta itu gedung semua pohon2 juga sudah ditebangin kalau hujan lebat air mau ngalir mana kalau gak ke sungai
831,nang endonesia ki seng pikir nek ra gawuk tempik mek nek ra yo selangkang berita ngene ki seng payu dol
832,1 minggu di 2020 banjir jabodetabek bakar hutan australia natuna world war 3 reynhard sinaga wew
833,kata jubir rakyatmasa rakyat kena banjir fadlizon diem ajamana suara
834,apbd triliyunan waktu siap2 8 bulan musim kmarau punya teori canggih naturalisasi punya anggar banjir potong yakin
835,bassa47924701 himawan1978 ruhutsitompul iya lucu memang kan sekarang beliau adalah presiden bahkan ini periode
836,kompascom emang ga banjir kok pak kemang emg cuma 15 persen jakarta yg banjir 85 persen di otak bapak
837,1 minggu di 2020 banjir jabodetabek bakar hutan australia natuna world war 3 reynhard sinaga wew
838,1 minggu di 2020 banjir jabodetabek bakar hutan australia natuna world war 3 reynhard sinaga wew
839,saya datang untuk pasti butuh warga dampak bencana penuh sebab bencana banjir bandang di lebak seperti pe
840,banjir bandang landa jumlah desa di lebak banten di awal tahun 19 sekolah dan 1410 rumah rusak ribu warga ungsi
841,nenek 71 th tinggal dlm rumah sendiri di green ville blok bn pas banjir kemaren viralkan biar sampai ke mendagri pak
842,saya datang untuk pasti butuh warga dampak bencana penuh sebab bencana banjir bandang di lebak seperti pe
843,wilayah kemang jaksel jadi salah satu daerah yang landa banjir pada awal tahun 2020 namun aniesbaswedan sempat meny
844,muslim muin anggota tgupp bentuk wan zigzag betul singkat tangkap air rumah sy banjir tampung sementara a
845,banjir bandang landa jumlah desa di lebak banten di awal tahun 19 sekolah dan 1410 rumah rusak ribu warga ungsi
846,aagym innaalillahi jakarta banjir lagi moga nanti ada pimpin jakarta yang rendah hati tak ujub takabur rasa
847,normalisasi sungai tdk jalan anggar tanggulang banjir rang pompa tdk kerja maksimal sistem drainase y
848,giveaway pulsaovogopay buat 3 orang karena banjir udah surut dan alhamdulillah ip ku smt5 di luar ekspektasi bener
849,kepala dinas di panggil polisi urus bisa jadi pidana soal banjir karena ada lalai dan akibat rugi da
850,enih senetron eang gagal orbit di stasiyen tipi tetangga critanye ada sorang warga korban banjir eang mau nuntut tanggung
851,ketua dpd fpi banten khmuhammad fakhrurozy amp istri sekaligus ketua pd mujahidah bela islam banten ustadzah hjdewi nursanti
852,tanam pohon ini untuk hijau dan serap air bagai upaya meminimalisir apabila jadi bencana alam
853,msi ingat dgn anggar siluman utk buzzer sekitar 3 m awal sih gw percaya gk percaya tapi pas liat ini kyknya 3m it
854,carramelf sama anjir mana pas gua banjir lg ga rumah kasi nyokap bokap gua
855,guys barangkali ada keluarga tetangga kerabat dampak banjir yg butuh bantu sabun mandi aku ken bantu den
856,cara citra aniesbaswedan ini sdh terlalu kasar amp norak dia pilih sbg gubernur bukan untuk jadi tukang sampah justr
857,doboooollll
858,anies tidak serius tuntas masalah banjir di jakarta
859,banjir di inggris utara warga evakuasi amp jalur trem lumpuh inggris juga landa banjir ayo para kutil tidak ing
860,hilang stres si moba ajak anakanak dampak banjir main sambil berliterasi
861,ciluukkbaa apresiasi bijak aniesbaswedan tangan banjir pakar hidrodinamika gubernur luar biasa please jangan
862,kritik anis di bilang gak mup on ato bela nista agama ndasmu lah aq bukan warga dki cuk bagi jkw menangwowo jadi
863,banjir jakarta bakar hutan di australia mungkin ww iii masalah pulau natuna dan laut cina selatan ria ir
864,saya datang untuk pasti butuh warga dampak bencana penuh sebab bencana banjir bandang di lebak seperti pe
865,beneran kayak parasite kalau dipikirpikir jakarta banjir dan timpang yang nyata
866,surabaya sudah antisipasi banjir belum jadi pemkot surabaya siap 59 rumah pompa hadap ancam bencan
867,usaha sdh rugi banyak paling jawab si anies cuma bilanh sabar aja pak ini coba kan bangke
868,barakallah ustadzah umikulsumas cc pksejahtera pksjakarta mardanialisera
869,salh satu tampak pintu manggarai tumpu sampah yang gunung ni bukti nyata pak jokowi benar adanyajgn
870,anya gerladine sampe lapar gitu masih bilang ga banjir
871,jenkol kan cegah banjir
872,guys barangkali ada keluarga tetangga kerabat dampak banjir yg butuh bantu sabun mandi aku ken bantu den
873,ciluukkbaa apresiasi bijak aniesbaswedan tangan banjir pakar hidrodinamika gubernur luar biasa please jangan
874,bagi yg rasa jadi korban banjir jakarta 1 januari 2020 ada yg mau advokasi laku class action untuk
875,pantesan buzzerp aniesbaswedan hobi sebar bohong lha bos saja sebar bohong itu sendiri dibi
876,twitter please do your magic aku minta bantu ke kalian semua buat temen kampus ku yang kena banjirlongsor rumah ru
877,peduli bencana banjir di jabodetabek xl axiata salur bantu untuk korban banjir
878,wowww fantastis catat nilai rugi banjir jakarta bisa untuk bangun 19381 desa di indonesia cukup jadi alasa
879,mana kita hari selasa teman2 aliansi ada yg berhari2 ga kerjaada yg ninggalin pacar sama keluarga ada yg sampai
880,twitter please do your magic aku minta bantu ke kalian semua buat temen kampus ku yang kena banjirlongsor rumah ru
881,kasus jiwasraya mereka coba salah sby kasus banjir jabodetabek3 provinsi mereka salah dan bully anies kasus
882,nenek 71 th tinggal dlm rumah sendiri di green ville blok bn pas banjir kemaren viralkan biar sampai ke mendagri pak
883,sahabat tim laraska anri masih beri layan restorasi arsip keluarga kpd masyarakat khusus yg dampak ben
884,nenek 71 th tinggal dlm rumah sendiri di green ville blok bn pas banjir kemaren viralkan biar sampai ke mendagri pak
885,salh satu tampak pintu manggarai tumpu sampah yang gunung ni bukti nyata pak jokowi benar adanyajgn
886,perintah perlu keluar putus radikal untuk cegah petaka banjir awal tahun ulang mau pakai istilah n
887,tidak cukup anies amp gerombol hanya sedia disinfektan utk korban banjir harus jika tidak mampu
888,ikonic help rt beautiful help from hanbin bantu sosial bagi para saudara kita yang kena banjir ulur t
889,serah bantu banjir dari suku dinas bina marga kota administrasi jakarta barat ke posko walikota jakarta barat 0
890,talk show rpk fm 9630 netizen united on air tolong pertama pasca banjir selasa 7 januari 2020 jam 1900 200
891,edan aniesbaswedan sebar kabar bohong hoax kemang tidak banjir
892,kasus jiwasraya mereka coba salah sby kasus banjir jabodetabek3 provinsi mereka salah dan bully anies kasus
893,ganjarpranowo yang penting nggak banjir kan pak kayak dki sono
894,adapun untuk data kembang informasi layan restorasi arsip keluarga khusus bagi masyarakat yang dampak
895,curah hujan tinggi akibat banjir parah di jumlah lokasi di indonesia krisis iklim telah makan korban ji
896,
897,kita mulai dari sini bismillah 300 warga jakarta korban banjir gugat anies jumlah masih bisa tambah
898,gin doang pemdadkijakarta sampah di biarin tumpuk
899,tuhan ga sekali kelen gugat gitu biar lebih greget wow nya atau noh gw kasih saran proyek kereta cepat juga sekali
900,giat pepesofficial kota bekas yg buat posko makan di sekolahsekolah di kota bekas bantu dr tangan2
901,salur air kampung yg guna trashblock nyaring sampah untuk cegah sumbat salur dan banjir
902,makanya jaga bacot lo dennysiregar7 kemarin lo bilang kirim bu risma ke jkt soal banjir pasti beres noh jawab
903,guntur romli edan anies baswedan sebar hoax kemang tidak banjir gubernur dki jakarta anies b
904,tagar rakyat hari ini rugi warga dki sebab banjir tahun ini sangat besar korban jiwa pun ber
905,manxtan pasang nih banjir musim hujan
906,guntur romli edan anies baswedan sebar hoax kemang tidak banjir gubernur dki jakarta anies b
907,sahabat arsip kami juga kolaborasi dgn dinas arsip dkijakarta beri layan restorasi arsip masyarakat yang
908,banjir bandang landa jumlah desa di lebak banten di awal tahun 19 sekolah dan 1410 rumah rusak ribu warga ungsi
909,kaos bikin sendiri mug bikin sendiri mana suara bela rakyat yg kena banjir fadlizon cuiiihhh gilir ke peme
910,anies bilng anak anak senang dgn banjir mereka bisa renang puas bahkan anak dewasa juga bahagia pak tuh pada lon
911,banjir bandang landa jumlah desa di lebak banten di awal tahun 19 sekolah dan 1410 rumah rusak ribu warga ungsi
912,edan ra katok
913,kampret nyaru ahoker yah
914,lur banyak kisah di balik banjir utama bencana banjir jadi lahan empuk utk citra pilpres 2024 kok tega
915,banjir bandang landa jumlah desa di lebak banten di awal tahun 19 sekolah dan 1410 rumah rusak ribu warga ungsi
916,orang klw uda hobi boong ya susah klw dpaksa utk jadi jujur curi masih bisa lu sadarin candu narkoba masih bi
917,restichayah vivacoid jokowi kodok bahagia krn bisa terus selfi amp ngevlog tengah musibah banjir
918,banjir bandang landa jumlah desa di lebak banten di awal tahun 19 sekolah dan 1410 rumah rusak ribu warga ungsi
919,rt keras pak rw di rawa buaya jakarta barat ini kesal karena pompa air untuk sedot banjir tida
920,jrkw19 banjir salah pimpin nye yak
921,jeonmrr kan biar gak banjir makanya air saya abisin
922,banjir jakarta bakar hutan di australia mungkin ww iii masalah pulau natuna dan laut cina selatan ria ir
923,kemenhub ungkap proyek kereta cepat china jadi picu banjir tol jakartacikampek buat cebong salah anies jauh
924,siang malam buzzerp dan curut2nya sibuk nyalahin aniesbaswedan karena banjir yang janji jadi presiden bisa atas b
925,lagi2 sampah yang tutup gorong2 sampah sumbat alir air sehingga naik ke muka masih yakin gorong2 juga mau d
926,banjir pejuh crot dua kali masih kental kayak lem
927,selamat datang di negara santuy dmn saat ada banjir bukan ngungsi malah asik2n renang pake pakai bikini
928,saya datang untuk pasti butuh warga dampak bencana penuh sebab bencana banjir bandang di lebak seperti pe
929,garda wanita garnita malahayati nasdem provinsi banten selenggara bakti sosial baksos untuk korban banjir yang meland
930,tangan banjir anies kerja dengan senyap tanpa gembargembor
931,neh kronologis nya
932,bangzul88 divhumaspolri bamusbetawi ccicpolri kemkominfo aduh ma jakarta banjir krn gubernur sd jelas bu
933,anjarduta halo saya bencana bot untuk lapor banjir di sekitar sila balas dengan
934,wingsforyohan inget dikit banjir
935,kepala dinas di panggil polisi urus bisa jadi pidana soal banjir karena ada lalai dan akibat rugi da
936,jumat 31 kemarin gue cuti kerja dan putus untuk gerak ke lokasi dampak banjir di pondok gede permai jatiasih bek
937,miris buanget denger nya kelas tgupp yg di gaji gede ngasih solusi ny tingakat pak rt bangzul88 hmfaqiha
938,anies sebut banyak 85 persen wilayah jakarta tidak landa banjir salah satu wilayah kemang jaksel fakta keman
939,rawan dari partai nasdem terus laku aksi nyata kemanusian dengan terus bantu saudarasaudara kita yang kena bencan
940,banjir jakarta bakar hutan di australia mungkin ww iii masalah pulau natuna dan laut cina selatan ria ir
941,boezem wonorejo jg kuat dgn pompa yg bisa selesai masalah banjir di kawasan timur dan selatan kota surabaya p
942,nasdemjatengid halo saya bencana bot untuk lapor banjir di sekitar sila balas dengan
943,share gugat class action korban banjir dki jakarta di tahun 2020 pemprov dki amp anies baswedan nilai lalai amp tidak
944,saya datang untuk pasti butuh warga dampak bencana penuh sebab bencana banjir bandang di lebak seperti pe
945,nenek 71 th tinggal dlm rumah sendiri di green ville blok bn pas banjir kemaren viralkan biar sampai ke mendagri pak
946,sampah akibat banjir 1januari 2020 di rawa buaya cengkareng blm sentuh sama sekali ini semua karna tidak becus gu
947,di hidup ini tak ada yg abadi dinamis berubah2 impermanence seringkali kita perlu tampar nyata dulu agar be
948,kemenhub proyek kereta cepat china jd picu banjir di tol kerja proyek kereta cepat indonesia china kcic buat sa
949,ganjarpranowo bassong17781360 siapa mau 3 gubernur ini ridwankamil aniesbaswedan ganjarpranowo duduk dlm 1 acr t
950,kita suport acara kondang hotman paris untuk layang gugat class action atas banjir di dki jakarta mim
951,quote direktur jenderal hubung darat menteri hubung budi setyadi nyata kerja proyek kereta cepa
952,ajar sejarah anak2 sebut kerja paksa brdasarkan waktu rodi kerja paksa waktu kolonial belanda
953,tuhan ga sekali kelen gugat gitu biar lebih greget wow nya atau noh gw kasih saran proyek kereta cepat juga sekali
954,begini nyata data banjir di dki era gub jokowiahokdjarotanies smoga buka matahati nalar dan tanggung jawab yg satuk
955,kepala dinas di panggil polisi urus bisa jadi pidana soal banjir karena ada lalai dan akibat rugi da
956,kanit sabhara polsek matraman iptu upang serta anggota laksana patroli daerah rawan banjir di desa tanah aba
957,ekokuntadhi aniesbaswedan minggu kemarin anies sama warga kerja bakti bersih sisasisa banjir warga m
958,hadeuuuhh spa yg mau jegal junjung lu drun influencer yg mna kta ini rakyat kecil emang udh satu hati nya ma pak
959,halo kami super junior kami turut empat untuk semua yang kena dampak dari hujan deras dan banjir di indonesia kam
960,1 minggu di 2020 banjir jabodetabek bakar hutan australia natuna world war 3 reynhard sinaga wew
961,cuma anies gubernur rasa presiden terus narasi kalian banjir yang daerah luar jakarta justru jauh lebih parah dari jakar
962,guntur romli edan anies baswedan sebar hoax kemang tidak banjir gubernur dki jakarta anies b
963,korban tewas akibat banjir banyak di jabar kok ridwan kamil nggak dibully netizen karena ridwan kamil adalah main
964,ciluukkbaa apresiasi bijak aniesbaswedan tangan banjir pakar hidrodinamika gubernur luar biasa please jangan
965,lihat de lbh kali ini sungguh2 mau class action hadap anies nggak sih lama ini lbh loyo hadap dg anies
966,pemprov banten akan ikan bantu nila 50 juta rupiah bagi keluarga yang rumah hanyut atau rusak pa
967,ketika ngo berava reformasi korupsi itu ada konpers ada cercah harap dari masyarakat yg dampak banjir
968,warganet harap anies baswedan tanggung jawab hadap korban banjir yang jadi di jakarta tagar
969,banjir jakarta bakar hutan di australia mungkin ww iii masalah pulau natuna dan laut cina selatan ria ir
970,banjir bandang dan tanah longsor di lebak ini sebab
971,cara citra aniesbaswedan ini sdh terlalu kasar amp norak dia pilih sbg gubernur bukan untuk jadi tukang sampah justr
972,banjir di inggris utara warga evakuasi amp jalur trem lumpuh inggris juga landa banjir ayo para kutil tidak ing
973,kemenhub ungkap proyek kereta cepat china jadi picu banjir tol jakartacikampek buat cebong salah anies jauh
974,ririnftr0322 halo saya bencana bot untuk lapor banjir di sekitar sila balas dengan
975,banjir bandang landa jumlah desa di lebak banten di awal tahun 19 sekolah dan 1410 rumah rusak ribu warga ungsi
976,banjir jakarta bakar hutan di australia mungkin ww iii masalah pulau natuna dan laut cina selatan ria ir
977,beneran kayak parasite kalau dipikirpikir jakarta banjir dan timpang yang nyata
978,kepala dinas di panggil polisi urus bisa jadi pidana soal banjir karena ada lalai dan akibat rugi da
979,banjir jakarta 2013adalah bencanabanjiryg melandajakarta amp sekitar pada pertengahanjanuari 2013yg sebab
980,nenek 71 th tinggal dlm rumah sendiri di green ville blok bn pas banjir kemaren viralkan biar sampai ke mendagri pak
981,gunromli panggil ryan dmasiv tanya sama ryan dmasiv yg tinggal di kemang kalau tanya sama anies ea pasti sal
982,yg jd korban banjir monggo 300 warga jakarta korban banjir gugat anies jumlah masih bisa tambah
983,warga jabar ga niat bikin petisi n gugat gubernur jabar
984,nenek 71 th tinggal dlm rumah sendiri di green ville blok bn pas banjir kemaren viralkan biar sampai ke mendagri pak
985,gugat class action ajak sahabat2 yang tinggal di jakarta dampak banjir 01012020 untuk gabung bersama2 meng
986,bangpino dianathena tahan banjir dong
